comments,star
应该是大鹏和柳岩迄今为止的大荧幕高光时刻吧 故事不能细究 粗看之下还觉得不错 但人物稍琢磨就会觉得立不住脚 当然这一部分是剧本的问题 不过作为导演的第一部长篇来说 完成度算是很不错了 有趣的是 作为制作人的宁浩第一部片子就是立足于重庆的 作为自己推出来的新人第一部也是 不知道是巧合 还是刻意为之 ,3
柳岩惊艳 尤其是卸妆那场戏 大鹏还是加油吧,3
哪想到有一天会被柳岩塑造的角色感动 张子贤让人恨得牙痒痒 这俩是这部戏最大的惊喜 ,3
表演救了糟糕的剧本,3
时代  很接地气,4
淼淼过于傻白甜和真善美这点 在这个故事里显得非常奇怪,3
男人看到的女人不过是自己的幻想 女人看到的男人也是种幻想 所谓爱情 只是有意识的欺骗和无意识的幻想混合后的衍生物 3 5星给柳岩 ,4
灯球独泣 拔罐泳衣 追车演技 你的名字我的姓氏 主线不合理处确实多了些 但细节和演技都不错 还可以的小人物悲喜剧,4
其实大鹏做导演还是合格的 为什么总要当主演呢 是长得帅还是有演技 貌似都不沾边 这部戏你的演技真的对不起柳岩的彻底卸妆,3
电影里的柳岩是个很可爱的女生,3
罗曼罗兰说看透人生却又热爱人生 是为英雄 何苦为难英雄 英雄大概不过就是不在人前难过  电影自然讲的是各种小人物 因为大抵买票的也不尽是帝王将相 所以乐得看主播也住合租 碰瓷得也会头破血流 笑声就会响起来 然后乏了 等着电影给出更残忍的出路  柳岩面对镜头说出自己三十八岁 了不起 ,4
这部影片比 缝纫机乐队 更接地气 三个主演中 柳岩的演技实在是太惊艳了 从没想到一个靠胸吃饭的美女 居然演技如此自然 也许是岳淼淼这个角色 十分贴切柳岩在未发迹时候的自己吧 也就是说 她与角色完美共鸣了 张子贤的钟科长也演的不错 那种假装正经的气质 很贴合角色 反而大鹏演的过于猥琐了 或者说 为了表现出这个怂包角色 演技有些用力过猛 这部影片 最大的败笔在于剧本无法讲述清楚 岳淼淼为什么会那么爱吴海 没长相没钱财还爱骗人的猥琐男人 按照常理 一个女主播是不可能爱上这样的人设 如果是钟科长与她结婚 就合理多了 ,4
妹想到 整挺好 大鹏沉浸得比之前任何角色都好 除了字幕也没啥英明神武的 就蛮有感触 做人能做自己 最不容易但最幸福,3
主播人物这个时代热点抓得挺不错 但是仍然掩盖不了故事的俗套虚假夸张 人物之间关系的剧情转折在好多爱情作品里都能找到 大部分的戏剧桥段都很做作 看片头监制是宁浩 片子的整体气质也和宁浩的 疯狂外星人 一样就是往疯了玩 包括配乐也是 大鹏这次的屌丝人物形象是很到位了 可是表演还是太过死板就那两招 倒是柳岩的表演富有层次让人惊喜 人物身上的伤痕也很符合柳岩在娱乐圈被当做肉弹的轨迹 要是送礼物能送来柳岩那样的主播 我现在就送 ,2
两星半 大鹏的表演重点是在说服人 是他和观众不相信他的一个对抗 他为角色所做的准备仿佛一直在说 你看 我可以演 但是 我认为这个角色交给其他的演员 完全可以焕发出别样的生命 而不是这种王宝强是的傻根 这个角色没有经由表演的过程从文字到形象 他的表演依旧还是剧本上的文字 柳岩的语言部分十分出彩 脸的方面也贴合角色 可惜关键几场情绪戏都不太到位 这三个角色其实都十分单调 是提线木偶 设定好了之后照着自己的路径一直往下走 缺乏深度和真正的对手戏 这些都是导演的问题 整个影片的悬念陈旧 铺垫的节奏又太长 导致观感局限 ,3
大鹏就不说了 得承认柳岩是个好演员 但距离优秀还差不少 加油吧 ,3
方言加分 故事太俗套 场景太刻意 ,2
笑中带泪 小人物的悲欢离合给人总是带来太多的唏嘘 ,3
故事还可以 骗局闹剧中带着些荒诞感 着力点在小人物从黑暗到光明的转变 喜剧点也挺新鲜 大鹏这回土味演不错 柳岩有种带入自我的表演感 ,3
那个黄衣中二的大鹏煎饼侠 在慢慢消失 从去年的 大吉 到今年的 受益人  我很清晰地看到了一个曾经北漂的二流艺人的蜕变 回归到电影本身 还是美化了真实案件中的残酷性 还是创作地太保守了 杀妻骗保这种事 更适合悬疑恐怖的气氛 ,3
其实剧情的走向早就写好 但柳岩让你相信你会爱上这样一个女人 但是这片子 更反应出了女性在婚姻里的困境 常常感到窒息,3
多一颗心给柳岩那666的塑料普通话 本子还是可以的 ,4
现实中有多少岳淼淼死在那条河里,3
都在说柳岩 这完全是为柳岩量身定做的角色 但是有一位更要提 张子贤 章宇后再发现的一大宝藏演员 一个小小的眼神 嘴角稍微动动 一个娴熟演技的形象就展现了出来 太惊艳 关于直播这一话题的反应很真实 尤其那句 谁现在直播还不打点擦边球  还有青少年看直播打钱这一点的反映 很真实 很讽刺 片中不乏对于 疯狂的石头 的致敬 开头的车主 三宝  火锅店老板 谢小盟  虽然 受益人 小格局的故事注定成为不了 药神 一样的爆款 但不失为坏猴子令人眼前一亮的第三变 ,4
三人戏 放置在宝马车 路边摊 阁楼 直播间 行车记录仪 如何引起动情力 如何欺骗 动真情 博弈 犹豫 悔恨 告白 挣扎 你会发现 这部电影是由三个演员支撑 贴近了镜头 放大了瑕疵 但他们不惧怕被观察被直视被嘲笑被讽刺 他们真实了 所以电影成功了 坏猴子的申奥会带着点宁浩的元素 但他有不同的气质 他是温情的 不疾不徐地处理情感递进 说不定他适合情感驱动为主的文艺片 柳岩奉献了她迄今为止最好的演技 她给到了我柳飘飘那样的感动 她说她38岁了 小狐仙 淼淼 柳岩 三维一体 大鹏很有气度 他让我看到一个主心骨演员给其他演员的空间和衬托 子贤老师在拍完我们剧去拍了这部电影 所以我要告诉全世界 有个宝藏演员张子贤 ,4
如果宁浩及他的猴子们继续批量制作这类看似现实实则童话的故事 我想他大概可以做春晚导演了吧  生存不易 大家都不容易  这是一部经过和谐的现实的镜子啊 ,3
三星半 评分有点低 多给点打到四星  除了画面质感次点  整体气定神闲剧本合情合理还莫泊桑了  柳岩这次是真的好  ,4
get 到两个主演的演技 但救不了剧本  分割线 看预告片get到大鹏的演技 口音都在线 就不知道故事内容如何 还是蛮期待的 宁浩风格电影 就是这女主的名字  emmmm 哎 ,3
又是一个自以为有才的导演炮制出来的 疯狂喜剧  追逐中敲门镜头抄 A计划 没抄好 大鹏和张子贤的重庆话完全没有说服力 柳岩扮演的湖南妹子可信可爱 ,2
 少年的你   铤而走险  这几个月银幕上的重庆一直脏脏的 俨然成为了底层小人物的罪恶之城 ,3
三星半吧 故事很有意思 演技也在线 但是这个简单的骗局就有点魔幻了 还有柳岩这个角色对欺骗的无限包容真的感觉有点假了 大鹏转型也带动柳岩一起转型了么 能看到她们的努力 ,3
这种片本质上和开心麻花那些片一样让人例如我无法喜欢 也没什么真正上的意义 故事和想讲的东西都不用看下去就知道会怎样 就一顿闹 大鹏把脸涂黑弄脏自己弯腰驼背各种小动作也没用 再这样的演法下去 不止演技不如王宝强 样子还不如王宝强看着舒服了 装入戏的那个嘴动作那个丑啊 这戏里就柳岩反而还行 碰瓷不拿小孩命当回事骗婚骗保谋杀总体上令人厌恶中途看着越来越无聊 成功boring me ,2
片子看完虽说喜剧部分做得还不错但没办法让人大笑 没有太多让观众产生情感共鸣的点 也没有更多的关注或延伸到现实内容的东西 三位主演演技到确实都没得说 但岳淼淼这个人物设计有点问题 一个三十八岁的女人按理说应该已经历经沉浮饱尝人世冷暖 还会有这么善良完美的   你要说一个十几二十岁的姑娘被这么骗我还信 还好柳岩这次的表演比较讨喜 不过对于是长片处女作来说 这样的质量也算是合格了 毕竟也不能要求每个新导演的处女作都是药神吧 ,3
有些女孩没有你们想象的那么差 比你们干净多了 ,4
叙事不算乱 就是杂了点 剧本最根本上也有硬伤 闹剧一场 不过柳岩证明了自己的出色,3
为何大部分人只给三星 完全值得四星 ,4
万达点映看的 被预告片骗了 新导演的问题都有 而且还没有属于自己的风格或特点 就最后那场落水戏拍的比较好 总体来说比较烂 看到一半大家都陆陆续续的离开了 不值得一看   缺点和朋友都叨叨完了 此处也不知道说啥 就是很可惜 这个故事发挥空间很大的 差一口气 就是提不上去 ,2
这部电影由真实故事改编 用戏剧的手法把具有社会意义的故事表达出来 期间加以人性的贪婪 单纯 以及悔恨等情感 让整个故事变得笑中带泪 主角的身份也与当下许多漂泊在外的人有着共情感 人物的真实当然很大一部分是建立在演技的基础上 就像淼淼一个典型的湘妹子的形象 柳岩把自身特点和角色融合的很舒服,4
宁浩监制 申奥初导长片的 受益人 虽然是一部有着黑色幽默的喜剧之作 然而这部关乎底层人群的电影既没有足够 疯狂 的幽默讽刺 也没有足够黑色的现实主义共鸣 相反拖泥带水而又倍显牵强的叙事 使一出极具社会焦点 本足以洞悉人性善恶的杀妻骗保案 趋于了平庸 ,3
真的是应了影片那句话 前功尽弃 虎头蛇尾 最后这结局 这啥呀这是 太泄气了   其实影片前半段还真挺不错 接地气又有幽默感 很有宁浩电影中那种小人物的窘迫感 直到小狐仙的出现 影片才真正的热闹起来   假戏假做引起的矛盾冲突点还是挺讨喜的 尽管已经猜到了最后肯定假戏真做的套路 但还是被两人的打打闹闹所牵引 这一切 在我看来全在柳岩 尤其是柳岩直播卸妆和吃辣椒比赛那两段 还是挺动人的 不管是戏外还是戏内 知道真相的观众 着实有点心疼   有的演员真的很努力 可是依然容易看到天花板 比如大鹏 真的很不喜欢影片中他的别扭劲 皱眉 耷拉眼 噘嘴 驼背 虽然很努力在角色上找补 但真的太难受了 这个形象难道不是 铤而走险 中的形象 丝毫看不出人物间的转变 刻意又用力过猛   真的 结局很不喜欢 二星半 ,3
对女性角色善意的无限期待体现了现实对女性的恶意 柳岩这个角色真的姿态低到尘埃里去了 看了会有不适感 然后就是演得比较浮夸 也有闪光之处 比如柳岩卸妆那里 还是挺动人的 ,3
推荐啊 6 7 太低了吧   算得上是一部好电影   柳岩大鹏都很不错  柳岩本色出演  大鹏也算正式成为一名演员了 ,4
真的傻 只存在电影中的爱情 坏人就是坏到底 好人就是傻的天真 最后好人胜利 坏人得到应有的惩罚 JC叔叔明察秋毫 属实正能量  ,3
柳岩  一个男人有100块钱 愿意给你99块 就是爱你的男人      包袱在后头    掏出一本名为 女人不狠 地位不稳 的书  这话是书上学来的   大鹏的幽默感依然到位 属于必看国产片 ,4
黑色故事的内核 但是最后还是有点流俗了 不过在内地审查的大环境下本来也不太可能一黑到底 最后还是真爱无敌 喜欢行车记录仪那段 用最客观的角度来回顾整个事件 大鹏和柳岩都很努力的突破自己 这份努力是很真诚的 希望两位继续加油吧 ,3
比想象中的好一点 柳岩本色表演 37岁终于当电影女主角了 ,3
只顾着看她了 哪还顾得上柳岩,4
不是我说市面上的直男编剧也太自我感觉良好了 都21世纪了你真觉着像岳淼淼这样出身底层见过大风大浪的女主播会轻易被没钱没权没色男屌丝轻飘飘的 对你好 而洗手做羹汤吗 除此之外 剧情不合逻辑的地方还有很多 人物行为动机不能令人信服 剧作水准和宁浩本人操刀的作品完全没法比 多出的一星给本色出演的柳岩 ,3
柳岩的出色是唯一看完这部电影的动力 各方面都差点意思,3
"大多数情节都是可以猜到后续发展的 但是还是会因为一些细节 被轻易打动 是用心在做的电影 我真的是太容易被触动了 理性在哪里 ",3
国外在讲why women kill 国内在演why men kill 贤哥演技在线 3分全给他,3
6 5 女主真的太天真也太可悲了 与其说是被角色感动到倒不如说是被柳岩的表演感动到 或者仅仅是出于为其悲哀 同情 至于男主的悔过坦白 实在是接受无能 表演的话男二最佳 柳岩个人觉得也算走心 至于大鹏 第一次看他表演就无力吐槽 用力过猛不说 油腻到简直没眼看 故事尚可 部分笑料也还可以 最可圈可点的是配乐 不过整体拍的一般般 勉强及格吧 ,3
GOD  ,1
电影的成色就像大鹏崽子那试卷的分数一样 60分上下浮动 剧情非常的套路化 偏黑色带一丝悬疑的喜剧 柳岩的演技突破很大 把直播女的形象诠释得很鲜活也很接地气 故事整体很平庸 像是用公式推导出来的电影 所有的戏剧桥段都能猜到 好在还是讲了一个很完整的故事 川蜀之地的风味很浓厚 让这部片子有一定的观众缘 不过现在市场上这样的片子已经成了主流 所以也没有显得很新奇 ,3
剧情尴尬 笑点生硬 大鹏演技依旧僵硬 导致观众对电影毫无共鸣 这拍出来还不如屌丝男士呢 ,1
三星半 宁浩作为监制 我猜一定也是为这部作品出了不少力 许多地方都透着宁浩式黑色幽默的影子 剧本本身以骗保为主题 结合当下社会上网红碰瓷骗婚等等热点现象 对各个阶层的人物作了一次热炒 当然也看得出大鹏想努力的拓宽戏路 证明自己不仅仅能演喜剧 将底层小人物从恶至善的转变刻画的非常好 柳岩的转型也很成功 尤其卸妆后的独白段落让人产生情感共鸣 打破了以往一贯的花瓶形象 ,4
预告片很带感 看成片有落差 剧本不够好 一切都在预期之中 缺乏新意 拍的也是中规中矩 除了柳岩那个角色稍微深挖了一些 另外两个男性角色都太浮于表面 我本来觉得 不是潘金莲 里大鹏的演技非常惊艳 这一部里却变得很刻意很虚假地去演一个土 倒退的也太厉害了 很多笑点也略低俗 擦黄色笑话的边 虽然要接地气 但我不喜欢这种 还是很看好导演 访谈文章里创作态度诚恳有反思 期待下一部会更好吧 鼓励 3星,3
演员表演比较稳 尤其是张子贤的角色突破可圈可点 一改此前的年轻屌丝路线 中年男的油腻感扑面而来 柳岩面对直播镜头与摄影机的状态非常动人 其个人真实经历与年龄的加入也使得角色更显真诚 但还是无法掩饰设定里女性角色过于傻白甜的问题 整体完成度尚可 算是差强人意没 但剧情有诸多敷衍的地方 既不够黑色 也不够幽默 煽情倒是有余 让人忍不住去想 如果一黑到底会如何发展 两星半,3
柳岩演技好了不少,3
演技棒呆  就是主播设定有点太太太太单纯了吧,3
国产喜剧拍到这个地步 有感动落泪 有黑色幽默 从头到尾看的嘻嘻哈哈哭哭啼啼 人间自有真情在 ,4
观影过程中 不知道有多少次 我期待淼淼才是真正的骗子 比如假表换真表 比如金总上门要八万 比如淼淼也在写大海的名字等等 很多情节都让我在期待淼淼的表现 期待她的骗术更胜一筹  又或者 结尾淼淼与大海联手反杀了江科长 得到了他17套房产甚至更多财产等等  但结局是钻石湾 是大海 是重逢 是未知的发展  这不免让我失望 毕竟电影的开头如此凌厉干脆 双角色交叉剪辑 两人应对谋杀后的警察审讯的演戏 都让我去相信 电影应该是一部彻头彻尾地黑色喜剧  然而 导演和淼淼一样单纯 他真的只想讲一个爱情故事 ,3
 大鹏这些年是否一直尝试成为一个真正的演技派 从那一年改变形象参演冯小刚的 我不是潘金莲 以后 他演过不少形象各异的角色 只是大多都没能被人们记住 不知道这一次他担当绝对主演的 受益人 能不能帮他圆梦 从早年间怀揣音乐梦想北漂 到主持互联网脱口秀节目 再到拍短剧 屌丝男士 开始红起来 再到用两部喜剧片 煎饼侠   缝纫机乐队 彻底证明自己的商业价值 但大鹏似乎并不满足于此 他骨子里似乎一直想证明自己可以有更能够打动人心的东西 这包括他执导短片在金马获奖 也包括他这两年停止导演工作 专心致志演习 希望 受益人 会是一次蜕变之作 电影 受益人 由坏猴子工作室出品 宁浩监制 一部喜剧爱情片 除了大鹏 还有柳岩 和大鹏一样 可感知的是柳岩身上的标签也有了许多变化 ,4
预告片不是已经把故事讲完了吗 ,2
演员们真的蛮出彩 剧情虽有不少槽点 但因为在重庆拍私心加半星咯,4
我们东北人常把海南想象的如同天堂一般,3
居然十分感人 柳岩吃辣椒给大鹏赚电动车的那一段 有些想哭 女人是如此容易被 他对我好 感动啊 可惜就是这一点反而最难 只是有些好没被看清 ,3
柳岩五星 大鹏一星 ,4
导演是不是本打算拍成悬疑正剧 然后又突然改成黑色幽默的 有种拧巴感 各种风格都想混用 又无法梳理成前后呼应的流畅 要么您就惨到底 要么您就笑着哭 别弄成哭笑不得 柳岩那场卸妆戏是全片华彩 大鹏演的那叫一个用力 太使劲就假了 ,2
看了预告片 好奇 再加上是方言 就去看了 中规中矩吧 电影挺热闹 人心还是冰冷的 行车记录仪那一段 真不错 赵英俊操刀的片尾曲 可真好听 ,3
凑凑合合,3
预告片比成片好看系列 本来以为是两个骗子斗智斗勇却日久生情的荒诞喜剧 没想到是一个渣男好女的直男癌土味爱情剧 逻辑欠缺 人物脸谱化 情绪莫名其妙 但是 张子贤让我惊喜 大笨钟这个角色也挺不错 总体还是期望越大失望越大 ,2
浅且俗,2
前领导包场 去之前完全不知道讲了啥所以也没抱期望 结果还挺惊喜的 主要是因为柳岩吧 完成的很好 我的泪点不在卸妆那段 而是在之前争吵后柳岩故作轻松带着讨好的叫大鹏去吃蛋糕的那个瞬间 回来后看了大鹏写给柳岩的信 真心感动 ps因为没花钱 所以后来还是请朋友去看了下 算是支持了吧,4
如果一个男人有只有100块 他愿意给我花99块 这就是爱情 ,4
可能是大鹏进电影界以来我唯一不烦他的一次,4
剧本想要动人深刻 实则略显薄弱 节奏想要有趣独特 实则有点稚嫩 柳岩是最大的惊喜 为她动容了好几次 ,3
差点意思,3
get 不到这片子的点,3
柳岩的角色塑造的好 演的也好 结束直播的独角戏让我差点忘记全片的大量硬伤手滑多打一颗星,3
没有太多 新意 和 想法 的导演长篇处女作 坏猴子土味黑色喜剧 梗都嚼烂了 鸡血和鸡汤闭着眼都叨念得出 至于饱受好评的表演 也只是基本的入戏罢了 柳岩虽然脸僵了 但依然性感 ,3
主角名字起的已经暴露了结局 ,4
剧本还不错 但是拍得太浮夸 台词太假 太过了 前半段是真的辣眼睛 结尾酝酿半天也没能调动情绪 ,2
手表店老板和交警蛮还有意思的 ,3
小代驾就都这么老实善良 宝马男就都这么邪恶 直播女就都这么容易攻破 人物 故事都套路 重庆 直播 代驾 网吧也都套路 要写个现实点的故事 就扎扎实实现实点 要写个伦理寓言故事 就再有趣点 哮喘花不了多少钱 租个房也花不了多少钱 不至于杀人 也导致矛盾不够尖锐 ,3
公映,3
柳岩是亮点 ,3
大鹏的诚意之作 因为柳岩 更加精彩,5
其实没有什么出错的地方 大鹏和柳岩演得很好 就是选择了一个平庸的叙事方式 很多国产电影都是这个毛病  火锅英雄 的成功大家都学学啊 这些年很多导演都在用 直播小妹 的角色 作为间歇性沉迷快手的用户 我觉得这一次处理得还蛮舒服的 ,3
太平铺直叙了 就像抄写课文一样 几位演员也缺少那种人物沉淀的能力 不管整的多邋遢 头发再多变 也仅仅是造型而已 ,2
绝大部分都是不温不火的调性 没有特别渣 但也没法瞎夸 宁浩的监制 也没能给影片带来速度感 最值得一提的大概还数大鹏的演技 演出了小人物的唯唯诺诺感 这个角色可以媲美于 树先生 王宝强 ,2
我还挺喜欢的 人物故事包括海报上那句话 都符合我的混沌式审美 世上哪那么多非黑即白的事 一见钟情不过是见钱眼开和见色起意 能在骗你的过程里爱上你 已在艰难人生里实属不易 ,4
这么好的女人如果你还想杀她那真的不配做人了,4
有多少岳淼淼死在吴大海手里  ,4
剧情太平没有波澜而且欠缺逻辑 笑点和泪点同样不足 唯一的看点竟然是柳岩的演技 ,3
多给个星往上拉一下分 这也有点太低了,4
不错啊 温情的黑色幽默犯罪片 有些地方让我想到大鹏上一部 铤而走险  重庆 相似的父子父女关系 良心未泯迷途知返的赌徒罪犯 但比铤而走险拍得好  选择了三个正确的演员 柳岩演得最出彩 张子贤演科长演得妙啊 网吧的美术场景设计 把地方特色和流行文化结合得也都到位了 除了缺少一个 无名之辈 式的炸裂高潮 以及看守所到海南结局之间的情绪连接以外 基本没啥硬毛病 希望卖得不错吧 ,4
大鹏的演技有点看头 柳岩算本色出演吧 ,4
学宁浩的喜剧风格没有错 但这种风格如果没有扎实的剧本支撑的话 再怎么照猫画虎也学不出什么好结果 本片剧作有些地方实在站不住脚 人物偶尔没有智商 有些情节因果关系衔接不上 最后吃辣椒比赛太俗套 都在夸柳岩 但实际上表现好的还是两个男的 结尾如果是我来拍的话 可能不会安排柳岩出场 让大海躺在海边沙滩上 然后笑着闭上眼  ,3
继路阳之后又一个被宁浩束缚的导演   ,2
那群玩新娘的扑街封杀刘岩 还好大鹏人还不错 不过大鹏演技真的有问题 演小人物就喜欢缩着脖子,5
看到片头发现这个导演我认识哎 还特意去豆瓣看了看是不是重名 发现不是 真的是2005级北影导演系的 然后再往下看 发现电影里的这座城市我认识哎 刚从重庆回来真的饱含太多感情了 这真的是一座有意思的城市 让你走出来了却心还留在那里 电影 不错至少让你看下去了 故事至少是饱满丰富的 作为国产黑幽片 我觉得是值得一看的  中间某段竟然看哭惹 ,4
本来应该是小成本悬疑片吧 最后做成了爱情喜剧 悬疑感不强 节奏上也拖沓 整体看下来有点 电视剧  骗保的理由和动机说不清 就让整个故事变得牵强了起来 我是在这部戏里发现大鹏原来会演戏的 还可以看 ,3
bug太多 就算是虚构的夸张 也是很薄弱的剧情 完全经不起推敲的细节 彰显幼稚情怀 最天真的是 你以为只要对她好 就能换来她的带孩子洗衣服做饭 呵呵太天真 5 3,3
很底层 很落魄 也很表面 结局走向俗套 ,3
下面一硬心就软 下面一软心就硬 好台词,4
呵 谢相公不杀之恩 ,1
完成度还可以 群演好些是 疯狂的石头 的演员客串 有点回忆杀 大鹏很努力的表演 柳岩的人物前半段些许疯癫 但后半段又让人感觉到变化 不过影片后半段的煽情意味太浓了 最大的反讽感觉就是对海南的向往 生活在别处的感觉 ,3
一开始居然还看出了一点 疯狂的石头 的感觉 还以为会来几条很牛逼的时间线 很有时代感的三种人物 保险师 网红主播 代驾 故事倒也简单 亏空公款的保险师利用落魄的代驾好友企图捞一笔 娶一个网红直播做老婆后设计一场命案来骗保 这个本身就不是很高明的谋财害命 还遇到了很多不明朗的局面 比如说这个落魄的小代驾真的爱上了这个看似浮夸虚荣的小网红 柳岩这次演网红也真的是贡献了一次演技 吃辣椒比赛为老公赢电动代步车也真的是感动到了我 她说 我才不稀罕第一名 我要第二名的奖品送给我老公  这种感情实在太套路了 但是看到最后居然还有一点点的感动 因为这样的主题作文能拍成这样 已经很不容易 前几天看了大鹏的 铤而走险  不再贴着屌丝男士和喜剧的他褪去了油腻 仿佛真的有一种小人物的卑微 挺好 ,3
剧情老套 圈人钱财 骗人眼泪 但还是哭了 大鹏演技绝对可以 毕竟短片获奖的人 在角色的塑造上很有心得,3
柳岩职业生涯的高光时刻,4
65 100 这是第一次大鹏刻画平民的类型片没有让我反感 可能是因为柳岩异常写实的表演的关系吧 ,3
又要婊子又要贤妻最后还得要良母 你们对女性的幻想和要求怎么就特么这么高 ,2
2019年最美表演之一      ,5
