comments,star
坏猴子影业的又一部颇具眼光的导演处女作 把黑色电影中常见的 双重赔偿 式骗保故事 嫁接到当代中国互联网直播的现实背景 便是一出充满 呼吸焦虑 的黑色喜剧 柳岩用卸妆做最后一场直播 褪去铅华 还原本真 也直击人心 而最后的开放式结局 也将一切的不可原谅化解 ,4
整体打磨还是不错的 看不太出新导演的青涩 情感点对普通观众很受用 但细看起来巧合和漏洞还是很明显 ,3
三星半 作为商业片 男主太磨叽 中间节奏太慢 看得难受 作为现实主义题材 女主的设定太过天真完美 反派太片面 有野心 有实力 但价值观没有统一 整个片子的基调都有些暧昧 整个看下来现实题材的冲击力和商业的爽感都不到位 男主女表演很棒 总体来说有点可惜了 ,4
把所有的赞美送给柳岩 尽管大部分段落中柳岩的表演还是过于安全 但是她奉献了全片最动情的高光一刻  岳淼淼直播卸妆 我钟意柳岩并非因为她是男人眼中的一个符号 而是她戏内戏外模糊和挣扎的自我 我特别喜欢 煎饼侠 中柳岩的角色在天台告白的一场戏 那是那部聒噪电影中唯一有重量的时刻 是柳岩的表演所赋予的 那刻你很难分清那是角色的台词 还是柳岩自己的心声 这种模糊影像与现实边界的处理在 色情男女 中发挥的更加淋漓尽致 这种真真假假的迷人观感 具有强烈的迷惑性 直播卸妆那场戏中柳岩展现的那种真挚的坦白 让我在这个扯蛋的故事中竟然也唯一相信了这个人物 并且在几场不同的哭戏中也感受到了柳岩表演的层次 我为柳岩感到由衷的高兴 这么多年 浮浮沉沉都走过了 终于在她39岁生日当天迎来了自己演员生涯的代表作 真好 ,2
从现实到梦想 从依山傍水到海天一线 每个人都想着最便利的捷径 ,3
感觉岳淼淼这个人物写的蛮好 柳岩也演绎得不错 相得益彰 ,3
非常棒的处女作 能看出申奥导演调整自己风格的努力 制作雅俗共赏的类型片 大鹏柳岩表演非常棒 除了演员自身天赋能力之外 我觉得也和年轻导演面对明星演员不怵头 站稳立场有效开展合作不无关系 剧本下了苦功 不断创造新矛盾和新需求 看上去编导对直播行业有特别的倾诉欲 可能专门做过调研 但是两位主角内心最渴望什么 推动两人做出这一系列选择 前半部分为了制造喜剧效果 本该深入探讨角色需求的桥段 因为笑料的存在而显得抽离 人物需求没夯实 偶尔会抓不住角色行为逻辑 彭飞老师音乐很棒 各种乐器样样精通  拨弦波尔卡 用得很到位 ,4
非常难啃的骨头 大鹏的好处使得片子距离坏猴子和港片都远 但他和柳岩都是很有标签的演员 这个题材还不足以抹去刻板印象 所以观众愿意为同样出色但更陌生的张子贤点赞 如此苛刻的大环境 如果走的是出口转内销路线或许无论口碑还是票房都会不一样 但拍法也面临调整 只是猜测啊因为即便如此当年 武侠 也没能打破天花板 如果和同为 花满山 出道的另一部片子比较 同样有触动且具有时代感 个人认为最大的差异在于本片的情绪更多来自个人体验 其实触动不足为外人道 但后者的情绪触碰了社会性的痛点 当然这只是题材方面 剧作有些依赖机巧 但成就了名场面 定剪的版本或许出于喜剧类型考虑 很多处都阻断了情绪的流动 有些遗憾,4
完成度真的非常好了,4
 B  影片本身说不上特别新颖 不过是那类踏实说好一个故事的喜剧片 尽管整体情节走向在预料之内 然而角色有几分可爱有趣 情绪上也把控到位 完成度达标  感觉看这片的时机太正确了 上午少年的你下午受益人 压抑的心情也得到了一定的缓解 ,4
继 绣春刀Ⅱ 修罗战场   我不是药神 之后的 坏猴子第三变  公映  这次有宁浩那味儿了 先前不被看好的大鹏演得真好 无须过多的幽默台词 只消几个肢体动作 在女人面前无钱买单的窘迫全表现出来了 让我想起 移民 中遭遇同样境况的卓别林 演得更好的是柳岩 演出了角色的单纯和复杂 有层次 也有立面 在最狼狈的时候都闪耀着光芒 观感很不错 只可惜导演有点玩脱 部分情节太 浮夸  以致于结尾收不住了  另外 重庆真是一块宝地 ,3
我的天那  走出电影院都有一阵阵恶心的后反劲  我的天啊 女主真是个惊天地泣鬼神的38岁历尽苦难永葆初心的盛世白莲大傻逼啊    吐了 ,1
 受益人  杀妻骗保的黑色设定已经事先张扬了凶手和被害者 但凶手的心理动机和转折 以及人算不如天算的环境和阻碍才最能把人吸引在座位上 从犯罪到喜剧 再到爱情 它把类型融合地十分顺滑 在合理的水平线上发挥 湖南腔的柳岩这回是找到了状态 也是演得最好的一次 当然细究起来还是会有瑕疵 但瑕不掩瑜 提名 最佳影片 最佳新导演 申奥      ,4
为了补上百万漏洞 他想到了杀妻骗保险  为了治好儿子哮喘 他迫不得已配合演戏  就这样 他认识了她 并真的喜欢上了她  一边是结识多年的哥们 不能不帮他 更是为了给儿子换一个好环境  一边是真心喜欢的女人 欺骗她已经愧对自己良心 更不能送她去死  普通平凡的他 左右为难 受益人是他 但受益人也并不是他  虽然她也想遇上一个有钱人 但她更愿意等那个只有一百块钱却愿意给她花九十九的人  最终 她还是等到了那个让她做回最真实自己的那个他 自此有了一个家 也有了孩子  外表看似亮丽的她 背后同样有委屈 难处 同样也渴望爱情  有着明显宁浩风格的电影 依旧是小人物生活上的挣扎与辛酸  PS 虽然大鹏 柳岩在表演上仍有些不足 但这次俩人确实有不小的进步 一改人们以往的认知 这是我们该看到 该肯定的地方 ,3
二流科恩兄弟 导演原因 大部分时间并未真正给予演员期待中的转型空间 一切其实仍在按照两位主演过往角色的模式进行安全的微调 没有张子贤的戏份 基本还是以段子小品的亲和力遮掩残破虚假的情节进展 唯一成功的做戏是高潮的三人落水这一全片戏眼 然而之后就立马迎来了更为彻底的逻辑崩坏直到电影结束 ,3
国内犯罪题材的电影都爱在重庆拍  那儿阴暗潮湿建筑复杂  简直是放大版的九龙城寨  让人可接受程度的混乱无序和荒诞故事在那儿发生一点都不违和   大鹏在电影上还是有那么点追求的 很看好他 ,4
完成度与演员不错 但整个诈骗行为的不可信与影片的谜之现实质感太相冲了 ,3
类型套路感过于明显 头十分钟的角色道德初设就像柳岩后背的拔火印清晰到没有回旋余地 以至观众早早早早判定最后的落水重头戏 一定是ta死 而不是ta死 如此一来黑色犯罪这条主线便失去卖点 只能靠三主角 都夸大鹏柳岩其实张子贤表演更优 之间的喜剧 情感互动去抓观众 好在导演在这个维度上还有些手段 ,3
很生气 为柳岩那个角色生气 凭什么啊 人家做错了什么 要遭遇这些,1
带着四五星的期待去的 结果发现还是差一点 演员的表演都没毛病 甚至还有些惊喜 相比之下 剧本的逻辑和说服力就弱了些 意料之中的剧情推进 配不上杀妻骗保的设置 对爱情的过度关注 冲淡了黑色犯罪的元素 可惜了一副犯罪类型片的好骨相 ,3
海 江 淼 角色名字把三个人的关系也带出来了 ,3
全片除了一句 你居然还会深潜 我笑了很久 其他都太 普 通了 这片子哪怕最后是骗中骗都很普通呀因为现在已经9102年了   通常一部电影要么拍的是人 要么拍的是事 如果两个都没能给人深刻印象 那么视觉好看刺激点也可以 但 受益人 不是商业大片视觉特效没有没关系 但影片中拍的人不像人 事不是事 硬伤太多了 ,2
想要关照边缘人群 又用海量喜剧桥段把剧情消解的毫无现实性可言 三人形成的骗保局还是有一定张力在 目标先行使得中段推进过程很疲惫 大鹏无论是谋财害命还是痛改前非的动机都很儿戏 柳岩这次的表现倒是挺让人惊喜的 ,3
影片充满欺骗 却努力教人相信 谋杀骗保是剧情基点 就注定了 喜 要从 悲 里借 编剧利用各种阴差阳错 把控住了情节转折点 三个主演演技在线 特别是柳岩和小狐仙可以说互相成就 直播卸妆和吃辣椒赛后采访这两幕很打动人 可惜角色的智商和三观尚欠打磨 人设也不新 要想从类型片里异军突起 或荒诞忘形 或现实彻骨 这部两者皆非 呈现的形式是折衷 保守的 很多场景的氛围设置都不伦不类 法制结局无可厚非 行车记录仪视角的回忆挺新颖 算导演扳回一局 电影说不上深入探讨了什么社会问题 但依然在鼓励对 边缘 的认识纠偏 也没有刻板说教 至少其态度是诚恳 包容的 这份对特殊职业 特殊阶层的尊重值得我们尊重 希望在这个冷漠的时代 除了相信法律 相信警察 人们还愿意相信爱情 ,3
预估在6 5左右  本来是来看大鹏会不会有惊喜 结果柳岩到是惊喜了一下 角色和她自身的重叠度比较高 所以带入感强 大鹏表演有点点过猛 化妆和木讷感 是在学习黄渤么   影片的黑色幽默还是达到预期 不准确的重庆方言和湖南普通话还是有加分  前半个小时尬了点 后面有所改观 因此全片并没有一气呵成的快感 好在高潮和结局挽回一些好感度   亮点是各种致敬疯狂的石头  ,3
第一款预告最吸引我 正片与之相去甚远 越临近上映 宣传越 动之以情  恰如剧情走向 开场的犯罪片的气氛逐渐被感情戏冲淡 甚至可以说是渗透 我期待的黑色幽默更是再无出现的可能  吴海 岳淼淼  主角人名一语成谶  还真是注水不少 宁浩监制的不一定都是 神  有时只是 人   我喜欢通过行车记录仪闪回的处理 大鹏演的还行 本片的平庸不是他拖的后腿 ,3
一部农夫意淫仙子的戏 仙子又一次被消费 被下凡 而且还是彻头彻尾脱下羽衣为农夫洗手作羹汤的无稽幻想 不要做梦会有辉夜姬下凡给你洗衣做饭带娃了 就算有 下凡也是为了取回羽衣 顺便向农夫后代复仇的 ,1
从跳楼开始失控 底层辛酸的骗保故事 没必要非要遵循宁浩的路子硬往黑色喜剧上靠 普通人的喜怒哀乐 坚持与颓废 细致得动人 仿佛是闹市大排档隔壁桌闲聊的真实往事 柳岩不是脱胎换骨 更像是多年后终于学会审视真实的自己 电影里戴着假面的主播 怎会看不出种种残酷和居心叵测 只是总会有人相信爱情是仅能抓住的幸福 小男孩网吧讨债 柳岩最后一次直播都感人 其实留住这些真已经足够 闹腾的旁支 画蛇添足了 ,3
说到底还是剧本不行 这片要是扑真不怪大鹏 柳岩我觉得害挺出彩的,2
节奏舒服到一匹 就这几个结婚出轨签字的循环 和这剪辑的重叠 简直就是期待到不行   20 2 5 杀妻骗保 不太行啊 倒是里面的重庆地形让我感叹 重庆犯罪宇宙可以走一波 地形打斗爽得一匹 ,2
观感不是很舒服 情节走向看一点就已经心中熟络 大鹏大概贡献了自己演艺道路最好的演技 也促成了和柳岩的CP 对坏猴子略显失望 配乐是亮点 ,2
一个人和要杀她的人过上了幸福生活   ,2
完成度真的非常好了,4
宁浩 坏猴子72变电影计划 之一 口碑 票房双低垫底  杀妻骗保 新编 俩碰瓷诈骗犯 骗婚后杀妻骗保 假戏真做遇真爱 喜剧成分稍弱 多靠演员表演和四川方言加成 三人戏水那段挺逗的 剧作一般 不该走爱情主线 走 三人行 两两成对 又各怀心腹事 的人物关系会不会更荒诞搞笑 本片最大意义反而是挖到了 张子贤 这个宝藏喜剧演员 ,2
想要关照边缘人群 又用海量喜剧桥段把剧情消解的毫无现实性可言 三人形成的骗保局还是有一定张力在 目标先行使得中段推进过程很疲惫 大鹏无论是谋财害命还是痛改前非的动机都很儿戏 柳岩这次的表现倒是挺让人惊喜的 ,3
 B  影片本身说不上特别新颖 不过是那类踏实说好一个故事的喜剧片 尽管整体情节走向在预料之内 然而角色有几分可爱有趣 情绪上也把控到位 完成度达标  感觉看这片的时机太正确了 上午少年的你下午受益人 压抑的心情也得到了一定的缓解 ,4
影片充满欺骗 却努力教人相信 谋杀骗保是剧情基点 就注定了 喜 要从 悲 里借 编剧利用各种阴差阳错 把控住了情节转折点 三个主演演技在线 特别是柳岩和小狐仙可以说互相成就 直播卸妆和吃辣椒赛后采访这两幕很打动人 可惜角色的智商和三观尚欠打磨 人设也不新 要想从类型片里异军突起 或荒诞忘形 或现实彻骨 这部两者皆非 呈现的形式是折衷 保守的 很多场景的氛围设置都不伦不类 法制结局无可厚非 行车记录仪视角的回忆挺新颖 算导演扳回一局 电影说不上深入探讨了什么社会问题 但依然在鼓励对 边缘 的认识纠偏 也没有刻板说教 至少其态度是诚恳 包容的 这份对特殊职业 特殊阶层的尊重值得我们尊重 希望在这个冷漠的时代 除了相信法律 相信警察 人们还愿意相信爱情 ,3
 受益人  杀妻骗保的黑色设定已经事先张扬了凶手和被害者 但凶手的心理动机和转折 以及人算不如天算的环境和阻碍才最能把人吸引在座位上 从犯罪到喜剧 再到爱情 它把类型融合地十分顺滑 在合理的水平线上发挥 湖南腔的柳岩这回是找到了状态 也是演得最好的一次 当然细究起来还是会有瑕疵 但瑕不掩瑜 提名 最佳影片 最佳新导演 申奥      ,4
预估在6 5左右  本来是来看大鹏会不会有惊喜 结果柳岩到是惊喜了一下 角色和她自身的重叠度比较高 所以带入感强 大鹏表演有点点过猛 化妆和木讷感 是在学习黄渤么   影片的黑色幽默还是达到预期 不准确的重庆方言和湖南普通话还是有加分  前半个小时尬了点 后面有所改观 因此全片并没有一气呵成的快感 好在高潮和结局挽回一些好感度   亮点是各种致敬疯狂的石头  ,3
第一款预告最吸引我 正片与之相去甚远 越临近上映 宣传越 动之以情  恰如剧情走向 开场的犯罪片的气氛逐渐被感情戏冲淡 甚至可以说是渗透 我期待的黑色幽默更是再无出现的可能  吴海 岳淼淼  主角人名一语成谶  还真是注水不少 宁浩监制的不一定都是 神  有时只是 人   我喜欢通过行车记录仪闪回的处理 大鹏演的还行 本片的平庸不是他拖的后腿 ,3
从跳楼开始失控 底层辛酸的骗保故事 没必要非要遵循宁浩的路子硬往黑色喜剧上靠 普通人的喜怒哀乐 坚持与颓废 细致得动人 仿佛是闹市大排档隔壁桌闲聊的真实往事 柳岩不是脱胎换骨 更像是多年后终于学会审视真实的自己 电影里戴着假面的主播 怎会看不出种种残酷和居心叵测 只是总会有人相信爱情是仅能抓住的幸福 小男孩网吧讨债 柳岩最后一次直播都感人 其实留住这些真已经足够 闹腾的旁支 画蛇添足了 ,3
看完片子强烈想念疯狂的石头 柳岩演的还挺好的 ,3
很多个想法 一盘散沙 导演 编剧 表演漏洞百出 镜头不成体系 拆开看都是高标准的 放一起就成了拼凑 剪辑也没加上分 除了预告就用过的那段交叉剪辑 人物不可信 自说自话 无根的夸张 表演上大鹏竟然垫底 这个人物难吗 竟然还没有从前演屌丝男士里的小人物稳健 新手导演在指导的时候怕是没敢下手 又或是指导的能力欠缺太多呢 梯坎上面逃窜那里是调度的顶峰了 然而并未见必要性 非要把背景设在重庆而对这里的环境特点和人文特点没有起码的了解 皮毛而已 堪称辱渝 太失望了 ,2
6 10 当钟会计策划把车开下悬崖骗保杀人 踢下脚边的石头教唆大海不能软弱 昭示着人通常没有自己从上往下看的那么硬 许多细节刻画出钟会计的外强中干 吞吐雪茄导致娇喘病发 送医途中看着抓扯皮肤 拼命呼吸的吴悠 冷漠关闭车窗 欺骗人情 但面对大海的涕泪跪下和拿开水烫的暗示 吓得躲闪 目击孙经理血溅挡风玻璃的邪后 倚着栏杆畏缩 从开头室内预演审讯的逼真演技 穿正装从容地走进工作楼和小妹打趣 到讨论填补挪用公款的紧张 呈现出努力模仿社会精英的身份伪装 吴海偷火锅店食材 期盼空气净化器减价的落魄牺牲了诚实 乌烟瘴气的网吧和空气清新的海边楼房代表了物质困窘和物欲反噬 审视了没有非黑即白的现实 可惜逻辑架构不合理 狡诈的钟经理竟然不删行车记录仪消灭罪证 骗淼淼下水意外百出 反面人物的刻意降智消解了荒诞与深刻 ,3
这剧情怎么做到三个人都蠢得这么认真啊,2
兜售地方特色风情无可厚非 贴近社会边缘小人物也可以理解 但是相比国内电同类型片中的优秀典范 诸如 疯狂的石头   寻枪   鸡飞狗跳 等  受益人 只学会了它们的形 但却没有真正领会  至少没有表现出来  其中的精髓 视听语言总体比较成熟 三位主角对角色的塑造也没太大问题 尤其柳岩 算是令人眼前一亮 只是故事最终还是欠缺临门一脚 笑归笑 哭归哭 灯光亮起 观众也就放下了 ,2
剧本有点差 逻辑硬伤太多 柳岩的表演是仅存的亮点之一 ,3
有宁浩的痕迹 没有宁浩的功力 像柳岩做直播拉了俩角儿演一场跨年老套加长版爱情小品 服化道和情绪都有 奈何剧情太烂 喜剧效果不明显 全靠男二张子贤撑着 柳岩还是那个柳岩 静不下来 演什么都像一团火 虽是魅力 成不了戏 大鹏所有的演技都被厚妆盖死 而且来去三板斧 小品拧巴脸 小品拧巴脸 还是TM的小品拧巴脸 观影体验甚至不如你去看喜欢的主播打两把游戏跳个舞唱个歌什么的 ,2
国内犯罪题材的电影都爱在重庆拍  那儿阴暗潮湿建筑复杂  简直是放大版的九龙城寨  让人可接受程度的混乱无序和荒诞故事在那儿发生一点都不违和   大鹏在电影上还是有那么点追求的 很看好他 ,4
导演底子没问题 完成度不错 但是本子的硬伤太多了 钱和时间的问题没弄清楚过 作为一个黑色喜剧荒诞感不足 那种安全地置身事外的感觉就没有了   大鹏这两部转型作品都给自己套了一个特别奇怪的状态 那个嘴太别扭了 比柳岩的腻子还烦   看到把柳岩往水里扔那就感觉不太对了 后面那段自白彻底确定了 这就是一个联动柳岩本人的角色人设 这一点是全片最最最出彩的地方 ,3
1 三星半 宁浩把类型气质捏得死死的 让一个简单的故事多了很多黑色幽默和疯狂劲儿 但还是差点火候 差一口气 2 具体来看  黑 得有些扭捏不彻底 比如结尾三人同掉水里 其实可以处理成非常棒的黑色结局 但却强行用温情盖过 就成了非常一般的处理了 3 喜剧效果还不错 大鹏和柳岩都比较卖力 导演处女作完成尚可 ,3
屌丝的童话 本片远远不如 铤而走险  这世界上哪来的你要杀死她她还对你死心塌地帮你养儿子的人 做梦呢 ,2
剧本太差了 主线就立不住 而且黑色幽默的路子走的很夹生 完全不对路 但是给四颗星是为了给柳岩和大鹏鼓励吧 这俩人我谈不上讨厌和喜欢 柳岩我觉得是那种没天赋但是分外努力的人 能看到她的进步特别特别的大 这种演员值得给加分 大鹏也进步明显 不再是那种屌丝男士或者凸显个人的装逼范儿了 是真的能看出来再用铲子了 也值得一星鼓励 电影本身就两颗星吧 ,4
人物演的再真实 故事是假的 大鹏演的太刻意 柳岩真的很棒 ,3
评分那么高 评论居然说男主是老实人 牛逼 原来老实人就是谋杀犯 诈骗犯啊 ,1
用力过猛 本子太差了 我真的是越来越喜欢柳岩了,2
女人婚后要付出多少的代价 才能得到一个男人想让你活着的一丁点善意 最后还是靠自己会游泳自救 好讽刺 说白了婚姻就是女的靠一点幻想感动自己吗 ,1
电影很一般 细节也是有的 但是谁有那个时间和精力在观影结束以后还去回想和品味呢 ,3
从大鹏开始偷自助火锅的菜那场戏就开始无语 就是一个想当然 不成立的大设定 还有不成立的人设 真的挺失望的 演员的方言也说的稀撇 除了柳岩 为她加了一星  甚至于很多台词都是想当然的方言 就根本没用对 整个故事就显得刻意做作 置景也很想当然 在楼梯中间的火锅桌 奇幻感很重的网吧 前后脚跟 少年的你  同样是重庆取景拍摄 一起上 差距就明显拉了出来 后面一些行车记录仪视点的镜头有想法 但是用起来就很刻意 还有一些镜头 明显有借鉴很多别的片子 ,3
我想起了一两年前我写过的一篇未发表的小说 我觉得我和导演犯了同样的一个错误  我们在想象女主播是怎样的一类人 有时我们高估了她们 可有时我们确实低估了她们  电影的框架没问题 没有令人震惊的反转和追悔莫及 这也很好 在大路上不摔跤就值得夸奖 不必非要去追求那抄近道的惊喜小路  关于表演 岳淼淼卸妆时仿佛说出了柳岩的心底 这种角色才有契合 用演技硬去演出感觉固然是技术的胜利 可是有时也没必要吧  张子贤 我觉得我看过他的戏 优秀  最后的行车记录仪简直了 多半颗星  结尾收的不好 弱了  这电影总感觉踩在了一条线上 就差临门一脚 可偏偏没踢出去 ,4
居然从一部从头到尾都在讲 假的 电影里看到了一丝真 而且居然是从柳岩身上 她傻吗 傻 别人有一百块给她99她就跟着走了 但是也不傻 这是她褪去另一层 光环 回归本身时展现的悲凉底色 从这个角度上来说 对这部片子不讨厌 那篇导演访谈看了 也没觉得申奥作为导演有多自负 也就是实诚 毕竟小机灵确实有不少 但是大智慧 老实说还得日后待挖掘 ,3
不是黑马 只是在困在小格局里的玩笑 演的最好最自然的是柳岩 江科长喝茶吐茶叶时人物的状态就出现 两星给影片认真的玩趣味的时候 剪辑要是能有预告片一半好就可喜可贺 重庆话广东话听的太开心 有时间一定去 大鹏不做评价 看了他近期的两部新片都觉得过于用力 ,2
一般 没有惊艳 也没有觉得哪个主演演技特别好 还觉得两位方言听起来好装,3
7 5分 宁浩的技巧大鹏的内核 小人物在金融诈骗的指使下互斗 高层抱团互助 中层独自挣扎 底层幸灾乐祸互相争斗 坏人偏偏演重情重义 仗义多是屠狗辈 ,4
首映时看了一半被电话叫走了 如今刚补齐 故事完成度挺高的 整体非常工整 但也缺乏惊喜 喜剧方面并不到位 就是在阴差阳错的情节下 本该产出笑料的地方并没有搞笑元素 而是就那么 划 过去了 这说明大部分剧情是导演推进的 而不是情节推进的 略显生硬 好在整体还算引人入胜 得益于叙事流畅和演员的发挥 柳岩角色前后虽有些割裂但瑕不掩瑜 张子贤太棒,3
及格边缘徘徊 摄影很强表演也凑合 剧本是命题作文 先确定了核心 硬去凑 从重庆回来后一日看两部在重庆拍的电影 对比太强烈了 三星里 这个零分那个满分 比文牧野差一截 ,3
宁浩监制顶个P用 剧本有我的高数笔记厚吗 我学二胡的 ,2
刚开始的代驾还挺有市井生活气息 就是大鹏的妆容画得有些过了  紧接着上演的碰瓷就显露出几分造假的痕迹 后面为了骗保的剧情安排更是逻辑性牵强 钟振江自己亲自上阵骗岳淼淼成功率会更高点吧 让吴海执行计划反而显得更不靠谱  结尾大致走向在预料之内 大鹏2019年主演的两部剧情片 铤而走险 和 受益人 虽然我都感觉一般 但观感比他之前自导自演的 煎饼侠  缝纫机乐队 好 ,3
 谎言促成美好姻缘 的经典叙事策略 嫁接重庆地域 在保有 坏  的纯正血统和喜剧基调的轻车熟路外 还做到了道德作祟的笑中有泪 以及对社会底层的关怀 大鹏的转型一步一个脚印 走得很稳 柳岩的演出状态尤其好 能碰到适合自己发挥的角色好幸福 直播卸妆和吃辣椒都戳到我泪点 很真诚 ,3
给柳岩一星,1
在大银幕上看大鹏的脸真是种折磨 水熊虫楞个坏滴很 只有柳岩是为这个角色而生的 景取得都不错 新鲜 结尾行车记录仪镜头很惊喜 大鹏在 铤而走险 里没说的重庆话在 受益人 里说了个爽 同样都是 意料之中 的剧情 后者质量完爆前者 青年导演各自散落的命运远比电影好看 ,3
大鹏柳岩演得倒是还不错 无奈剧本还不够精彩 商业爆米花片 倒是很乐呵 ,3
