comments,star
 B  至少可以保证的是 这第四部绝对不是一部 狗尾续貂 之作 动画分镜 转场 动作与环境渲染等各种高水准制作尽显皮克斯的技术实力 而剧情上的节奏把控和笑点的安插也凸显出皮克斯作为一个老牌动画工作室的资历 关于 自我独立 的主题诠释也相当出色 但 不是说第四部不好 只是前三部所共同构成的一个完整实在是太美好了 而第四部就算再好 也很难不去打破这种完整 我觉得 有些故事 还是让他们留在想象中更好 ,5
2015 03 28 2019 06 21  玩具总动员4 在豆瓣 IMDb 时光网开局评分都高达9 0 烂番茄新鲜度100 开局现在依然保持98 的好评 壮哉我皮克斯 迷粉为此感到骄傲 喜新也念旧的我初看后暂时的 玩具总动员 系列喜爱度排名是 3 4 1 2 作为 皮克斯 所有官方动画长片短片都追看过的我看到诸如 锡铁小兵 据说是 Toy Story 的雏形    等角色真是喜出望外 这些惊喜细节算是给我们这些老粉准备的 小礼物 了    千与千寻  我最爱导演 宫崎骏 监督 我最爱二维动画工作室 吉卜力 出品的我最爱的电影之一  玩具总动员4  我最爱的三维动画工作室 皮克斯 制作的我今年最期待的电影之一 在2019 06 21这天 两部作品同日上映 我如愿在影院前后观看这两部让我都喜爱有加的高口碑佳作 对我这个动画影迷而言是何等的幸福  ,5
很難說前三集的胡迪會願意做這樣的結局抉擇 遊樂園乍看五光十色 然而胡迪巴斯等人在片尾的追逐時 隨處可見滿地泥濘 隨時會踩死玩具的人潮 沒有玩具箱得以照護風吹雨打 更沒有一個主人 這並非是風光選擇 說殘酷些 第二集的博物館還有第三集的幼稚園高級班 可能都比這個處所更舒服 也有機會容納更多夥伴 但是 時光已不能回頭 ,3
拍到第四部还能保持一贯的水准 也只有皮克斯了,5
全程被受虐狂奴才牛仔气得白眼连连 最后算是圆过来了 ,3
看之前几部怎么就没觉得玩具 家长  my kid  you have a kid   嘞 这一部Woody完全搞成老父亲了  蛮推崇女性主义的一部 谁来写写美国主流动画片里女性形象随意识形态动向演变   巴斯光年直接被打成配角了 不过即便是拯救了 恐怖谷玩的不错的 大反派 谁来管那四个Dummy呢  活该被抛弃吗 有些段子做的不错 倒是可以讨论一下这一部里的乌托邦 竟然真建成了 和二三级的伪 乌托邦的话题 ,3
1995 11 22 玩具1 上映 6天后我出生了 20多年后的今天 玩具4 上映 我也迎来了大学毕业 本片某角色类似复联某初代的 谢幕  友情 成长 离别 一直是这个系列传达给我们的 最近都是离别 一直是伤感的情绪 片中的BF拥抱的时候 眼泪还是没忍住 看着坐在旁边看了四年电影的好友 明天也要跟他告别了 ,5
这个系列的剧作思路 冒险片模式 失散寻找被捡到的动作设计 第一部就已经走死了 唯一能延续下去的做戏方法只有不断刷新人物弧光以及由此带起的主题的内部升华 到这部大方向仍然是对的 充分扩展支线丰富B故事C故事以承载人物 虽然完成度良莠不齐分别也不够深入具体 有些细节编剧还偷懒 或者就是编不下去了比如偷钥匙那  像巴斯光年的人物支线就粗糙了点儿 真正不太满意的是 宏观视角的消失以及不断加入新玩具而让老玩具功能化或彻底沦为 背景板  这是不是也是一种喜新厌旧或者对主题的变相背离呢  However 这些并不妨碍 玩具总动员 是唯一一部能让我哭并且从头哭到尾的动画系列 它太成人向了 那些老生常谈的 被创作者一次又一次拿来自我标榜的东西 永远都能戳中我最薄弱也最隐蔽的那点纯粹 ,5
过气ip回炉重造失败范例 故事格局太小 本以为会讨论当代玩具的消费模式和结构转变 殊不知还是那个合家欢核心短片撑长版 消费者依旧会选择熟悉的故事 可这集除了片头已经没有Andy了 别再拍了 ,2
太好看了  为什么 这么  好看     ,5
第四部的故事走向没有什么问题 但总给我一种在不断攒段子的感觉 就如同结尾要塞进四个彩蛋 叙事节奏也是算计着观众在走 跟第三部那种情到深处感人肺腑的调性是没法比了 也没有一气呵成的惊险刺激大场面营救情节 当然这样另起一个故事序列的做法也很聪明 不至于造成常见的狗尾续貂   胡迪在这一部里舍己为人顾全大局的性格放大到了令人生厌的程度 与之形成鲜明对比的就是牧羊女的独立女性光辉形象 新增角色里那对连体活宝加分了 但这一整组新伙伴的人物关系还有待继续打磨 远不如那些老朋友打浑插科来得自然 最后一个彩蛋出现的女版叉叉外形绝对是致敬 超级无敌掌门狗 第四部短片里的杀人面包师女主  JSZ万达杜比 ,4
玩具是孩童无意识的投射 当它被创造 有了名字 并被 定义 为一个玩具 它就有了灵魂 它将成为unique 不再成为野生 废弃的状态 而 玩具4 中则提供的就是这样一个内容 folky希望回到纯粹客体的状态 去除掉bonnie投射过来的无意识之灵 但是它失败了 最终接受了这一事实  但是 就在影片的结尾 当胡迪与宝贝公主的求婚 并选择离开Bonnie一家时 这个系列最终以颠覆自己最初提出来的物属性世界观告终 也即 玩具的快乐必须来自与主人的青睐   离开家往往是孩子的成长仪式 同样也是银幕外这些观众的必经之路 从这一点看上去 这部影片似乎仍能自洽 但是就folky和胡迪的两种姿态 两种截然不同结局看来 这部影片则是一个悖论 究竟一个客体是否可以摆脱其宗主的投射并成为主体 ,3
玩具理想的立意乏味而偏执 强行控制房车的段落设计愚蠢突破天际 给恐怖分子出身的雀斑找主人的桥段简直想吐    说到底 整个系列都很弱鸡 ,2
系列最差 人物弧光写得稀烂 毫无必要的续集,2
我看那场只有三个家庭 我一个单崩的 小孩子都很小 家长很有素质 观影前提醒不要讲话 过程中孩子一直在跟家长互动 跑来跑去我也没制止 也没觉得吵 还挺有氛围的 就当在他们家客厅看电影了 唯一区别可能是主题歌一响起他们都笑了 我哭成张亚东,4
在电影院里暴哭 ,5
好了 就是这样了 一个系列的完结 如此完美中的完美 哪怕是最乐观的皮克斯粉 也不能说没担心过这部续作吧 可是皮克斯就是又一次做到了 它让我笑得像个小孩 哭得也像个小孩 只想拿出架上落灰的玩具 对着它们挨个说声对不起 那些美好的回忆 原来都不曾忘 别看影评 别看预告片 什么都不要看 你只管走进电影院 去拥抱未曾老去的自己吧 ,5
三星半吧 这一集杂乱得很 玩具有了自我意识 但他们又必须得到小朋友宠爱才有意义 又不像机器人还能自我追问 所以这个题写到这就没法往下推了 这一部也是整个四部里最纷乱的 就像老宫的 起风了  能很明显地看到几种创作意识在里头打架 尊重一个伟大的系列最好的方法是在它最美好的时候完结 而不是守着IP持续捞钱 玩具系列如此 星战系列亦如此 哎  ,3
一次 在巴斯光年按下胸前的按钮时 听到的声音是 打开舱门  这是在致敬斯坦利 库布里克导演的 2001太空漫游  后者中的原句是  大卫 波曼打开舱门 哈尔  ,3
就  挺一般的啊 9 2分绝对是虚高 美国人的国民动画一直不是我的菜 感觉2010年之后的皮克斯创作能力严重下降 大部分动画都是重复自我的续集 行行好 别拍续集了 来点原创吧 翻了下第三部的评论 我写的是 perfect goodbye  呵呵,3
100昏100昏100昏   保持这么萌这么有爱这么有情谊这么有梗拍到12我都会一直追着看的    呆萌呆萌的机车公爵居然是奇诺李维斯配的   本色演出咩 ,5
长大了也不要忘记那些陪你一起长大的伙伴 快去打开那个尘封的柜子 他们一直在 快     ,5
挺适合组织事业单位和高校的退休人员观看的  要知道地球没了谁都照样转 发挥余热不一定要在原单位 跟一群老伙伴一起发挥点社会价值或者谈个黄昏恋 都挺好哒  ,5
本来觉得3很难超越了 但4出乎意料的好看啊 幽默感和温情并存 几个沙雕角色太嘲了 尤其是兔哥和达鸭 吐槽一句 爸爸到底做错了什么要受到那样的惩罚啊哈哈哈,5
长大了也不要忘记那些陪你一起长大的伙伴 快去打开那个尘封的柜子 他们一直在 快     ,5
黑人配音的那俩逗逼哈哈哈哈,4
挺适合组织事业单位和高校的退休人员观看的  要知道地球没了谁都照样转 发挥余热不一定要在原单位 跟一群老伙伴一起发挥点社会价值或者谈个黄昏恋 都挺好哒  ,5
本来觉得3很难超越了 但4出乎意料的好看啊 幽默感和温情并存 几个沙雕角色太嘲了 尤其是兔哥和达鸭 吐槽一句 爸爸到底做错了什么要受到那样的惩罚啊哈哈哈,5
前三部留下的泪 变成了第四部脑子进的水 胡迪这一部的性格转变让第三部结尾的潸然泪下变成一个笑话 巴斯光年更是全程掉线 两大主角莫名其妙 牧羊女的性格设定倒是非常符合当下的潮流 叉子的人设更是踩准了时代的脉搏 可这跟整个系列的内核有多违和 反派盖比前半部分真的在挑战带孩子观众的视听极限 后半部分怎么就突然成了可怜人收获一大波同情 最后走向新天地的玩具都有残疾 完好无损的反而有了主人和家 前三部是正传 这一部只能说是同人 看完电影走出影院心情十分复杂 突然理解了星战老粉看完星战八的沮丧心情 ,1
玩具是孩童无意识的投射 当它被创造 有了名字 并被 定义 为一个玩具 它就有了灵魂 它将成为unique 不再成为野生 废弃的状态 而 玩具4 中则提供的就是这样一个内容 folky希望回到纯粹客体的状态 去除掉bonnie投射过来的无意识之灵 但是它失败了 最终接受了这一事实  但是 就在影片的结尾 当胡迪与宝贝公主的求婚 并选择离开Bonnie一家时 这个系列最终以颠覆自己最初提出来的物属性世界观告终 也即 玩具的快乐必须来自与主人的青睐   离开家往往是孩子的成长仪式 同样也是银幕外这些观众的必经之路 从这一点看上去 这部影片似乎仍能自洽 但是就folky和胡迪的两种姿态 两种截然不同结局看来 这部影片则是一个悖论 究竟一个客体是否可以摆脱其宗主的投射并成为主体 ,3
三星半吧 这一集杂乱得很 玩具有了自我意识 但他们又必须得到小朋友宠爱才有意义 又不像机器人还能自我追问 所以这个题写到这就没法往下推了 这一部也是整个四部里最纷乱的 就像老宫的 起风了  能很明显地看到几种创作意识在里头打架 尊重一个伟大的系列最好的方法是在它最美好的时候完结 而不是守着IP持续捞钱 玩具系列如此 星战系列亦如此 哎  ,3
臭鼬车太酷了 想过独行侠牧羊女的生活 胡迪你要加油 不然要配不上帅气女朋友啦 ,5
系列最差 人物弧光写得稀烂 毫无必要的续集,2
C   剧作上依然有第二部转折过硬且人物更加功能化的毛病 但有趣的是用一路规整且最终妥协的主题表达依然做出了不少摇摆的部分 虽然这仅仅是一种更加明确区分之后的不确定 但至少可以在微调的大框架之下做得更老少皆宜 七个小时之内能看到这堆玩具终于不用异口同声哭爹喊娘地找主人真的有几分欣慰了  ,4
特别特别好看 我太喜欢那三只羊了 另外惊悚和爆笑同时而来简直是让人意外啊 感谢小鸡和小兔子 最后一定一定要等彩蛋 最后一秒一直到皮克斯台灯经典那段都有惊喜 ,5
真开心长大后能看到玩具总动员4 我长大了 再看时玩具也更多面了 里面的人物也更立体形象了 爱你们 ,5
几天前看的 忘记标注 因为又把同系列的其他电影都看过了 一个最大的变化 玩具中为数不多的女性形象 Bo 前面几集都是非常典型的被刻板化的女性形象 在这一集里 她是那个勇敢 爱与正义的化身 她过着一种看似流浪的生活 却在不断的探索自我 个人边界与这个世界的圈层 是她带着 Woody 跳出了 陪伴孩子是我的使命 价值观 Woody 大可以不停的更换孩子 感受到被人爱 被人需要 被同伴认可 却始终没有看到自己 这就是长大吧 ,5
一次 在巴斯光年按下胸前的按钮时 听到的声音是 打开舱门  这是在致敬斯坦利 库布里克导演的 2001太空漫游  后者中的原句是  大卫 波曼打开舱门 哈尔  ,3
7 8分 玩具这个IP已经快25年了  飞向宇宙 浩瀚无垠 的台词早已不是孩子们的专属 因为当年的小孩已经长成大人了 主要配音的汤姆 汉克斯也随着这个IP变老了 他从自己39岁开始配胡迪 到今年已经63了 至少声音变老了 哈哈 而已经拍到第四集的 玩具总动员 的故事性无疑是系列中最曲折的 也是最惊悚的 似乎借鉴了 鬼娃回魂 的创意 而且还添加了 器官 移植的作料 有个不太情怀的地方 那句 浩瀚无垠  在最新一集的中文字幕是 宇宙无限  这个有点儿不照顾二十多年老玩具迷的意思啊 这片目前在豆瓣是系列最高的9分 不管有没有情怀都值得一看 ,4
就  挺一般的啊 9 2分绝对是虚高 美国人的国民动画一直不是我的菜 感觉2010年之后的皮克斯创作能力严重下降 大部分动画都是重复自我的续集 行行好 别拍续集了 来点原创吧 翻了下第三部的评论 我写的是 perfect goodbye  呵呵,3
比预想得好 不算前三集粉丝 也被圈粉 俩毛绒玩具太逗了 美帝动画的时代精神还真是与时俱进 从Inside out开始 傻白甜 忠诚 愚忠 退居二线 对负面的直视与理解相当成人化 仅就这一点而言 Pixar和迪斯尼的创作者对于全年龄向作品的幼齿化还是高度自省的,5
Wow给我看哭了 两次 太厉害了 24年了 每一部都是精品简直不可思议 最后的告别那么悠长我们以后还会看到伍迪吗 Keanu的角色是为他量身定做的 几乎是某种致敬 大心 要看到最最后的Pixar logo哦 ,5
有了媳妇忘了兄弟 牵手放逐当垃圾 我们当代青年真是太棒了 ,4
伟大的续集 如对生命的礼赞 我们为什么是活着的 又该怎样选择自己的生活 ,5
在 玩具主人 视角 曾经我们以为陪伴了这么久的小主人安迪成长也意味着这些玩具故事的落幕 希望第三部的 完满结局  如同所有童话中那样定格在最美好的一刻 但现实就是 当玩具们的小主人一次又一次的长大必定也要经历一次又一次的离别 没有第三部煽情感人 却有着前三部 都没有突破的 极其出色而伟大的切入点 安于平稳 忠诚 善良 自我认同 个体觉醒 归属感 追逐更大的世界  最重要的是 你可以选择自己想要的人生 每个新玩具都有对自己身份不一样的看法 而直到最后 电影也没有对他们的决定有一丝偏颇倾向 没有谁对谁错 各自求仁得仁 我好喜欢牧羊妹阿宝   游乐园重逢那一段超级精彩  ,5
哭得比电影院里每个孩子都凶 第一次是胡迪鼓励盖比去安慰迷路女孩 那句 这是身为玩具的职责 不仅使命感炸裂 更教会了银幕前的孩子们 善良是可以传递的 第二次是巴斯光年说的那句 她会明白的  不是宝贝 而是 邦尼会明白的  兄弟就是无需多言心灵相通 编剧真的把每个转折点和前后人物弧光写得很巧妙 面面俱到拳拳击中 尤其是盖比刚坏事得逞 胡迪却愿意倾囊相助这一段 出了电影院还在哭 想起之前看3的时候哭成泪人儿的圣诞夜 回家立刻把娃娃们一个个亲了一遍摆放在床头 night  night ,5
今年流行告别和撒狗粮 连玩具也不例外 ,5
曾几何时 我想像胡迪那样 能成为照顾好一切的人 可是最后 我只是盖比 很用力在渴望 却适得其反 那么 不如最后放手吧 ,5
还是依旧生动有趣且感人 但在我心中 第三集是完美的收尾 本作皮克斯依然玩出了亮点 玩具 走自己的路 也是G点十足 但不如第三部有力量 最爱那一对毛绒搭档 导演估计看过不少B级恐怖片,4
3 5  稍许剧透 娱乐性体现在开篇不同类型风格的转换 动作喜剧冒险惊悚黑色收放自如 而本集的核心角色是牧羊女 她首先引出了主题 即到底是甘愿当孩子身边被驯化的伴侣 还是成为完全自由的存在 虽然电影本质规避了由此引发的可能性思辨 简单处理成个体选择的问题 但还是点出了玩具世界的意识形态冲突 第二作为女性角色 她从一个被规训的家养玩具 蜕变成战斗女神 显然有点迎合女权之味 虽然以前暗示过她狂野的一面  但影片在这点上基本找到了平衡 没有显得太突兀 第三她使胡迪选择面对命运的巨大转变 所以当他放弃某物件后 实际是断绝了与人类交流的唯一方式 再看其动机与困境 结局也就顺理成章了 缺陷是叉叉功能性太强 这个凭空而来的角色始终没站起来 一些桥段的衔接也失掉了曾经的灵气 BTW 约翰银手今年真的很活跃 ,4
系列笑点最多的一部 但也是哭的最惨的一部 从TS3开始 迪士尼就不再专注于创造美好的童话 而是在童话中展现着那些成长中必要的伤痛 离别与转折 它不再美化那些人生中的变故 而是让观众在故事中学会珍重 学会放下 收获迈入下一个阶段的勇气 再见 老朋友 ,5
价值观实在难苟同,2
从 一个不再被宠爱的我如何拯救一个只想当垃圾的你 到 每一个任前主人都是不能被提前的EX  那些玩具关于自我认同自我寻找出路的啼笑皆非的往事又浮上心头 牧羊女这个角色的再次包装顺应了独立女性形象的热潮 胡迪再也不能掌控全局把每一个需要爱的玩具都带回家 陪伴一个孩子不是每个玩具的最高荣誉 胡迪从陪安迪玩 陪邦尼玩到成为 流浪玩具 自己给自己找乐子 用梅梅的话说 皮克斯赋予了玩具人权 当他们拥有了自我意识 这故事也许就已经是最完美的结局了 泪点全部贡献给盖比娃娃了 ,5
没有了以前的温馨和感动 整个玩具世界的世界观颠覆了 ,2
是我长大了还是怎么的 看了没有什么感觉 第三部才是最好的告别,2
不及格 皮克斯的故事也越来越不用心了   无论作为单集还是完结篇都不及格 对今年的动画电影都大失所望 记忆中上一部比较好的还是驯龙高手3 不喜欢胡迪大电影 但喜欢tom hanks的声音的沧桑磁性 喜欢巴斯光年 尤其下巴那个小螺旋 这集价值观混乱强行凹转折一波三折 这种我是 的 接近结尾多次响起的煽情音乐却让我无比冷静  条件反射的滑出一两滴泪 但完全不感动 最爆笑的还是控制车爸爸进监狱hhhh PS 最后纪念谁 ,2
皮克斯近年最佳 自我意志的主题很高级 Toy系列从1到4逐部进化至此 妙哉 Bo也是最近几部好莱坞大片中的女性角色最佳 这才是高级的塑造方式啊敲黑板 别再嘴上挂着女人男人喊些苍白的口号了 ,4
玩具存在的价值仅仅是忠诚的为主人服务 和前三部比 第四部试图在内容深度上扩展 去弥补情感力量的不足 因为前三部已经把那种纯真与爱做的很满了 后安迪时代要让观众对角色重新认同要做的更多 编导很聪明地回避了这个问题 通过加入更多全新的角色来填充这个关于自由的冒险故事 第三部离别的伤感也变为了第四部重新开始新生活的憧憬 但这样让从第一部开始追随的老粉们心有不甘呀 虽然新玩具更炫更拽 但老玩具完全成为配角实在有点让人失望 老玩具们虽然梗也玩的差不多了 造型也很老土 但毕竟在前三部中让人感动得痛哭流涕的 这么说成配角就成为配角了 最后牛仔既兼顾了忠诚有实现了自由 真是太主旋律的俗套了 很难让人再有前三部的那种感动,4
开场没多久胡迪一句叫错的 安迪 就把我的泪水吸引出来了 迪士尼这次用 忠诚 告诉我们 除了爱情亲情友情 还有一种坚贞叫做对主人的爱 胡迪是4集里的主线 在最后用一个箱子呼应了第一集劝巴斯一起的桥段 而这次他累了 他选择了自由 与那个曾经给他一脸唇印的绵羊女 因为作为玩具他也需要潇洒也需要尊严 也预示这个玩具总动员真的要完结了   胶 了个朋友  他不会再lost 被遗弃 迷路  两个语言梗 还有手牵手的毛茸茸两兄弟 咯咯的小房子等 迪士尼用这些小细节小可爱告诉了电影同行何为业界良心 玩具总要找到主人才有意义 就像盖比最终找到了归宿 迪士尼也希望他们的电影一代一代被小朋友需要着 让所有人都总有童心 ,5
中二兔哥达鸭逗逼组爆笑全场 这集居然还开刷 鬼娃回魂  也是够Cool 冒险与惊悚 离别与不舍 慰藉与温情 一部优秀的卡通片就是能这样让你开怀大笑 动魄惊心后又依依不舍 感今怀昔 ,4
最后没有Toy story 3哭得惨烈但是也泪目了 这可能对伍迪来说是最好的结局 也是最好的开始 ,4
新晋几位弟兄 废柴叉 刻薄羊 暴力兔 僵尸木偶 都表现不错 女权时代 金刚芭比和雀斑小反派也算亮眼 整体气氛依旧团结友爱 温暖明亮 主旨老套但演绎动人 多年老友都有告别日 每个人均曾经历迷失 寻找自我的道路殊途同归 ,4
时隔多年再见 他们换了主人我也变了心境 讲了很多人生议题 孩子长大疏远父母 被抛弃的孩子的寻家之旅 作为玩 工 具自诞生起的附属关系与个体独立的身份纠葛 无用与有用之间的微妙转换 存在的意义      等等 其中最有趣的是玩具与主人互为 父母 与 孩子 的关系 在玩具身上这两个身份的并置体现的更明显也更深刻一些  所以虽然我坚定的认为这个系列停在第三集是最完美的 但也觉得这一集有它存在的意义 当做了一辈子忠诚警长 负责监护 的胡迪的发音盒被拆除 他的使命终于完成 脱离了机械心的它也终于听到了作为一个独立个体的自己的inner voice 做出了重要的选择 作为这个系列的脸面 当玩具们告别胡迪时 就像所有人在跟这个系列说再见 所以虽然预留了继续续集的空间 但就让故事的叙述停在这吧 ,4
前三部是在玩具与主人关系的议题上不断纵向深化 第四部是在玩具自我选择的议题上做横向拓展 也许没有第三部感人 但维度是更广的 最难得的是 在那么完美的第三部后还能交出一份这样的答卷 非常佩服了 一些幕后 皮克斯这五年做了62版 玩具总动员4  10场试映 花60 160个小时才渲染出一个画面 所以想对张嘴就说皮克斯只想开续集赚钱江郎才尽的人说 你也许都已经不是你了 皮克斯还是皮克斯 ,4
从前的皮克斯有趣是皮 内里是暖 现在暖还挺暖的 但越来越无趣了 可能我不该拿玩具3做比较吧 ,4
在环球 蓝天 梦工厂 甚至迪士尼自家的动画系列长片一步一步逐渐走低的情况下 皮克斯的 玩具总动员 系列却能一部比一部精彩和感动 我想这就是作为一个皮粉的礼物和自豪 ,5
有深度 有思考 有泪点 有感动 结尾居然还出现了反转 还有4个小的彩蛋 我其实不太记得自己是否以前看过这个系列 所以基本上是把它当成一个全新的片子在看 情节非常的饱满 主角内心里复杂的情绪变化 尤其是玩具伴随人成长了之后 他已经完成了他的使命 可是对于小主人又有一种放不下的那种牵挂 你明明知道你应该离开 可是你就舍不得走 这其实是一种非常让人为难的选择 在整个片子的叙事过程当中 我们可以说这是一种情感上的牵绊 因为这种牵绊而产生了强大的力量 我们也可以说 这其实是为了最后的放手做准备 在这一点上特别像是父母对待孩子的一种感情 虽然我舍不得 但我迟早会放手 因为我还要有自己的生活 这个片子非常让我意外 虽然是个动画片 但是成人如果去看的话 也没有什么问题 鼎力推荐 ,5
呜呜呜Woody要去追求爱情和个人自由了TAT,5
完全四星 终于理解绿皮书为何在这个年代还能赢得那么多赞誉了 一部电影内在动力清晰而完整 也不需要绞尽脑汁去表现什么 观看时不曾让空虚感涌上心头 而是源源不断地出现 that s it 的隐喻 so 就让笨拙继续打动我们吧 ,4
可能最近烂尾的大IP太多 所以也抱着这部可能炒冷饭或者卖情怀的心态去看的点映 但是看完立马就打脸了 玩具4在全新演绎的故事上又对前几部进行了传承 新角特别有趣出彩 老角色也都有了最好的归宿 最后又看哭啦   ,5
论垃圾的自我价值 论单身的事业成就 臭鼬飞车 木偶帮派 甜心老大 激光双熊  这部片子更像是献给曾陪孩子看过第一集Toy Story的父母一辈 当年为了孩子抛弃真爱 如今自己不再被需要 能否勇敢振作找回自由 ,5
