comments,star
拍到4了都还这么好看 第一部讲友情 第二部讲玩具的意义 第三部讲成长 第四部讲爱情与独立 这个系列真是绝了  闪灵 音乐响起的时候差点吓哭 作为动画片你不带这么玩的   ,4
 飞向太空 宇宙无限 的台词出来的时候 那一刻的情节于我来说就像是见证神迹的发生 更何况这句话还是由两个最经典的角色分了上下半句各自说出口的 要哭了 ,4
一个断手 一个失声 身  这不就是 神雕侠侣 吗,4
 玩具3 已经非常完美 本以为 玩具4 注定狗尾续貂 没想到仍然保持了 玩具 系列的高水准  胡迪和牧羊女在第1部的爱情得以延续  玩具们模仿GPS的声音也是 玩具1 的故技重施  对前作致敬 同时革故鼎新  前3部都是探讨玩具的危机 被抛弃 被冷落 第4部跳出了固有思维  既然人类可以选择玩具 那么玩具也可以选择自己的主人  甚至 玩具可以不需要主人  前3部是玩具围着主人转 第4部则是传达自由 独立的精神  而首先懂得独立的是牧羊女 牧羊女再开导胡迪 又体现了对女性的肯定  公爵证明了自己的价值 盖比也安抚了受伤的心灵 太温暖了  期待第5678部 迫不及待想看胡迪和牧羊女的流浪生活  一个隐藏泪点 邦妮因为叉叉不见了而伤心 却丝毫没发现胡迪不见了  第二个隐藏泪点 连玩具都有对象了 你却依然单身 ,5
1 2  3  4 不知什么时候开始皮克斯不再是那种满腹笑料却无意中用一两个转折画面和有力台词就能制造内涵说服你的动画公司 现在全是反反复复的自我复制和拖沓的 励志 对白 如果玩3可以不是结局那这也可以不是 世界围绕玩具逐渐变为玩具围绕世界 并开始肆无忌惮与人接触把之前的世界观按地上摩擦 几乎所有我们喜爱的角色全部边缘化处理只负责在里面露个脸好提醒你在看玩具总动员 熟悉却疏远 假设胡迪这个角色确实存在心理成长空间和具有一定必要性 你把整部电影的情感曲线和可能是系列故事分割转折点全压在一个角色身上这种做法是无比愚蠢的 画面超棒部分场景以假乱真 也可以算用心的制作 作为一个连所有游戏都不放过的死忠我感受不到任何灵魂 无论故事 人设都和前几部偏离过甚 玩具总动员的核心趣味已在这一部被彻底终结 ,3
社畜看什么都是社畜 我看玩具总动员4的移情点竟然是叉叉反复跳垃圾桶又一次次被胡迪捞起来上班  泣不成声 ,4
当大家都认为第三部已是巅峰的时候 皮克斯却玩出了新意 不得不服 生而为玩具 也同样要接受时代变化带来的危机感 甚至讽刺的是 你的对手是个自认为 垃圾 的自制玩具 新加入的角色依然搞笑十足 反派意外的出彩和拉好感 但结尾胡迪 找到自我 的选择才是全片最动人之处 ,5
老一辈人 拥有坚定的理想 可以为了集体付出全部 勇敢追求所爱 一生过得充实而有意义  我们这一代 我是垃圾 生而自由  最大惊喜还是Key   Peele 啦 ,4
  把别人开膛破肚修复自己的发声盒 聊斋之换心吗 从叉子到傀儡娃娃 感觉全是主创的恶趣味 这他妈是个恐怖故事啊 没必要 真的没必要  ,3
不知道是不是心开始变老了 越来越不愿意去接受新的环境与人 但玩具朋友们所展现的温情与勇气始终能宽慰那个曾经的小孩 重新续满期待去包容这个花花世界  ,4
皮克斯这部仍然保持了很好的娱乐性 好玩 好笑 并有惊险与刺激的类型段落 剧情本身则延续了玩具与陪伴的话题 并继续将遗忘作为情感落脚 只不过胡迪最后的选择 还是给这个系列指出了新的方向 看样冒险将成为之后主题了 不过 玩3最高的地位 在我心里仍然无法撼动 ,4
本想着午夜场看皮克斯的动画片应该是很安全的 怎么突然就冒出一大堆死寂玩偶来 ,5
影院前排有个小孩对家长说 妈妈 电影不好看  我带着眼泪 想站起来对他喊 你他妈懂个屁   ,5
好多人说三是完美结局 再出会不好看 但是我觉得四完全没有这种情况 搞笑激动又热血 我爱皮克斯 我爱巴斯光年    ,5
这才是真正的动画大片 皮克斯没有让观众失望 将情怀这玩意玩得烂熟于心 虽然冒险历程并不刺激 但剧情营造和节奏把握还是非常出色的 结局也异常温馨和美好 ,5
这是我看的第一部皮克斯 我永远会记得他给我带来的震撼 ,5
4完全偏离了前三部的世界观 前三部里的玩具在与人类世界交融的时候还是非常谨慎小心的 虽然有生命但更高的逻辑其实是人造物 所以举个不恰当的例子就是必须遵守机器人三原则 在4里面玩具直接肆无忌惮的与人类发生冲突 譬如引导邦尼的爸爸妈妈去游乐场和臭鼬撞车的那一段 看的我非常不舒服 因为如果牡羊女这样有 自由意志 的玩具继续发展 结局必然是所有玩具被人类当作病毒和细菌清理 ,3
评分虚高 7 2 8 2姑且可以接受 9 2让同档期的 千与千寻 面子往哪里搁 典型的有佳句无佳章 确实有很多动人的时刻 但剧情漏洞一抓一大把 突兀的人物 玩具 逻辑转变 比如牧羊女怎么就突然就理解牛仔了  混乱的视点转换 以及原因难以成立的古董店追逐 如果一开始就把声音盒给雀斑就没有这些破事儿了不是么 _ 也没看出来声音盒对牛仔有多重要啊   机器人总动员 时代那个惊艳全世界的皮克斯已经不见了 现在的皮克斯或许在技术上进步了很多 但剧作真的在退步 PS 阿兰德龙客串了一名加拿大车手 ,3
果不其然 在电影院再次哭成狗 我们一辈子都像盖比一样渴望被爱 像宝一样驻足观望后走向自由 像胡迪一样从在乎别人到在乎自己 这既是我们的成长 也是永远无法告别的童年 依然有皮克斯笑到爆的梗 抢钥匙那一段笑炸全场,5
結尾不錯 愛得卑微的人最後選擇了自由,4
 每个人只能陪你走一段路 迟早是要分开的  人和人是如此 主人和玩具也是如此 夜色幽谧的树荫小径上 叉叉问胡迪 谁是安迪  胡迪只是喃喃自语又无限留恋地说 那是很久很久以前的事了  真叫人感伤 他终于放下了 从此去往江河万里 最怕我当你是生命 你却只当我是玩具 你弃我如丢垃圾 却不知道我曾爱过你 ,4
连玩具和刀叉都终成眷属了 而我还是单身 来生我想成为一只草履虫 ,3
我们学会爱 然后离开 ,5
全程努力说服观众第四部存在的必要 越努力反而越显得露怯多余 曾经的创作自信哪儿去了 ,3
由于第三部在我心中过于不朽 后续如果没达到那个程度 肯定还是觉得下降了 所以不算很惊喜 抛开系列内比较 单看这部 故事给每个人物设定的性格 其对应的主题动机太过明显 一看把这人写成这样 就知道电影想拿他 她讲什么 虽然带出了女性独立 追求自由 自尊自爱等等 但仍觉老套 甚至还有些说教 主要场景一内一外 古董店 嘉年华  知道是想让观众在这里 玩 得尽兴 但总觉得 事儿太小  一个大环境里出现大人 孩童 玩具三个世界 是系列的基本设定 但本集除了角色一直 哇  哇  也没觉得出现什么很有趣地方 优点是 动作戏一直是系列最大看点之一 大伙儿搭人梯从这里飞到那里 从小到大看不厌 牧羊女的瓷的材质看起来好棒 最后那个夜晚好美啊 3 5,3
最喜欢叉叉了 用垃圾做出来的 一辈子也只想当个垃圾 最向往的地方是垃圾桶 还说 当个垃圾温暖 舒服 有安全感  我的写照无疑了 ,5
玩具总动员4里居然有闪灵梗 仔细看 还可以发现异形梗 ,5
依然范特西 你们要是一直拍下去 我就一直看下去 小孩子才会丢弃自己的玩具 成年人都会好好保存 ,5
非常失望 这个系列最让人着迷的地方是玩具与人的感情 3最强烈 1还不错 2也有一点 结果到了这一部几乎全没了  连玩具总动员这个皮克斯最牛的IP都变得迪士尼化和流水线化 这已经不是自我重复 而是在挑衅玩具总动员前三部的粉丝 比如我  另外 女权这座大山快把皮克斯也压垮了 ,3
大家只想放松看些温馨纯粹的故事 但我看到的玩4全是隐喻和教说 巴斯光年这个做了三部的双男主人间不值得 ,3
玩具总动员都拍到4了 还能保持如此高质量 确实是佩服皮克斯 ,5
第一次懒玩具总动员 被朋友拽去的哈哈哈 他安利了我好久 听得我也蛮心动的 也真的蛮期待的 特地补了前几部再来看 真的每一部都很好看很精彩 这一部也没有让人失望 两个毛绒玩具很爱抢戏了哈哈哈 好可爱 推荐大家去看哦 ,4
给邦妮温馨童年 对安迪念念不忘 带叉叉重拾自我 使盖比点燃希望 最后陪伴翠丝流浪 至始至终 胡迪心之所向的 以及那些无论有无主人认领的toys 都不外乎一直想找寻内心永恒的归属 想来我们何尝不是如此 爱 家庭 亲情和善良 如此普世的情怀 穿插完美的高级笑料梗 居然还有温子仁乱入  皮克斯所展现的 一直很高级 8 7,5
这年头玩具都可以找到真爱在一起撒狗粮虐到单身男女 满分 皮克斯九年磨一剑终于没有让续集就是烂片的魔咒出现在这个经典动画IP发生 这一部基本是让贯穿三部曲的牛仔玩具男主伍迪彻底退出的谢幕之作 24年前 皮克斯的玩具总动员确实改变了我们所知道的动画的面貌 它展示了一种全新的讲述故事的方式 可以说是通过CG动画上赋予玩具生命的方式讲述一段伟大的故事 这一部的反派秉承系列一贯的风格 每个反派都不是刻意单纯的坏 它们每个玩具都有自己的一段心酸的被抛弃历史 了解到它们的故事 你才会对它们做法表示同情甚至怜悯 那个木偶娃娃真的不是在致敬温子仁的恐怖片吗  但第四部 其实从头到尾贯穿的思想就是follow your heart  伍迪不再是以前那个他了 他终于有了选择自己生活的权利 他有了自我核心意识产生 ,5
玩4亮点集锦 1 叉子男 一开始特欠扁 后来垃圾理论一出 倒让人感觉这不就在说我么 心甘情愿做个cozy trash也挺好 2 古着店 娃娃绝对惊喜  温子仁乱入感 可惜后来这条线苏了 3 关于lost的讨论很棒 怎样生活才不是迷失 4 脑洞怪兔子鸭子也贡献了不少笑点 5 牧羊姑娘 变身疯狂马克斯之迪斯尼女权版       整体感觉稍弱于 玩3  毕竟3已成一代经典 不仅故事逻辑性强 还窝藏了宏大世界观 ,4
太好看了 有几段真是看得号啕大哭 我喜欢玩具系列的重要原因在于 它是皮克斯少数几个 不会搞反派公开处刑 群众拍手称快的系列 即使是坏玩具 也会得到自己的救赎 陪伴孩子是我们的使命 可是 当使命结束 我们是否也应当到 更大的世界里 1到4 每一部都在主题上有所 前进  终于这一部 进化到了 玩具的中年危机 安迪长大了 邦尼亦然 我们老了 希望玩具们 幸福呀 会生小玩具吗,5
我原以为胡迪一直会是 最忠诚 的玩具 最可靠的朋友 多少次伙伴们不信任自己的主人 他都会说  we are Andy s toys  直到最后Andy长大了 把他们交到下一个 Andy 的手上 自此胡迪一直困着自己 一直跟自己说我还要守护邦尼到她长大 但是邦尼不是安迪 一个玩具不必捆绑一个主人 24年过去了 胡迪过上了自由的生活 那么同那样长大的我们 是不是也自由了呢 ,5
抛开情怀 其实相当平庸 自我觉醒的主题不但浅尝辄止 而且放在这个系列的设定下其实是存在某种悖论的  如果玩具应该像人一样自由 那么那些对于主人的忠诚又算什么 何况 连招牌的冒险动作设计 与几部前作相比也显得潦草,3
牧羊女回归 感觉本片对于玩具的 陪伴属性 和 自我意志 的讨论又更进了一步 有的玩具渴望主人的陪伴 而有些被主人遗弃的玩具则宁愿成为流浪玩具 渴望更加广阔自由的新天地 ,5
To infinity and beyond1111,5
看到结尾 我 一个铁石心肠的boy 竟泛起泪花 满分  To the infinity and beyond ,5
皮克斯还是那么会讲故事 没想到玩具总动员系列拍到了第四部 还是能够保持前面三部曲的水准 在安迪成年之后 也让玩具有了一个成人礼 完成了陪伴孩子成长的使命之后 有了自己的觉醒 能去外面更广阔的世界看看 皮克斯动画的动人之处 就是他们总能去讲一个成人向的主题 在成长和传承的话题上 让成年观众共鸣 也难怪它会让人情不自禁的泪目 ,4
3 5 现实视角与超现实 或称童真 视角相互兼容 人与玩具皆可畅通代入 这是前三部成功的根本 而之所以 不可续  关键不在于第三部多么无出其右 而在于前三部已经构成了完整闭环 属于玩具的轮回在安迪与他们 我们与系列的共同告别中已被勾勒成型 在非续不可的大前提下 这一部必然面临受众转向 重回低龄 和赋予玩具新弧光的难题 但 玩具的自我觉醒 这样一个突破 轮回 的成长路径 本身已是对现实视角的进一步疏离 也让告过别的上一代观众难以维持同时代入人与玩具的能力  而当被代入的只有熟悉的胡迪 他的幼儿园主人又要和我们现实中的什么形成对位 一个人畜无害惹人爱 不知奴役为何物的奴隶主吗 这不是童心犹在 或者早生早育带个崽看所能化解的了  但退一万步 即便先天不足 有如此完成度加持 终究是个优等缺陷儿吧 ,3
3 1 2 4 看完更加觉得   收尾在第三部是明智的 恰当的 完美的 这部画蛇添足感太明显了 这个系列三部曲承载的主题已经足够 让他们 一群玩具 去承载更多或许未必适合他们去诠释的东西真没有必要 当年特喜欢 死寂  看到玩偶很惊喜了 ,3
拍续集就是创作力枯竭以及来钱快嘛 希望大家都能勇敢承认这一点 ,3
请豆瓣加一个惊悚标签好不好 死寂的人偶真的好恐怖   ,4
3 5 离第三集都九年了 总体制作水准维持 情怀也在 但时刻以操心天下事为己任的过程偏冗长 结尾相当不错 玩具不再附属于主人 不仅可以自己选择主人 甚至还可以选择不需要主人 与其在卑微中乞爱 不如在被遗忘前放手 戳中心事 牧羊女太帅了 ,3
从第一部的友情 陪伴到第二部的责任 坚持 再到第三部的离别 成长 以及第四部的认识自我 直面内心 20年来  玩具总动员 系列也陪伴我从一个小男孩成长为进入社会的 大人 了 谢谢你们在这个细雨绵绵的晚上 对着正面临失意 怀疑自我的那个小男孩说了一句 Be who I am  right now   再次给他走下去的勇气和希望 ,5
集体主义与忠诚至上的精神留在了上个时代 这个时代是由独立女性来引领自我和颠覆世界的 ,5
可以笑得很尽兴 几乎是全程的  也可以哭得很尽兴 关于自由和归属 关于内心的声音 关于超越自我  这些别人讲起来会感觉老掉牙的东西 皮克斯可以做到新意迭出 你仿佛是第一次听到这些词 故事讲得很精准  准确地控制了你的情感穴 满足了你的想象力 这感觉 就像  即便你没有这么大的胃 它也设法让你尝遍了所有的山珍海味  嗯 刚看完 比较兴奋 不太理智 但这就是它能创造的效果  ,5
三星半 第四部这个 家养玩具 与 野生玩具 的设定 跟前三部是脱节的 总有点无病呻吟感觉 冲突矛盾和情感都不如前三部 玩具们之间的连接与互动也不那么扎实有趣 除了胡迪与牧羊女 其它玩具都沦为酱油 胡迪和叉叉的冒险之旅其实并没有多大价值 后面插入旧货店更让故事主线模糊不清  倒是盖比娃娃的角色有点意思 结尾一幕最有催泪效果 总之 如今的皮克斯创造乏力 趣味不足 本片没几个特别好玩的地方 新增的毛绒二人组更是尬 黑人喜剧气质与本系列一点不搭  吃老本都成问题 C U toys ,3
迪士尼现在真的好注重women empowerment什么的流浪大佬Bo飒帅飒帅的 duke caboom这沙雕角色居然是Keanu Reeves配音我窒息 钥匙那里全场爆笑哈哈哈buzz真的怪萌的 没人high five的小兵怜爱了 告别to infinity and beyond有真实泪目,4
没有第三部好看 改变价值取向 是玩具在选择小孩 而不是小孩在挑选玩具 但是皮克斯爸爸也做了个人 胡迪终于不要等丑小孩长大再把他抛弃了   结尾收在 新的手工玩具问 为什么我有了生命  而叉叉说 我不知道  也算是官方回答 就让系列在此终结吧 ,4
为了实现立意的突破翻新 或者说更靠近所谓 追求自由 的流行化政治语境 而选择彻底推翻 玩具与主人 这一原本从日常经验中提炼出的绝妙人设 实在属于舍本逐末的媚俗 当玩具拥有了过分充沛的生命力 这个系列便不再具有存续的意义 这不是 玩具总动员  而是 猩球崛起  ,2
牛仔的选择蛮好 但我忍不住觉得那个本来有着强烈的自我身份认同 却被牛仔洗脑相信自己是个玩具并且以哄人类开心为价值的叉子有点可怜  ,4
让爸爸坐牢    ,4
这部还加入了恐怖元素  ,4
续集一多 难免就会陷入自我重复的困境 不是不够好 而是这些已然是老生常谈 看似新颖 但创意着实没有多少 就像个极其设计的机器 尽显精巧 华丽 却再难拥有前作的感动与回味无穷 既已告别又何必再见 ,3
8 0 不那么好的一部玩具 当重温了第三部后马上再去看第四部才会清晰发现这个系列止步于第三部会好很多 并不是说有多差 而是这个系列一直探讨的话题 玩具是如何的存在 探讨了整整三部后 这一部继续这样走下去就变得完全没了什么新意 引入了叉叉这个角色和牧羊女的回归在开头是一直在刺激胡迪的价值观 但是这方面作的笔墨并不多 中期大多数时间不过是救人的冒险故事 叉叉的自我否定仅仅是他诞生的那几分钟 而牧羊女的自我放逐也不过是三言两语 所以这在最后造成的胡迪放弃主人这个结果就变得突兀 不但是是胡迪一个人的塑造有点失败 这一部里面除了胡迪 其他那几个老玩具角色彻底成了背景板 以前的双主角设定里面的巴斯光年也在这里面仅仅是个打下手的 让这一部成为这个系列的完结篇实在是不好 值得吹的 也不过是让人惊叹是4K渲染,4
过去玩具们无条件陪伴主人 一身赤胆忠诚又籍籍无名的故事 终于以主人长大成人而结束 这次垃圾变成玩具 玩具主动选择被遗弃  或成为某种很难分类的 垃圾  都说小孩子某一面是恶魔 但有些玩具设置也很惊悚 类王子公主的出走故事 更像迪士尼而非皮克斯原本 然而谁都要长大 那个大游乐场嘉年华 上海迪士尼乐园的疯狂排队 VIP加塞不是已经很说明问题了么 掏再多情怀 还不是要商业买单 毕竟 牧羊女是个大爱皮啊 ,4
超过了期待 没有光打情怀牌 有情怀 但新故事很棒  也没想到依然看哭 这一部除了因为归宿而引发的矛盾 更多是玩具的使命和责任 而且影片中反映出的价值观可以说是与时俱进 但又不会太刻意 虽然叉子很丑 但看完电影就不嫌弃他了 Woody依然最帅  p s 本片用来宣传垃圾分类太合适了XD  每一个垃圾都有自己的归宿和价值 ,5
1 一心相当垃圾的叉叉就是豆瓣废柴 社畜胡迪一直想给他洗脑培养新社畜  2 人类不就像那群玩具 主人早就不爱我们了 甚至从来也不爱 我们还自我编造意义 自我洗脑争当合格社畜 不是社会需要我们 是我们需要社会 否则就觉得自己无用 生命无目的  3 可就这样 我们还像那个摩托男那样高呼上帝之名飞向月亮 高贵伟大光芒万丈 真是可爱可笑的物种啊 ,4
并无提升与惊喜的一部 依然高口碑是因为习惯吧 ,3
你不是垃圾 因为你被人需要 你日夜坚守 因为你肩负使命 你摁个不停 因为你听从内心 你奔波流浪 因为你还在等待 你依依不舍 因为确认过眼神 你不惜一切 因为你还想被爱 你办法很多 因为你还有同伴 你不断寻找 因为你需要陪伴 你找到自己 因为你感同身受 这就是皮克斯 因为你总能在其中找到自己 不断分别 终有重逢 相信那一天 你依然热泪盈眶,5
平庸 不可思议的平庸 为了与时俱进凸显 girl s power 强行改了牧羊女的人设 从一个俏皮的奔放的花瓶 改成一个强大领导力和行动力的女领袖 我并不喜欢花瓶 我只是反感这过程中的刻意和任何形式的伟光正 在过去三集里 玩具和人的关系维持着一种微妙的距离 这一集玩具可以直接影响人 让这个故事失去了原来温馨的童话感 拉塞特被换果然影响很大   ,1
从头到尾都怀着一颗感动的心观看,5
不知道是不是买错票看了国语版的关系 整体感觉维和又无聊   ,2
只能说不难看 系列拍到第四部了难免重复前作 且笑点和感动都少了很多 这个结局应该不会再拍续集了吧  皮克斯真的需要点新东西了 ,3
如果说第三部说的是玩具作为孩子的玩具的最终意义 说尽陪伴与感激 这部就是在说玩具们自身 跳脱出孩子们所属 拥有自己的意义和选择 如同UP开头十分钟赚足观众眼泪 却又在中段让老爷爷一件一件丢弃掉陈旧的 超重 的家具 重新让自己飞上天空一样 玩具总动员的3与4大概就是这样的一种关系 皮克斯总是告诉我们敢于舍弃 不畏惧改变 做真正的自己 我永远喜欢皮克斯 ,5
上一部是情绪巅峰了 记得在南京的影院里几乎泪崩 这一次被剧透了结尾 少了种掏心挖肺的痛 却有种目送他们走向岔道的忧虑 毕竟24年来 习惯了玩具们齐齐整整 但其实 自己虚伪到连牧羊女都未曾想起 而她这一次绝处逢生 英气得超越了女权 女性 母性的局限 太喜欢这个在玩具噩梦中站得海阔天空的角色了 而成长的命题 终于还是要面对自处的豁然与怡然 前作中 这群担忧被遗弃 被淡忘的玩具 拴在他人无法保质的爱里就是最大的冒险 如今转向每个人在生命的岔路上不断选择并行或道别 伤得更重 却不知该从何处哭起 是那种泪干了仍会觉得身体颤抖的难过 我终归是个生性太念旧的人 以前的玩具大多不见了 但能剩下的 再舍不得扔掉一个 囤积真是种无能为力的心病 话说 在上影节有空在大银幕前重温1 3该多好啊 永远爱你们 ,5
去电影院记得带好纸巾 孩子们看的是其中精彩的冒险 大人们看的是从几个不同玩具身上所代表的自身意识的投射 泪点在反派和结尾 牧羊女全场最佳 新独立女性意识的觉醒 从影片的时常 节奏流畅度以及故事的曲折程度都可以看出皮克斯在竭尽所能的贴合比较低龄的受众群体和票房 不足的地方是整个冒险经历虽然笑点多 娱乐性强 但缺乏惊人的想象力 这使得影片离神作还有一些距离 结尾的意外和催泪扳回一局 ,4
3 5  没想到三部曲完结之后还是能挖掘出新角度 责任与自主选择 一种比 玩具3 更深刻的主题 完成得如往昔般精巧 但同时也透露出过度的精致和好莱坞的 套路 感 胡迪和大家告别的时候还是被戳中了 希望这是真正的最终集 p s 致敬了 死寂   闪灵  ,4
看 玩具总动员4  我哭了好几次  深深爱着一个人 为他的幸福付出一切 但却不能陪着他长大 最终 只能成为他遥远的童年记忆 然后你的世界倾塌 带着受伤的心 不得不再重新爱另一个人 心里 却始终明白 总有一天 这个孩子又将长大 你又要被抛弃  太痛了 别承担这份过重的责任了 不值得  毕竟 你始终只是一个玩具 会变坏 磨损 成为一个遗失的玩具 看到最后又觉得很欣慰 不被需要了很寂寞 却也是一种自由  看完后到朋友家玩 帮她的小朋友收拾玩具 看到被拧掉胳膊的钢铁侠 我忍不住认认真真地对一个五岁的小朋友说  你要对玩具们好一点哦   我真是入戏太深了 ,5
巴斯光年的口号换了那么多句 只想听到想听的声音 公爵飞行四十英尺 只为兑现广告里的承诺 古董店无人问津的傀儡娃娃 也想修好发条获得宠爱 胡迪把叉叉带回家 是他目前唯一能做的事 再廉价的塑料 如果有人组装就会获得生命 再精美的娃娃 如果无人把玩就会成为垃圾 变成玩具 是最好的宿命 ,4
如果说玩3的结局是Andy Woody选择放手使Andy成长 玩4则是Woody自己的成长 孩子总会长大 玩具也并非只有一种方法来守护童心 或许它们不再完整如新 但不再迷茫 lost真是个完美的双关 本片表达的东西很普世 一个人的存在感和归属感不用通过别人承认才成立 找到真正的自己 倾听内心的声音 更重要 老玩具们戏份不多 潇洒公爵超好笑 一定要看到最最后 To infinity and beyond FOREVER ,5
