comments,star
尴尬癌都要犯了 皮克斯的水平下降的厉害 成熟从不喜欢皮克斯开始,2
低龄 观影体验差,2
这一个礼拜我一直不敢去看这个片 因为我怕我绷不住 下足勇气去看了 发现扑街到这种程度 反而长舒了一口气,2
和预期差太多 这部更像迪士尼拍的鬼娃回魂,3
我给皮克斯1000000分 光是胡迪几次表情变化的小细节和安迪把胡迪交给邦妮的那个场景就让我感动落泪 一周连着看完四部 这感觉就像是从大清王朝穿越到哆啦A梦所在的22世纪一样奇妙 但又首尾呼应 完全不觉得生硬 皮克斯让胡迪和牧羊女一起奔向更自由的世界这个结局简直太戳我的心了 我相信分别以后会再重逢  我以为巴斯光年是第二主角 却没想到第二主角是一根塑料叉子 ,5
恐怖片 爱情片了 其实可能并没有想象中那么好 巴斯光年也有点打酱油了 but still to infinity and beyond ,4
emmmmm     太惊悚了这群木偶 太惊悚了,2
每个残缺的孩子心中都有一个独特的 玩具  可以补全自我完整 但没人想过 玩具也有自己的人生要探索 ,5
最后还是流泪了,4
在穷尽了以十公分高的视线观看居家室内场景 包括邻里小区 的奇观想象之后 第四部果然打开全新视野展现了一个嘉年华 外面的世界也昭示着从第三部被孩子放手到第四部玩具主动放手孩子的价值观升级 比起孩子为人父母更需要看的这一集 真 陪着观众一起成长 以及原来和新版鬼娃回魂联动的不仅仅是海报 正片把恐怖谷效应玩出了花 再及闪灵梗 E T 梗玩一百年我也不嫌腻 ,5
天啊这个系列每一部都让人哭成狗 即使猜到结局也能流出一顿泪水 永远吹爆皮克斯 看了二十多年 从自己是安迪到自己变成邦尼的妈 这系列还是那么好看 伍迪是天使吧 巴斯好蠢萌 爱才是让一切东西闪耀的存在啊 爆哭 ,5
这部是底层自由意识觉醒的意思吗  第一次去幼儿园有心爱的玩具陪伴才会安稳地度过第一天 过于真实 引起极度热泪 ,5
这片较有趣的地方在于融汇了许多电影作品与类型 比如西部片追求个人自由与回归家庭 社区的主题在一个 牛仔 玩具的设定下倒也贴切 且在结尾扮演了重要角色 再比如Dead Silence式的人偶horror gangster元素 还有其他各种致敬 ET Carousel  融合在一起还算较为自然 也让影片的叙事走向增加了一些不确定性 最后环扣被取走 倒也解放了牛仔 ,4
好莱坞保守主义动画的典范 不会靠恶心和歧视来搞笑 不会宣扬狂妄的虚假正能量 但是它幽默 有真正有益的正能量 ,4
垃圾迪士尼 拆我CP,5
Pixar的技术自然不必说 难得的是故事依然能讲出新花样 但说是作为续集却感觉很别扭 真正是中心角色的只有伍迪 连巴斯的地位都挺尴尬的 插科打诨的作用更是分给了新一批配角 加上那种分量的结尾 俨然成了 伍迪传  anyway 连女权都能做的后知后觉 其他公司学着点儿 8 5 10  离别 是我这几天生活的主题 自然在结尾哭得脖子都湿了   ,5
好在于把不可能变成了可能 从一个闭环里 扯出另一个维度来 探讨了玩具的自我意识 把 陪伴 或 离开 都上升为玩具的自我选择  可是 这样一来 固有的闭环也就被破坏了  前三部里 尽管玩具会动 但有一个基本的设定是不动的 那就是玩具的使命就是陪伴主人 这也是整个系列最核心的根基  到了第四部 这个根基被动摇了 玩具有了自我意识 可以主动选择离开主人 追寻更好的生活 这个立意作为单独电影 是不错的 但对于整个系列的完整性来说 无疑是一种破坏  说到底 造成这种割裂的根本原因在于 前三部的世界观是儿童的 它基本是站在孩子的角度 让他们重新认识玩具 并认识到陪伴和离开是生命的常态 而第四部更偏成人向 它其实是个科幻设定 如果AI有了自主意识 会怎么样 这与前三部比 已是另一件事 ,3
孩子并不是玩具的全部 它们也会选择独立 甚至产生爱情 每部都有惊喜 不仅仅是伟大的系列动画片 其对于孩子的洞察也很全面 有温柔的孩子 也有熊孩子 对于人性善恶的观察 精准到微 虽知道人性黑暗 还能歌颂勇气和光明  ,4
这是温子仁导演的吧,4
玩具总动员的故事到这里也该结束了 玩具们都找到了新的生命 更何况我们呢 故事和人生 都向前走吧 ,5
拍到第四部还能有这样的高水准 还能说什么呢 跟着新时代独立女性一起哭就对了        ,4
全程都在惊叹皮克斯的材质渲染 打光 镜头景别和景深的选择 看得一愣一愣的 结局让我穿越到 权游  为啥最有责任感的角色的归属永远是放生回大自然 绝对是真 佛系 不过在灯火阑珊中找到自由也算是最诗意的结局了吧 ,4
2 5 让胡迪对老朋友毫不在意 才卖力建设起了叉叉这角色 反而把弹簧狗 巴斯光年 翠丝等人做成了背景布  ,2
 玩具总动员4 3D 能有这部续集本身就是惊喜 但终究逃不开离别的伤感 胡迪对主人的爱 已经博大到可以容纳另一个叉叉的存在 甚至为保护它而不惜放逐 诠释出忠诚的更高境界 新玩具达鸭 兔哥 机车公爵的加入 让笑点保持在一定的密度 最感人的是盖比娃娃 她不被最爱所选 但仍旧物尽其用 正所谓 莫道昆明池水浅      ,4
并不伤感 这是喜悦 胡迪做出了他应该做出的选择 他已经陪伴了两个孩子 完成了他玩具的使命 现在 他该跟随自己的内心 相比较第三部 这部没有那么感伤的泪点 最大的笑点是玩具阻止爸爸开车离开的那段 全场爆笑 还有玩具们摔出窗外劫后余生纷纷抱住自己伙伴的时候 公爵抱的是摩托车      大笑   如果有下部 胡迪牧羊女公爵可以成立玩具游侠小队了,4
和朋友看完之后一路上吐槽直到分开 真不把胡迪当人 虐到死 能给的都给了然后才肯放他一条生路的感觉 第三部其实是最好的结局了 起码我们还有大把想象的空间 ,2
我不喜欢这个结局 玩具们应该还和andy在一起 ,1
第三部实在是太完美了 所以比不上 但迪士尼仍然交了一份令人满意的答卷 故事主题从前三部曲聚焦人与玩具的羁绊 友谊 成长 转为玩具探寻自身存在价值的意识觉醒 画面表现力上 耳目一新的桥段还有 但是为数不多 最后胡迪告别的感动程度不输上一部安迪的告别 玩具总动员系列给人带来的永远是温暖与美好 感谢 ,4
不打扰 是我的温柔 ,4
我真的哭成傻逼 玩具们感知到自己已经完成了使命 我也终于跟着发现自己已经是个grown up很久了 只是不想选择makeover而已 就像原先的woody一样  ,5
整体超出预期 超好笑再加时不时触碰回忆的感动 感谢迪爸爸 ,5
Disney太善良了  ,5
我一个现在还和家里所有娃娃每天说话的人 看这种电影简直就是我 的 世 界 ,5
Forky先生很萌欸 无法接受自己还不错 高呼着trash 一脸幸福地跳进垃圾桶 是我本人没错了 ,4
玩具系列在我心里是殿堂 已经不是看动画那么简单的事了 但我承认我不爱这个结尾 甚至有些被伤到了 希望就此完结吧 喜欢叉子是一时的 没了牛仔会哭很久的 ,5
完美结局之后依然能讲出好故事 守护一方的警长成为无拘无束的游侠 老粉欣慰抹泪 皮克斯和胡迪都值得   ,5
毫无逻辑 狗尾续貂  盖比娃娃这种我弱我有理的绿茶婊是如何被洗白的 这动画片有核心价值观吗 盖比娃娃的善意初衷并不是她施暴的理由 完全本末倒置 最后还给她一个HE 作为一部动画片而言这价值导向差得离谱 ,2
学会在适当的时候放手 会收获更多 保持了系列的娱乐性  闪灵 音乐与 死寂 娃娃 惊悚元素的致敬惊喜 ,4
一边看着胡迪拼命守护一个孩子的快乐 一边听着邻座那个熊孩子一会儿哼哼唧唧一会儿大声嚷嚷 强忍着打死他的冲动 这感觉实在是太特么神奇了   ,4
愿有情toy终成眷属 ,4
这个系列一直想要探讨 玩具 与 人 的关系 但一直都浅尝辄止 或许是说深了就会发现两者关系并没有那么美好 所以我更喜欢最初牛仔风胡迪与太空潮流的巴斯的文化碰撞 越到后期这种风格越淡 迪士尼的大团圆 全攻略等俗套流程出现了 这部最有意思的大概是用人偶和洋娃娃反复制造经典恐怖片桥段吧 盖比的声音很好听 中文翻译有个地方很有趣 玩具们口中始终说的是kids 但翻译为 主人  He has a kid变成他有主人的 其实直译并没什么不妥 再加上中段胡迪着魔般和牧羊女大谈对 主人 忠诚 氛围就有点变质 对孩子忠诚 氛围是不同的  所幸最后结局胡迪的选择成了亮点 几可与当年怪物史瑞克结局媲美 如果还有下一部 到底是拍流浪玩具的冒险 还是拍流浪玩具的回归 这是个关键的选择 ,3
有情人终成眷属,4
从割舍童年 享受新的成长 到这一部经历更难的一些抉择 玩具都随着时间 陪伴观众无畏地向前 游乐场和古玩店场景都有新意 伍迪挽着牧羊女在旋转木马前 玩具们一一走来 你好啊 新伙伴和老朋友们,4
叉叉的任何事物都能成为玩具 牧羊女的任何玩具都不必要找一个主人 这是对前几作 忠诚 母题的革新 可盖比的执念又击碎了这个突破 在me too等解放运动的当下 这种必须依附某个客体的概念有些落后 叉叉诞生时承载着 终归成为垃圾 这个宿命式的主题 在之后的剧情里却被抛掉了 其实这种对使命的开放态度更贴合胡迪作出的最终抉择 但影片却将其归于和牧羊女的暧昧情愫 真是全方位的失败 ,2
这部是认真的讲故事 越往后越走心 差点感动哭,4
这是我小时候第一次看玩具总动员的心情 怎么会这么好看   小时候 我们需要它 长大了 一度以为这个系列已经不再适合自己了 但现在 我又变成了那个第一次见到胡迪的小孩 我已经很久没觉得自己还是小孩了 ,5
一个给孩子看的片子能到这个水准 而且每部都没有烂 服气   但全片没看到有孩子玩iPad 我还是很惊讶的 ,5
我对这个系列的感情真的好深 还是第一次在影院看这个系列 当电影开篇you got a friend in me响起我就忍不住眼泪辽 每一次对安迪的回忆都是泪点 不可否认第三部的结尾已经很圆满很完美 也同样承认这部的水平相较于系列前三部确实有所退步 但这还是那个我最爱的电影系列 我愿意带着我此生最厚的粉丝滤镜去感受这个系列 结尾巴斯和胡迪共同说出的 飞向宇宙 浩瀚无垠 又让我回忆起多年前的玩具1 是一切故事的开始  玩具系列永不结束   我永远爱皮克斯    PS 超想把这个系列的玩具买全啊啊啊啊,5
并不太喜欢 强行蹭女权主义热点 冲淡主题又没贯彻到底 吃相很难看 ,2
给五星不仅是因为 童年回忆 的圣光加持 剧本的确一流 值得追随的主角 明确的目标 逐渐升级的冲突和令人满足的结局 多少大人电影求而不得的四大好剧元素 这部电影都有了 我和我边上坐的小孩儿泪点基本一致 这就是好电影的魅力 带来超越年龄的共情 ,5
每天晚上 全家都进入梦乡了 可玩具们却开始出来活动了 顿时 屋子里热闹非凡  当初 就这样入了玩具总动员的坑 终于等到第4部上映 汤姆汉克斯配音 品质保证 胡迪的感情线  ,4
这部真的巧妙 玩具们已经有了觉醒的意识 他们脱离了主人照样可以存在得很有价值 这或许是一种也是一种成长吧 真希望玩具系列一直拍下去 看到他们就是自己的青春记忆 一起成长一起加油 ,5
把孩子替换成政府 玩具替换成社畜 整部片子顿时就清晰了  所以社畜应该为自己而活 哪怕是去第三世界援助当地政府 开心就好 ,4
无趣 ,1
有个台词说 每个玩具有自己的主人是最大的荣光      感觉美帝还是骨子里喜欢奴隶制 ,3
那把叉子无数次地跳进垃圾桶的时候我就烦了 后面都没怎么看进去  ,3
以为拍到第四部该烂尾了 一直搁着才看 结果我又看哭了 这系列真是太温柔了 守护世界上最柔软的童心T T 不是孩子选择玩具 而是玩具选择想守护的孩子 一心想跳垃圾桶寻死的叉子 臭鼬跑车 还有奇奇怪怪的小玩具 盖比决定去温暖走丢的孩子   可爱又感动 皮克斯真是爸爸 胡迪真离开了吗 舍不得巴斯光年他们啊 请继续拍下去吧 牧羊女好看 有人说看出了生理反应   ,4
皮克斯惊喜之作  不是所有人都会在原地等你 也不是所有感情付出都有回报 你会被轻视会被辜负 但善意终究给你温暖,5
OMG 也就哭了十几次吧    ,5
8 5 3 2 4 1 啊 这次是真的结束了吧 单从剧情上讲感觉 拯救 这条大主线并没有前三部精彩 然而结局却又一次狠狠戳中了我 胡迪一直在为主人 为同伴竭尽所能 这次终于听从了内心的声音选择放手 寻得自己最终的归宿 新加入的两个玩偶无疑承包了大部分笑点 闪回式想象片段真是有趣 另外叉叉也好可爱 其实这一系列让我觉得很难能可贵的一点是 无论新加入几个角色都不会含糊了事 它们或好或坏总会有自己存在的意义 最终也都会有一个令人满意的结局 就算是像本部中渗人又败好感的傀儡娃娃 最后也给予人了一丝欣慰 虽然第三部的结局已经非常完美 以这部结束却也依然很棒 没什么遗憾 就这样告别真的很好 ,4
拍到第三部刚刚好 let it go主题用滥了也会让人无感撇嘴 另外前半部分数次营造对小朋友不友好的惊悚氛围是导演的某种恶趣味吗 万幸我后排的小孩子在表达了几次害怕情绪并开始大哭的时候被他的好爸爸及时抱出影厅吃快餐去了 留下妈妈和大女儿安静看片 心里点个赞 ,3
带兔美逃学看电影 挺好的故事 迪士尼真的把 老少咸宜 这四个字发挥到了极致 ,4
 ９ １０ 这次也许是真正的结局了吧 好的故事可以不需要反派 实现了别人的心愿 又何尝不能来一场最后的告别呢 PS 童自荣老师没能来给这一部配音 多少有些遗憾 ,4
4 5 重启系列自然会让观众有点担心 但皮克斯用纯熟的技艺表明旧瓶永远能装新酒 开篇让叉叉玩具意识觉醒 跟第一部拯救巴斯光年如出一辙 中段鬼娃造型 安娜贝尔   死寂 恐怖氛围再起 则是第二三部都用过的类型伎俩 核心矛盾冲突依然集中在理念之争 玩具究竟是否需要依附于主人来获取自身存在的价值 第四部给出了自己的答案 结尾的选择在意料之外情理之中 节奏好到不行 笑点俯仰皆是 周末能和朋友一起看一场这样的动画 真是巴适得板 希望在自己变老的路上能一直有胡迪的陪伴 ,4
真心觉得不咋的 中间无聊的想睡觉 难看 真难看  无聊透顶 评五星的你们是认真的吗 ,1
小时候看第一部 就特别坚信玩具都是有生命的 他们会在我不知道的时候 有自己的生活 所以对每一件玩具都特别好 现在长大了 看到第四部 回来抱着我的小独角兽哭了半天 给她讲她资本主义的同事都多不容易 都21世纪了还生活在水深火热之中 请她务必珍惜自己的生活 然后教育了我狗半小时 请她务必理解从小到大我不肯给她买玩具的事实 毕竟她不懂事 只会撕咬可怜的狗玩具 这让狗玩具如何在我一堆精心呵护的玩具中立足 他们会歧视他的 歧视的事情在我的视线范围内不可以哦 然后 我看到我狗挣扎着上来想咬住我的小独角兽的角 孺子不可教,5
1  从剧情到人物塑造再到配乐都无可挑剔 顶级水准的作品  2  胡迪像是遭遇了中年危机的男性 对事业的焦虑 对自我的质疑 这些迫使我们的警长从前三部里解决问题的人变成了这一作里制造问题的人 而在和众多新老朋友解决问题的过程中 胡迪重新认识了自己 也重新认识了 玩具 这个身份 从不离不弃的陪伴到选择开始新的冒险 故事的主角给这个系列画上了完美的句号  3  新加入的角色占据了包括巴斯在内的老角色的戏份 他们的表现不负众望 基努和黑人兄弟的配音尤其精彩  4  故事的终章难免让人伤感 然而故事总会走向句点 冒险却永远不会结束  to infinity and beyond  ,5
前几部的玩具们还比较像玩伴 这一部的胡迪就真的很像父母了 对主人的称呼一直都是my kid 做的又是一场场注定以分离为结局的陪伴 这就是父母呀 而在完成 使命 之后 有些人选择找回自我飞向自由 有些人选择继续陪伴新的孩子 带孙子   皮克斯最可贵的是从来不会judge不同的选择 爱某个孩子也好 爱更广阔的世界也好 都没有高下之分 大家最终都能互相达成理解  如果说前几部在告诉我们要珍惜相聚的时光抓紧创造回忆 这一部大概是让我们接受 再紧密的关系也可能会走上不同的路 分离才是人生的常态 ,5
从玩具为孩子而生到玩具为自己活 时代在发展 皮克斯也在与时俱进 随着邦尼逐渐长大 总有一天要分手 与其执念不如放手 世界那么大不如去看看 离别也未尝不是新的开始 ,5
一般般 ,1
Vincent作为一个心灵手巧忠于朋友的boy 只是因为长得特别 就要收到世人和朋友的这种待遇 为他掬一捧热泪 剩下几个boy更惨 明明是四个人的电影 他们却不能有姓名,3
童年没有玩具总动员 没有太大感觉 连玩具都要追求人生意义 中年丧狗觉得很累 当个trash挺好的 ,3
还是那个不拘一格的皮克斯动画 始终饱含着人文关怀上的思辨 虽然三部曲已经将本源角色阐述完全 这部 多余 的续集自然另辟蹊径 从玩具的人格觉醒下笔 相较于前作 本片对自我意识的诠释可谓更进一步 几乎是在向从24年前就开始看起的观众 一次拉近现实的寓言 各种jump scare实在酸爽 ,4
真的是年龄大了 看什么都容易哭,4
在凌晨场的电影院哭花了妆 皮克斯太懂怎么让你一边笑着笑着就哭了,5
虽然第三部可以说是完美的谢幕 但新的一集却没有狗尾续貂的意味 新旧角色各有亮点 牧羊女的女性独立意识 人偶惊悚的恶趣味呈现 叉子等弱势群体的自我认同 成长和爱的议题也更加深沉 价值传达和情绪煽动也做到了润物细无声 依旧感人至深 故事还兼具怀旧式的故梦重温 不说教有内涵 让离别升华 让成长绚烂 让爱与陪伴不止追求形式 玩具们的原始使命和个人解放都得到奏效的安放 去世间流浪与终身陪伴都有了替代和选择 世事总善变 唯一不变的是脱下青春和稚嫩时 梦想和美好依旧能深刻的感动你 结尾处胡迪跟每个朋友告别的时刻 才惊觉成全才是这个世界最伟大的爱      ,5
依旧很美好呀 想回归垃圾生活的叉子太好玩了 做一个垃圾也很好呀哈哈哈 爱与放手 ,3
本来以为胡迪和巴斯光年就算街头卖艺也会兄弟一起 没想到竟然散伙了 哭唧唧 最惊艳的是牧羊女从一个花瓶一举变身成黑寡妇 散发着女权光芒 最开心的是这个系列依然一以贯之的暗黑 能吓哭电影院里的小朋友们 ,5
看到主人变成Bonnie 与Bo的久别重逢 心酸感动Toys真的是伴着我成长的见证 犹记看T3时笃定成长是这个故事最好的告别 如今再去用新的眼光看待曾经局限的世界 去看责任或者未来 如Woody寻找自我 在这一部中又是一种新的感悟 我们从童年的成长逐渐开始体会所有必然而然 酸甜苦辣的人生 ,5
比想象中的好看 ,5
这就是童话和电影的魔力吧 会让你忘了所有挑剔 沉浸在它营造的这个温暖的世界里 只有美好的事 只有纯粹的爱 只有希望的光 没有那些复杂人间事 这100分钟 都是幸福感 ,5
每一部的故事都在发掘新的意义 角色塑造极精致 ,4
真的没想到 玩具总动员 还会有4  然而4没有让人失望 这集不光有玩具之间的友情 玩具对主人依赖 更让我们明白了主人需要成长 玩具也需要变得成熟 另外这集也让动画人物挑起了女子力的大旗 却没有太多说教的味道 梗至少3个以上 但是才疏学浅如我只能想到3个 死寂 ET 吃鸡   终于明白了汤姆汉克斯之前说配音都哭了 我也哭了 剧里有多少笑点就有多少泪点 玩具老粉必看 结尾有5个彩蛋 请不要提前退场 本集保守评分8 8 5,4
 如果迪士尼拍 西部世界   之所以不提皮克斯 是因为本片无趣得难以察觉皮克斯的痕迹 ❶有意增多牧羊女的戏份以及加强她的战力 尤其是后者 英姿飒爽 无可非议 然而却再三有意突出胡迪的有勇无谋  画蛇添足  贬低他人以抬高自己  对调性别便能瞒天过海 ❷胡迪的愚忠恐怕是致命吸引力 牧羊女前后仅隔6分钟就从谴责变成迷恋 到底捧女性还是讽女性 ❸咔嘣公爵 丧版巴斯 盖比 黑化不彻底的大粉熊❸结尾彩蛋穿插得太生硬,3
相比前作结尾导向一种不定型的狂欢状态 这部落脚于 选择 实在是太简单 自主选择是假象吗 Gabby的声音是自己的还是Woody的 Buzz的inner voice是怎么回事 Demo模式是不是主体 这些才是Toy Story不凡之处吧 ,3
 后宫 胡迪传  主要演员 如懿饰Woody 李玉饰Buzz Lightyear 凌云彻饰Bo Peep 寒香见 意欢饰Forky 弘历饰Bonnie 甄嬛饰Gabby Gabby 吉太嫔饰Duke Caboom 海兰饰Trixie,3
当别的系列都在不断挑战着烂尾和卖情怀的最低底线  玩具总动员 竟然依旧可以拍出新的完全不同的核心 ,4
出乎意料的好看 新角色都非常令人驚喜 故事沿襲了迪士尼一貫的 給每個時代的小孩一個好故事 的傳統 讓每一個小孩或者每一個大小孩 都能在簡單的的故事裡體悟到不簡單的人生道理 長大和離別是人生的必修課 如果我們以正向的態度面對它 理解它 練習它 在那一刻降臨時 我們就能更容易的接納它和它相處 ,5
即使过了24年 整个系列的 魂 都还在  认清自我价值 信任你的朋友 ,5
我们都长大了 长大到懂得我们不是必须被需要 这个系列陪伴我从10岁到34岁 我看到胡迪跟伙伴们挥手道别 眼泪在3D眼镜下狂飙 有趣的是旁边一个跟我年纪差不多的老家伙也几度拭泪 隔着3D眼镜 我们躲起来好像又回到了10来岁,4
"玩具3 对未来的惊鸿一瞥 对过去的最后致意 正好前几天刚刚重温了第三部 所以当我带着这种穿越时间的余温坐到电影院 灯光暗下 银幕亮起时 一切都好像是只发生在昨天 尤其是开篇的转场流畅自然 无缝衔接 都让这部续集从第一秒开始就把观众带回了玩具们的大大世界 电影节奏依旧流畅 故事依旧走心 你看着那些玩具为了一个单纯的目标而历险时 会发现旧时光仿佛从未远离 童年岁短 欢愉有时 一代又一代的孩子们不停长大 但胡迪警长 巴斯光年他们 永远年轻 ",5
那个劣质毛根手工 那第一天上幼儿园的状态 那丢三落四喜怒无常的性格  对孩子的细节刻画简直是完美了 如果你有一个正在上幼儿园的孩子的话 一定会忍不住打5分 ,5
故事精美笑点密集 但没有 3 那种感动了 ,4
有笑点 有感动 只是这样的感动已无法抵达内心深处 已经需要更深刻或者更真实的东西才能触动内心了 有爱的童年真的很美啊 而如何成为一个独立且能够给予的大人是一生的课题 ,3
从一到四 我这么不爱西部片的人 为了一个牛仔哭了十几年 ,4
首先不得不说这一部玩具模型的塑料和陶瓷材质渲染得真是太自然了 尤其是对于这个跨度二十多年的动画电影系列 当我们还停留在第三部对童年时代的告别时 第四部已经升华到了对人与人情感关系的处理 更大的玩具价值观和世界观也被延伸扩充了出来 当然 第三部还是最令人感动的一部 ,5
85 100 也许这是一部童话版的西部世界 玩具从忠于主人转为忠于自我 或许下一部会出现一个有野心的玩具制造商和一个戴黑帽的高级玩家而使玩具攻击人类 对 我就是想看R级的玩具总动员  ,4
讲的是执念的放下 第四部了 还是能挖掘出新的角度 而且在泪点的制造上克制而且到位 很棒 ,4
没有草莓熊所以减一星,4
woody和buzz人设全都崩了,3
牧羊女好酷哦 不过娃娃们太可怕了 吓死我了,4
玩具可比人深情啊 哭得我  结局是个好结局 再有5678 大概就不会那么感伤了,5
见识到世界之大后 牧羊女开拓了眼界 不再是那个易碎的瓷娃娃 胡迪放不下的永远是维护孩子 他的爱与正义 巴斯光年对内芯的声音有了自己的解读 叉子理解了温暖所以不再认为自己是垃圾 玩具是因为爱才有了生命 内心的话是别人的设定 但他们生命的延续和成长不会被鞋底那稚嫩的文字所禁锢 最终他们都会了解自己 找到自己 每个玩具都是自由的 如果被喜爱 就守护 如果被抛弃 就自立 人生从来不是只有一种价值 一种选择 ,4
