comments,star
老子一大早就爬起床 洗头出门饿着肚子看电影 结果就这 一直以来没有办法成为推理粉 原因就在于 太多推理小说也好电影也好 都编得太 编  编得太 圆  为了让各种抓马 冲突 各色人等 能够在有限时段 有限空间内形成 闭环  自圆其说  使得情节 线索的铺垫与设置满到了溢出 又硬拗动机或情节的驱力 通常是大量诡异的巧合来凑  要么就是概念先行 由结果倒推 硬导过程 以致于反而在现实逻辑上闭不了环 看在这帮人个个蠢得有声有色 三星 ,3
全程都在等老头复活 ,3
三星不能更多  太一般了 观影体验让人想到之前看的调音师 悬念倒是有 回味完全没有 群戏可以给负数 每个人物几乎都是功能性的 只有简单的特质 尤其是家族里的那些人 就是面目模糊的贪婪恶意之人 bug也很多 甚至还不如前两年翻拍的东方快车谋杀案呢 也完全没有塑造人物 在类型片里也是快消品 不如回家重温希区柯克 ,3
今年国内上映的最好的悬疑片了吧,5
导演的视听调度还是可以的 看摄影调度就知道这个家里谁和谁有关系 至于007和美队的关系镜头简直就是赤裸裸的告诉你 并不存在悬念或者需要猜的东西 简单粗暴赤裸裸的复古侦探片 不愧是拍星战主题乐园大片的导演 我真的不知道这种赤裸裸的视听呈现算是好还是不够好 好的就是导演在视听技巧上是有追求的吧 至于谎言呕吐或者最后的颅内风暴 观众看着开心就好 7 10,3
1 融合经典英式推理传统与现代叙事手法的侦探片杰作 乡间别墅疑云与各怀鬼胎的家人 人性揭示与撕逼令人想及 八美图   多视点叙事与插叙闪回 反转也玩得溜 2 打破套路的反类型之作 早早揭示部分真相并以既深入又疏离的护工视角结构大部分影片 引人共情并激起悬疑感 政治讽喻和喜剧情节穿插其间 还有自我调侃的 史上最烂追车戏  3 华丽的全明星阵容 动作片与恐怖片老戏骨齐集 007的美国南方口音和表面的迟钝与故作深沉感令人忍俊不禁 而美队的表演更是突破过往角色束缚 4 著作等身的推理小说家与自带匹诺曹属性一说谎就呕吐的女主是两个关键有趣而不乏新意的设定 漫溢着游戏感与喜剧色彩 呼应片名的刀子也令人肾上腺素飙升  9 0 10 ,5
就因为反川普评论界集体高潮了 除掉这点电影连服化道都谈不上惊艳 失望 多扣一星 ,2
还好吧 导演一定看了很多 名侦探柯南  ,3
文本的容量并不止于推理过程像宣布遗产后的家庭撕逼或者各种现实影射 但这不意味着推理环节的薄弱可以被忽视 警察和侦探在未知尸检结果前提下的所有推理全都是让我出戏的 闪回内容超越了本格推理范围内的信息量严重削弱了快感 柯南式解密也没能给到让人回忆铺垫细节的空间 最大的优点是喜剧腔调拿捏得很好 ,3
很多人评价一部电影好坏的标准是 是否有一个剧本 是否会讲好一个好故事   利刃出鞘 就是好故事的范本 人物 拍摄 制作都堪称精品 片子的大多数场景都是室内 通过人物对话 行动来完成 但悬念铺设 人物关系环环紧扣 丝毫不显得沉闷 紧凑的节奏恰到好处地抓住了观众眼球 这个故事就像是通过思维模拟导图完成的 所细节都经得住逻辑推敲 ,5
这几年极为少有的非常出色的阿加莎克里斯蒂式本格推理片 剧本很扎实很很严谨 很意外导演竟然能写出这样的推理剧本 因为他以前并没有拍过方面的片子 由于早早就被剧透凶手是谁 导致我看的时候一直无法集中精力 且悬疑气氛也被破坏 没有铺垫开篇即进入正题 前半小时为了塑造角色剧情有点无聊 但剧情走势到中间的时候 马塔打错药 还是很吸引人 后半部分的反转也很出彩 而且这部片为什么出色就在于把所有线索不保留的告诉观众 几位演员都很不错 个人对这片的关于移民的政治讽刺感受一般 不加分也不见分 美国人为了骂川普特意拍一部电影也是够拼的 喜剧部分我倒是没有get到 8分 ,4
整个观影阶段都在想 老头布的自杀局太漏洞百出啦 老头肯定留了更厉害的后手来把表面上的烂局给填平 结果老头就真的只是布了个烂局 ,3
说实话 没啥意思 只能用规规整整来形容吧    整个故事都很套路 开始没多久就知道到底是怎么回事了 毫无惊喜    以及 007的南方口音好奇怪 ,3
庸俗谋杀剧 就认为一个浮浪纨绔子弟可以瞬间想到这么精致细微的谋杀操作好了 请问他平常玩乐之余是在哪家护理学院接受的药学训练使他获得了在药物标签辨认 解毒知识和静脉推针达到了可以和多年执业的执照护士一较高下的专业素质 ,1
期待值不算高 但还是略失望离场 作为130时长的戏 完成得没有问题 但是作为犯罪悬疑片 几处人物动机及行为的表现都不够说服力 故意没戏找戏 尤其 法医报告 和 说谎呕吐  以致于观影全程都有闻到呕吐物的不良错觉 等几个关键设定也太儿戏了点 另外 能叫得出名字的演员很多 但是个个看上去都怪怪的 一开始还以为会暗藏玄机 最后发现并没有 ,3
蛮本格的 但是好没有意义的一切啊 没有能力还不陪我聊天打针下围棋就会被剥夺继承权哦 而且孙贼口口声声要大家吃屎 结果动机还是捍卫自己和自己的家庭      类似想不通的地方太多了 这是为了戏剧化牺牲了人物的合理动机 ,2
4 5星 名副其实的年度悬疑佳作 在悬疑推理这一类型里 极富诚意又极其大胆地用各种经典设定和元素重新构建了这样一个原创故事 像是邀请观众一并来参与一场需要全程投入的 杀人游戏  莱恩 约翰逊的风格和手法看上去很古典 但在悬念的铺陈与包袱的设置上 又完全不落经典的窠臼 用各种考究的细节满足你的趣味 撩拨你的猜想 但保证你一定猜不对真正的凶手和结局 ,5
我宁愿看2个小时 名侦探柯南 剧场版 ,3
知道肯定有反转 但是中途容易猜到凶手耶 不过能在电影院看侦探片真的特别开心 ,4
大概是年度院线最大惊喜 编导之所以一上来就把真实发生过的全部闪回 大概就是因为他有足够的自信 认为不需要靠这部分来制造惊喜 歧视层层嵌套 最后连侦探本人都被歧视 大概在侦探片里也算 出格  唯一不喜的可能是女主说谎就吐的强设定 如果我是侦探我可能直接会问女主你是凶手吗 她只能说是 这样就至少可以减少100分钟的片长 ,4
不推荐 阿加莎流本格推理 叙述性诡计 一人分饰两角 场景搬到现代 查案用智能手机 案情分享用Twitter 一股浓浓的 神探夏洛克 风 明显比阿加莎逊色的是 虽然家族中有4个人都存在一定的犯罪动机 但剧情一早就引导观众 这几个人都不是凶手 只有这个是凶手  早早把大多数登场人物都排除掉了 我心目中正统的阿加莎流应该是 登场8个人 其中1个侦探 1个被害者 其余6个人轮流被安上嫌疑人的帽子 而且都好像说得通 但真相只有一个 此片的侦探设定也存在严重的不足 居然让一个已经知道大部分真相 不能撒谎 只会说真话的人来担任侦探的助手 华生 的角色 我说你这侦探也当得太轻松了吧 这案子的解决 侦探的功劳有没有占到20  ,2
被悬疑包裹的爆笑喜剧 仿佛阿加莎 克里斯蒂遇到梅尔 布鲁克斯 做到了在前45分钟便交待出案发经过 之后依然有惊人展开 导演莱恩 约翰逊无疑是类型片大拿 处女作 追凶 致敬黑色电影 这部则学到了英式推理的风骨 更把美式移民问题完美嫁接 丹尼尔 克雷格表演脱胎换骨 贡献了极有喜感的 波罗 式侦探 完全可以自成一个新系列 ,5
非常精密 准确 成熟的剧本 加上群星璀璨的表演 高级的电影化技巧 复古的音乐与氛围呈现 直白有力地对现实政治的反讽和影射 组成这部高水平的娱乐大片 几乎可以说是教科书式的案例呈现 它当然很难用 伟大 来赞美 但已经做得足够稳定优秀 ,4
我觉得推理看得少是一种优势 当毛老师已看猜到真相的时候 我还在目瞪口呆 ,5
我们所看的究竟是不是电影 是否仍然重要 ,1
92届奥斯卡最佳原创剧本提名 推理完成得相当扎实 局写得也很漂亮 是属于电影的推理 悬念 吸引力用法是很视觉化的  很多地方可能参考了 一家各婊 没有共识 的 八美图  当然最稳的还是老爷爷 丹尼尔 克雷格扮演一个顶着法国名字的名侦探一度让人挺烦的 可惜最后没再翻一道  ,4
隐藏在向传统英式推理小说和电影致敬的表象下 实际则是对这一经典类型的肆意反叛 像若干不可靠叙述者加一个绝对可靠叙述者这样荒诞不经的设定和近乎赤裸的政治指涉 在硬核推理作品中难得一见 ,4
观感 嫌疑人比侦探聪明 侦探比杀人犯聪明 杀人犯比观众聪明 观众比编剧聪明 编剧比嫌疑人聪明 诶 ,4
一场侦探小说家遗愿和侦探PK的故事 全明星阵容一点都不花瓶 观众完全陷入全知视角的圈套里 反而被剧情的编排骗到了 一个没有麦格芬的悬疑电影 让观众直接移情到嫌疑人身上 与侦探智斗 反套路设计的让结尾更加惊喜 当下主流的价值观显露无疑 可谓是正能量又政治正确的侦探类型片 ,4
欣慰 这种伏线 误导 反转 人物 动机全都达不到及格线的片子都有这么多人看和叫好 说明推理小说的推广力度还不够 潜在用户还是很多的 本格只要稍微丰满一点就可以 难怪欧美推理消失 全都变成悬疑了 今年看过的最烂的片子之一吧 不就毒杀吗 看看圣女的毒杯的逻辑和推理 改编影视 只要把人设稍微圆满一下 绝对比这个强太多了 本来应该给一星 看在老外的演技份上 2星吧 ,2
七月标记 十二月看完 一百分满足  观影过程犹如坐上了一趟充满意外与惊喜的过山车 山穷水复 柳暗花明  既有对古典推理小说的传承 意外与谎言交织 豪门中的每个人都有动机 疑问是 谁才是凶手  也有站在经典肩膀上的创新 过早告诉你答案 同时又用一个接着一个的反转颠覆你的想象 还用喜剧和幽默来消解你观影时的紧张感  三观也很正 人心是把利刃 唯有善良能得到最后救赎  太牛逼了 悬疑佳作 年末必看 4 7  ,4
除了巧合 最难控制的是人心 女孩的心偏偏是一个定数 反过来又成为心术不正之人的不定之数 ,4
整个观影阶段都在想 老头布的自杀局太漏洞百出啦 老头肯定留了更厉害的后手来把表面上的烂局给填平 结果老头就真的只是布了个烂局 ,3
这个电影给我最大的震撼是 不到死的那一刻 都不要放弃治疗 不要让恐惧占据上风 先行了断自己 ,5
标记这种院线片意味着我和直男出门了,2
观影感受极佳 在我看来  利刃出鞘 拓展了悬疑类型的内容空间 打开了原本早已约定俗成的 套路  正如国外影评所说 既是致敬阿加莎 也是全面的反阿加莎  甚至可以说  利刃出鞘 不能仅仅只用悬疑推理电影来界定 否则就过于狭隘了 莱恩 约翰逊很好的掌握了将丰富视听元素聚集并熟练编排的能力 加上一众 全明星 级别卡司的精彩演绎 完美实现了类型片的商业化 破圈  就像导演可能安排了一百个梗 而我只发现了10个 坐等国内上映二刷走起 ,5
说实话 没啥意思 只能用规规整整来形容吧    整个故事都很套路 开始没多久就知道到底是怎么回事了 毫无惊喜    以及 007的南方口音好奇怪 ,3
观影体验颇为愉悦 整部电影略显笨重 既然在中途已经藉由护士的回忆托出了案件真相的基本盘 之后行为动机反常的兰森 加上之前老奶奶看错人的台词 也成为了重点怀疑对象 那么我作为观众的期待就是看最后怎么把兰森跟基本盘给圆到一块儿 而最后揭晓的谜底实在不够惊喜 片中那幅名画是西班牙非著名画家Pere Borrell del Caso的错视画Escaping Criticism  1874   UA时代广场 ,4
竟然把悬疑犯罪电影 拍出了些许喜剧的味道 而且还能get到里面的笑点 这有的难得 片名叫 利刃出鞘  结果影片里翻译的是 致命遗产  感觉有点奇怪啊 整部电影就是一场酣畅淋漓的 剧本杀 游戏 而维系整个剧情的其实就四个人 家族的其他人好像都是充数的吧 总体还不错 达到了预期啦 ,4
期待值不算高 但还是略失望离场 作为130时长的戏 完成得没有问题 但是作为犯罪悬疑片 几处人物动机及行为的表现都不够说服力 故意没戏找戏 尤其 法医报告 和 说谎呕吐  以致于观影全程都有闻到呕吐物的不良错觉 等几个关键设定也太儿戏了点 另外 能叫得出名字的演员很多 但是个个看上去都怪怪的 一开始还以为会暗藏玄机 最后发现并没有 ,3
谜底确实精彩 只不过请这么熟的脸来演这么重要的角色真的好么 几乎让其中的一个大悬念没了悬念 剩下的只是关心操纵手法 ,4
多伦多电影节好评如潮 美队 007别样出演 值得跑趟电影院,5
低于预期 但是确实是一次对于阿婆出色的临摹 带着古怪口音颇为神经质的波罗式侦探 张牙舞爪的奇葩家庭 层层剥开的意外真相 虽然对于推理爱好者老说惊喜不足 但是在这个年代还能看到如此复古精致的推理小品已经足够让人激动了 如果做成系列就更好了 让隔壁的 东方动车谋杀案 看看什么才叫古典推理 ,4
无聊的视角霸权 ,1
 Whodunit 类电影最踏实又最专注的拍法 至少看下来它重新回归到了 解题 的趣味 社交网络的蓬勃发展和观众对相似题材的广泛受众 如若只是单纯着手线索和阴谋会轻易被观众逐渐成长的认知打破和颠覆这份惊喜感 于是本片的做法是尽量忽略掉证据 由回归到简单的人物嫌疑 呈现故事的每一个方向 尽管非常非常支持任何不在漫威型态的Chris 但不得不说全片的重头戏安排在 Ransom 身上 他的演技未有真正撑住最后一次反转所带来惊叹 当然也可以说 人畜无害的桃总就是要这样傻傻的可爱 才让这家 寄生虫 的故事看起来又多么具有讽刺层面上的好笑  ,4
2 5 自作聰明的傻逼白左瑪麗蘇 客觀來說這個製作水平可以給個3星 但結局實在太惹人生厭了  ps  Katherine Langford的餅臉完全經不起大銀幕的考驗  ,2
我宁愿看2个小时 名侦探柯南 剧场版 ,3
罪恶之家与阿婆的混合变体 反向解构古典主义  字面意义上的好看 高完成度撑起了莱恩约翰逊旺盛的创作欲望与野心 真相其实没有那么难猜 但就像甜甜圈理论 总会有出乎意料的部分 而这种出乎意料被以一种妙趣横生的方式消解再造 剧作与群像调度到达了一种微妙的平衡状态 各种迷影梗 推理小说梗也被巧妙地插入 然后最有意思的是结局在幽默的政治讽刺下放弃了更多的反转机会反而走向了一条 反黑色电影 的人性之路  这场游戏没有规则 唯一的规则就是赢家可以自己制定规则  BTW 依旧觉得莱恩约翰逊的最佳发挥是 星战8 ,3
古典主义油画的高贵画风试图掩盖腐朽家族内部的贪婪与污秽 一把把利刃的脱壳而出刺破了虚妄的人性假面 最后只有纯善的光芒得以坐享极致的财富   它不只是一个追逐谜底的杀人游戏 更能使人在探秘的过程中完成自我的成就   坚持看到最后一秒 你一定会明白我在说什么 ,4
这个剧反映了本格推理小说影视化的一个难点 作为小说阅读会很好 但是拍出来就会无聊 当然这个文本很古早结构主义 所有诡计的核心都是关于能指和所指错位的 ,3
故事还行 有阿加莎风格 CE演技真的不太行    ,4
无惊无喜 中规中矩 前半段差点睡着 后半段没啥意外 有时候不得不承认人和人的观感差异真的很大 ,3
这种 old school 的 扎实的 爽歪歪的 原创电影 竟已成为惊喜的少数,5
典型的乡间别墅富有家族各怀心机谋杀案 其实 推理 部分有点弱 名侦探逼格满满地出场 还用钢琴键调教警方 可是高开低走后面并没显出多睿智 最后往铁王座上一坐结案陈词也 美术方面太突出了 房子里的水晶头骨匕首圈画板等都有种暗黑童话的不真实的美感 桃总和寡妇儿媳的服设也特别出彩 ,4
这部悬疑电影要二刷 而且我可以大胆预测它会爆 电影是群戏 每个角色 眼神动作台词等 都值得琢磨一番 二刷必然会寻找到更多有意思的细节 看的过程中我多次猜测剧情走向以及该怎样结局 真是猜不透 等结局真的来的时候我忍不住拍案叫绝 最后回归到人性美 完美且没有比这个更好的设定了 ,5
 A 大概是今年好莱坞最富趣味性的剧本了 严肃 古典而优雅 莱恩 约翰逊拍出了属于美国社会语境下的 寄生虫  本土上流人士的 寄生 实则蚕食 外籍佣人移民的 寄生 却是拯救 再看看现实 这个剧本所要指向的 有关人士 应该非常明显了 尽管本质是 文本电影  莱恩 约翰逊所交出的答卷依旧让人满意 2019 真的是个类型片大年  PS 我一直等着克雷格把车里那杯可乐喝下去呢      ,5
大宅子内仍属于那个时代 你知道的 大家都向往的那个时代 可外面却已经变成了 明明是一个完美的金蝉脱壳却仍会被吐槽史上最烂追车戏 的现代 说到这里 这片子有趣的地方就出来了 两个世界并没有什么割裂感 就算是把手机宝马带了进来 大宅子里的人们仍是在做着同样的事 尔虞我诈的客人们勾心斗角的为真正的主人铺好红毯 所有的恶意与狡诈最终为天真和善良让道 身处外面的我们 想体验一下本格推理的浪漫 其实并没有那么难  只要我们依旧笃信 恶有恶报善有善报 种恶之人 终尝恶果 ,5
说句心里话 像克里斯埃文斯这样的表演真能让人感到愉悦吗 这个故事能够在我的记忆的缓存区里保存超过一周 但我承认 这些其实并不紧要 因为这部电影正如它所竭力追寻的那个年代 那些作品一样 遵守了和观众 读者间的首要原则 这是一场有明确规则的游戏  也许不够公平  但至少保证有趣 当一些电子游戏正在把弱玩具属性运动推向一个新阶段时 我很高兴有电影在做看似相反实则同道之事 这种观赏过程中互有攻防的快感在上世纪末段后确实久违了 ,4
看得出是对阿加莎式侦探故事充满爱意和敬仰的戏仿 同时进行一些信手拈来的当下批判 前半部分也的确高效且极富节奏感 熟稔地带给观众符合预期的娱乐 但文学和影像在呈现方式上的根本区别使得一个在纸面上充满悬念的故事在镜头里马脚毕露 至少我很难享受我比剧情快半个小时猜出谜底的悬疑 本片的解密演讲又特别反高潮 是讽刺了不少 谁是凶手 片的传统 但影片进行到那时我已感到不耐烦 很难再全身心地去享受它的幽默 另一个问题就是每一个人物都是caricature 当然亦可说全片就是要借用这个家庭打造一个美国白人政治caricature 但这也导致与之对比的人美心善移民小护士也变得如迪士尼公主般美好扁平 自我反省 我现在真的难以genuinely enjoy商业院线 ,3
最后站在阳台对着哈兰全家用哈兰咖啡杯喝咖啡  My House My Rules My Coffee  告诉哈兰全家 我才是这房子的主人 哈哈 爽,5
 怎么又是你  问题的关键在这个 又 字上 故事一直在反转 但每次反转都心悦诚服 就是可惜了自己动刀的老头儿 谁不想站在豪宅的大阳台上 端起一杯 my house my rule my coffee 咖啡 俯瞰众生 巴适得很 ,5
遗产外赠 死亡之谜 怪萌侦探 阴错阳差  以往同类故事都见到过的类型元素被组合到一起并配以早早释放的真相闪回是否真能让人眼前一亮 个人持保留看法 悬念与神秘之间并不只是一种将故事模块的次序重新排列组合就能互相转化而戏剧总能无损的简单关系 ,3
虽然是美国出品但整体风格very British 有没有人和我一样觉得全片非常有原版 足迹 的味道尤其是屋中内饰  一句话我太爱了 开头俩黑狗飞奔慢镜头甚至以为在看JB版福尔摩斯 吐槽南方口音可还行,5
3 5 在古典推理片的框架下有一定创新 但我却喜欢不起来 编造设计的成分很大 里面只有特定类型下的纵横填字谜式的形式逻辑 而脱离现实生活的逻辑 比如人物动机难以令人信服 特别是死去的老头 他的遗嘱及将遗嘱内容告诉孙子  包括一些无厘头的设定 一撒谎就呕吐 最后还被自己推翻 算不算作弊 算不算都无所谓因为很容易猜到  就不提实际破案压根不是这样子的了 一部只以反转为价值的影片是令人腻味的 ,4
跌宕起伏 这是对 follow your heart 最完美和最精彩的诠释了 虽然就像片中说的那样 当你拼凑起所有的线索 真相会自己落下来 但即便猜到 最后的结局还是很完美 喜欢悬疑推理的会觉得很过瘾 ,4
线索和暗示足够多了 在近一个小时案件结束的时候隐隐约约可以接近真相了 但故事仍在继续 案件抓着你的眼球 你打起精神 挺直了腰板 不自觉地身体前趋 被戏剧的张力牢牢抓住 国内的观众一定会爱死这部家庭遗产分割的撕逼大戏的 ,5
很有阿婆作品的感觉 看着爽快但回头想想并没有比类似作品高明 不过在没有原作的基础上剧本写得如此扎实也够可以的了 缺憾是侦探的口音 既然设定是个法国侦探就不能找个会说英语的法国男演员来演么 非要让克雷格装一口莫名其妙的腔调 他演着别扭我听着也别扭 ,4
剧本真的厉害 抛开政治话题不谈 案件和诡计又工整又本格 既让猜到凶手却自以为获悉结局的影迷沾沾自喜 也让注意到BUG进而看清真相另一面的推理迷大呼过瘾 ,5
是豆瓣影评的菜  逢烧脑必high 而很多被称为 烧脑 的电影 不过是一些影迷在变相表示 我看懂了  要不然就是太久不动脑了 稍微一动脑就觉得烧腚上 其实我觉得这电影最烧脑的地方在于短时间出场一堆人 有点记不住 而一旦接受了这不过是一堆各怀鬼胎的烂家庭就不太影响观看,3
預告像Poirot 開場似Maigret 看完才發現是不折不扣的Columbo 遽聞劇本靈感源於導演拍 星際大戰8 後收到的各方謾罵 不過看完沒啥領會 感覺反倒更像是模仿 閃靈  用美國最強項的敘事敘述美國最不堪的歷史 ,2
早早就抛出的 真相 最后不过是个误会 一连串的反转入情入理 人物虽脸谱化也还都立得住 乌拉圭移民和巴基斯坦豪宅是对白人豪门的绝妙反讽 同样反讽的是听风就是雨的推理小说老作家 这个世界终究不是建立在 如果A那么B 的逻辑推断上的 白白搭上一条老命 ,4
高阅片量带给我的痛苦在这儿显露无疑 眼前是剧情的满目疮痍与审美的鹦鹉学舌 给了高分与盛赞的观众还真是饥不择食 片头对角色代入的层次感是稀薄的 克雷格仿若俄国英音的腔调有样儿无厚 埃文斯很疏离大概不会演非快餐电影了 片末的逻辑收拢缺少张力缺少逻辑高度 影片一开始像波洛 剧情迭代颇似盖里奇 整体风格模糊且模式化 侦探前段扮帅后段扮傻断档很严重 剧情走向变成了维护好人好报的僵化鸡汤 甚至不比无限反转的调音师 更不要提水准佳作祈祷落幕时 蛮失望 ,3
调换药水调换不了真相 85岁的吗啡让人享受清醒 写了一辈子诡计小说的富豪老人 聪明反被聪明误 一撒谎就会吐的护工小姐 善良的弱点赢的糊涂 表面支持移民政治的富人 夺家产翻脸举报威胁 看穿一切的侦探 审讯不露带血的鞋 最厉害的围棋高手是不下棋 最戏剧的谢幕是弥补过错 机关算尽唯利是图一场空 巴西移民最终占领美利坚  人生一世 像一个空洞的甜甜圈  ps 我要怎么样不露声色的炫耀结局前我想到了结局 ,4
自杀 他杀 自杀 他杀 自杀 他杀      不到最后一刻 真相不会浮出水面 你不知道是自杀还是他杀 ,4
非常优秀的本格推理了 看美队骂街超过瘾 ,5
是好看的 看得出是阿婆的好学生 但无论故事 剧本还是拍摄 距离神作差距还是明显的 特别是留给观众的线索太多了 导致很容易猜出结果 ,3
这个侦探有啥用      以及我的想法 不管是不是用了吗啡 老头子的确是自杀啊 要真是因为吗啡 法医不早就该检查出死因了   我本来还以为这中间还能发生点什么 结果一早接了谜底 毫无乐趣     bb一句 老头子真是狠人 几分钟之类就能下定决心安排女主伪装死亡时间然后立刻抹脖 膜拜    总之没爽到,2
