comments,star
一位推理小说家的最后作品 一个 缺失中心的甜甜圈  一桩事先张扬的谋杀案 一部成分复杂的电影 包括古典主义结构 黑色风格打光 迷影情节致敬以及对时弊的幽默戏讽   建立在全知视角下的闪回段落一步步将观众引入希区柯克式的悬念陷阱 当你以为了解到了案件全貌 导演却说 你所看到的真相 不过是我想让你看到的 蒙蔽的真相   当你觉得一切不过如此时 第二幕却悄然拉开 告诉你 故事才刚刚开始   阿加莎会用文字迷惑观众 导演莱恩则像影片中一说谎就呕吐的护士那样 诚实  我们可以用 阿加莎破案法 猜到 东方快车谋杀案 或是 罗杰疑案 的凶手 却不适用于本片 因为导演让最可能的嫌疑人很快变成了 麦格芬  通过侦探之口 阿加莎笔下的 杀人动机 也成了无用的线索  以阿加莎式的故事完成了反阿加莎式的推理设置 ,4
 这真是有史以来最烂的追车戏 ,5
 LFF 四星半 看完全片后感受太棒 警探小哥拿出正在录音的手机时还有CE被吐了一脸后全场大笑着鼓掌欢呼 brilliant 这样的叙事方法让各种反转不会觉得很刻意 而是同角色一样真像被难以捉摸的生活戏谑了一把 不俗气 不滥情 各种铺垫和互文在故事结束后再回想起来很是有味 反套路反电影思维定式这点做得好永远都会讨人喜欢的 马克杯的首尾呼应等诸多巧思设计又特别有趣 还有就是 也活灵活现地展示了人性凛冽又微妙的消极面 和与之绝对反衬的善良和坚强 这些搭配着悬疑的抽丝剥茧和讽刺性的笑点逐步奉上 好看 整个作品就是一部引人入胜过程精彩的探案小说与优秀电影语言手法的完美结合 使一些细小的逻辑瑕疵都可以不值一提 另 丹叔的口音和表演好逗 CE不需要胡子也能充分展现这张脸不再是美队 ,5
披着 东方快车谋杀案 外衣的美国版 寄生虫  比奉俊昊的隐喻来得更露骨 更直接 也更深刻 ,5
❶建议准时入场 开场以较快节奏呈现人物关系 铺设杀人动机  ❷钢铁侠之女是美国队长的表妹     ❸英国特工智斗美国队长  ❹利刃 拼盘 也好 甜甜圈也罢 把血检报告作为推理的遗失环节及最终利器 显得故弄玄虚 黔驴技穷  ❺ 全都留给蔡根花宝贝  ,3
不是美队不是007,5
一个好人有好报的故事,5
全片最佳  老奶奶       ,4
推理悬疑片难得拍出这么温润舒服的感觉 看完故事 爽快和推理的快感都得到满足 不过之前被友邻的评论灌输了有反转的预期 导致顺着女主收到信那里得出了结论之后一直在期待 四星半推荐,4
难以想象电影院里忍受两个小时看这破玩意 豆瓣评分越来越不可信了 明明1个小时说明白的非要扯两个小时 剧情套路笑点违和 演员演技尴尬 是全体演技都尴尬油腻 不管哪国咆哮帝的演法都戳雷点 恨不得有 键 我还以为全家都得来一遍推理呢结果到儿子那就完了  也太简单了狗屁反转哦 007全程逼王演技看见了杨洋的影子 ,2
阿加莎式的大宅凶杀案 非常适合感恩节看的商业片 故事执行得挺好 前面埋的信息后面有用到的那种舒服 悬疑反转确实没特别impressive 任何一个看了足够多侦探小说的人都有足够的敏感度能察觉出来 Daniel Craig又睁着他的蓝眼睛去Christopher Plummer家查案子了 上一次是瑞典 这回改波士顿 Chris Evans的演技真的太一般 在这个cast里更加明显 ,4
纯粹的推理电影是没法赢得高票房的 悬疑加喜剧才是推理电影的正确选择  利刃出鞘 剧本写得太好了 案情与娱乐两不误 乐创引进这个电影是独具慧眼了 点赞 ,5
Hugh did it的梗是王建国写的吧,3
看这片看到爷爷出来时候 就感觉如果龙纹身女孩如果有续集 DC真是无比契合小侦探的角色了XD,4
好看吗 ,1
观赏感很好 就是美队帅出了违和感 把邦德都衬托到尘埃里了 ,5
凶手是谁决定整个电影的质地 这部既然要走娱乐片范畴 凶手就不可能不是大明星演的 这不是 杰米 李 柯蒂斯是凶手 能轰动世界的年代 那究竟谁是凶手会轰动世界呢 太好猜了 导演最大问题和多年前 环形使者 一样 拍不出人物的光彩 具体来说就是演员都只是通过妆来完成角色 此外没在任何地方下功夫 反而还会显得妆假 明星云集却视觉不美 因为是个体罪案而不是揭露群体 注定没有乔丹 皮尔那两部那么尖锐 它对恶的探知 是仅到娱乐片大众所能接受的限度为止 这也造成它在态度上的中庸 配角群的戏份安排太混乱 每人都只剩人设 大家都在演 我看起来像凶手又不像  全是给观众看的卖相 没人在戏里 够做作 阿玛斯不是什么不得了的演员 全片围着她的紧张 疑虑 害怕这些表情拍 好无聊 装叉的装叉 卖萌的卖萌 平庸的平庸 ,3
人长得好看真的可以为所欲为 因为如果美队让我吃屎我可能会先问是不是他拉的 ,5
好看 剧本难度很高 演员都在线 算是对阿婆风格还原度超高的致敬之作,4
4 10 预期不同吧 原以为是 看不见的客人 那样影像贫乏但剧本精彩的电影 结果它剧本也没有精彩 笑点尬尬的 ,2
其实立意说穿了也就一般 推理  应该属于沙雕推理吧  ,3
导演对观众的态度比较暧昧 这种表达让我看得怪怪的 比方前面在一个很安全的状态下突然给到鞋上血渍的特写 观众期待是但愿之后不会被发现 一般导演会安排险情并最终影响剧情走向  但这个导演在一切搞定以后让007说其实他第一眼就看到了 这个处理太令人迷惑了 当然如果说这是导演的反类型的话我也无话可说 另外拿一堆南美国家来怼川普蛮有意思 可能他自己也分不清厄瓜多尔和巴拉圭的区别吧 ,3
精彩 故事考究得不像是2019年的 但看看设定背后的政治隐喻 又叹气是真的2019 移民恐慌在多样性的伪善play中完成了某种自我讽刺 核心问题总是谁剥夺了谁   而被符号化编码的仍是善良 诚信 白手起家这些传统美国价值 只是在今时今日 这种张力已经不可能脱离族裔流动的语境去呈现 说政治正确也好 寓言也好 总之不能让我免除怀疑 我总觉得 如果integrity来自设定 是无助于与更复杂现实的勾连的 这部电影给我的满足更多来自阿加莎式的剧本 而非影像 当然也有铁王座之类的埋梗  人物的表演状态极顺滑 带有喜剧效果 也因此少了些沉在现实里的痛感 或许 这个时代人和人的恩怨 以及对它的态度 已经无法匹配推理所需要的强度和纯度 ,4
氛围不到位 想象一下希区柯克会怎么拍 ,3
剧本扎实 人物和情节都好 层层包裹的真相 不断得以延展的剧情 恰到好处的喜剧元素 以及巧妙的政治议题 算是近几年来非常优秀的悬疑推理电影了 ,4
 82 剧本确实厉害 通过上帝视角的事实陈述让观众消解掉对twist的期待 赋予最后真相以更大的冲击效果 而社会元素的融入也是对这一精妙悬疑文本的点缀 讽刺感恰到好处 ,4
9  TIFF 2019 很惊喜 竟然在多伦多电影节看了一场电影版的上流家庭的狼人杀 相比很烧脑的悬疑推理剧 这是一部很全新的悬疑片尝试 风格很独特 结局也意想不到 期待引进国内 想二刷 ,5
门槛非常低的观众友好型爽片 是IP和续集肆虐的市场上的一股清流 老派而古典的推理电影 稳重又严肃的多重反转 同时又是非常可爱的 人物带一点漫画式的夸张 莱恩 约翰逊真正站到了巨人的肩膀上 是陈思诚踮起脚尖但怎么也够不着的高度 熟悉007和美队的影迷 肯定会在这种反差的角色设定里获得极大的快感 并没有往深处严肃探索人性 但用类型技巧拍出了那种过瘾的张力 ,4
属于从题材到剧情到表演都毫无惊喜 看完后也没有任何回味的电影,3
重点在于一家人的打嘴炮和各种撕逼 美国宅斗的狗血精彩程度完胜破案     ﾉ,4
功底扎实 妙趣横生 ,4
利刃出鞘 方知赢家输家 真相揭晓 歌颂人性美好 说谎但不呕吐的助手不是好华生 年度院线片top3 属于电影层面的内容几乎无可挑剔 技术向的构图 运镜 布景 服装全部拉满 以007坐在黑暗角落对谈女主角一场戏为例 充分利用阴影和灯光 先闻其声后见其人 若隐若现的面庞充满了迷人的老派悬疑片气息 文本向的故事架构用心 区别于阿加莎式推理 在前三分之一时间就揭晓大半真相后仍然利用家庭成员之间错综复杂的关系做文章延续悬念以丰满后续剧情 表演向是本片更夺人眼球之处 有多久没看到美队在镜头前满嘴喷粪了 唇枪舌剑的全明星阵容比前年的 东方快车 还耀眼 硬要找茬的话就是主题由阶级对立上升到政治层面后的讽刺略显老套刻板 结尾众人仰俯视的定格虽然幽默 但太直白 留下咖啡杯特写就好 ,5
狗叼木板 最lame飞车 移民之罪 富不过二代 全员杀人动机  侦探 即 凶手  CSI KFC和呕吐华生 谁也没读过的 万有引力之虹 躺枪 a donut within a donut  导演Rian Johnson发财有了资源后 反而不敢像早期几部片子那样把电影语言玩到癫 但弄出个这么工整old school的侦探类型 依旧开心,5
甜甜圈中有个洞 洞里有个甜甜圈 洞里的甜甜圈中有个洞 洞里还有个甜甜圈 ,4
白人都是吸血虫 拉丁移民善良正直 我特别不喜欢这类政治隐喻 之前的终结者也是的 救世主非得找个墨西哥人 还要偷渡去美国 几句话一说开始领导拯救全人类 这部里 非法移民的女儿得到了美国富翁的全部资产 只有她人善心美 其他家人全都吸血奇葩 呵呵 这个设定我真的是  200114 字幕版复习 原来是乌拉圭移民 逻辑捋的更顺了 但还是没有很喜欢  ,3
引人入胜 鞭辟入里 开场多视角审讯 理清头绪的同时顺带扰乱视听的功效 还能让观者身临其境的参与和讨论 简直是带入并封锁的佳法 让所有角色都符号化 以细节服务于剧情 随着时间的推移 真相呼之欲出 冲突就愈发浓烈 紧凑高效 反转重重 虽然在内容上平淡无奇 但在形式上技杀他法 悬念设计和诡计布局可谓顺理成章 将现实的议题解构于虚拟的案例 让你知道人性的黑暗随时会让你胆寒 每个伏笔都给出合理化的诱因并适时出人意料的运用和反转 背后还皆携带有政治层面的象征意义 毫不掩饰的嘲弄和讥讽 大起大落后还能让一切回归人文关怀 给美好的人性最终做出补偿 布景 色彩搭配 构图和配乐都十分考究 属于类型化极致的优秀案例 这是一部黑色幽默的当代寓言 更是一出政治色彩浓厚的时评小品 人性试炼 精妙绝伦      ,4
一直觉得Rian Johnson很靠谱 这部也算是好莱坞近几年来最本格的推理片了吧 Ama de Arnas的角色都太楚楚可怜了 简直是真人小鹿斑比 ,4
真的超棒 华丽 严谨 细节到位 伏笔绝妙 而且那座房子简直太棒了 是我的dream house ,5
好人有好报系列 但美队实在长着一张胸大无脑不太聪明的脸 ,4
喜欢耶 好久没在院线看到如此开心大笑外国片了 观感非常好 被007和美国队长强力圈粉 都是非常有魅力的演员 只是以前演的那些东西比较程式化 性格平板所以很难发挥这种光彩 现在有了立体的空间 塑造了比较复杂的形象 加上故事也很能烘托他们的气质 真的是感觉到他们是优质偶像 养眼又有光芒 影片非常好的一点是三观非常正 具备老式推理的结构 却有年轻的节奏并着力在一些好玩的点上 大大方方地交代了一部分事实 留着 甜甜圈中间的洞 再去发挥 所以内核并不老土 合理性有值得商榷的地方 属于那种看的时候只要跟着走就会非常爽 看完一推敲 为什么坏人要这样 好傻  配笑cry表情 的那种 不过观看过程中的爽感做到位了 加上一些语言梗和美术的优势 真是赏心悦目 匕首王座真是太有气势了 puke的设定也好好玩 大笑好几次 ,5
亮点很多 比如说演员 但女主角反而不是太强 克雷格倒是很有意思 推理过程很好玩 虽然开头的死亡理由一点都不充足 一波三折的过程很有意思 既有猜到的地方 也有猜不到的 幽默好玩的成分也多 所以整体风格并不冷峻和悲伤 甚至亲友的死去带来的悲伤也几个镜头就淡化过去了 所以是一出推理游戏 讽刺成分很强 对当代美国和某些阶层的人 一说谎就吐的设定太好玩了 她的选择和做法也是非常重要的 值得玩味 ,4
院线片不相信友邻系列,3
①看简介海报以为是 高斯福庄园   八美图 的暴风雪山庄 turn out not②头尾重中间稍疲软 总体还算整挺好 市面上很久没出现这样的古典庄园 全员恶人推理爽片了 美术道具组真烧钱 ③old school风格里掺进网络新兴产品热词 美队拍的是抖音  有种故意违和的喜感④笑点高级 不少自反梗 最烂追车戏啥的 当然策划by推理小说家本身就是大自反 道具与动作的呼应有巧心 吐槽监控录像带像日式恐怖片笑死⑤英国佬口音模仿秀 脱英腔往土土肯塔基口音整 高雅欧洲腔爱好者莎婆能气晕⑥又黑美帝移民政策 说把护工视为家人 那她到底来自厄瓜多尔 乌拉圭还是巴西 ⑦与Thrombey接近的单词thrombin 凝血酶⑧我相信杰米李柯蒂斯能生出长美队这样的儿子 ⑨但诡计核心为钱还是落了下乘 为尊严正义才是高 ,4
有点厉害 鸡汤却一点不狗血 反转节奏 细节安插都特别棒 工整却一点不死板 群像人物每一个真是塑造的都太好了 要推理有推理 要反转有反转 要吐槽有吐槽 极其愉悦的一次观影体验,5
这是一部散发吐酸的电影 隔着屏幕透了多来 随时担心女主吐 ,3
被吹爆的这个剧本 难道不是一个上乘推理剧本应该有的水平 大明星群戏不是1 1而是1 2 用力过猛的尴尬还是有些溢出银幕 失望离场 主要失望自己的英语水平 ,3
比平原上的夏洛克好看 动摇的人性比土味一根筋有说服力 而且即使恶人也有舒张的个性 自私的自由 和不觉得自己的权利和尊严会因为作恶被剥夺的信心 而不是每逾矩一步都要掌嘴 只能在老大哥无微不至的注视下做个本分的韭菜 两部电影对比来看 物质优越不是决定性的 但注定遥遥领先 精神被控制 思想被囚禁 则可以让人活得没一点精神气 ,4
虽然是美国拍的 背景也放在美国 但从里到外都是英国风 故事元素和叙事手法处处可见阿加莎 克里斯蒂的影子 老宅里的离奇死亡 遗产与家族纷争 每个家庭成员几乎都有嫌疑 也都道德可疑 最后遗产落在道德最清白的边缘人身上 没有DNA检测等科技手段 指纹对破案也没帮助 最后都是靠侦探那种19世纪式的逻辑推理 最后 对凶犯或死因的解释会有一点让人意外的包袱 怎么说呢 中规中矩 非常老派 可能这就是它有意打造的 就像一件仿古作品 适合对这一路风格感兴趣的观众 ,3
能在电影院看到何其之兴 在传统推理这个层面 近年最佳 作为悬疑迷在二十世纪第二个十年里最不能错过的推理大作之一 如果说今年的片子小丑是以演绎取胜 利刃出鞘就是绝对的剧本王者了 唯一的遗憾就是说谎呕吐这一点 出现在传统推理故事中还是显得 有点超现实 ,5
为了美队看的 剧情悬疑性还行 3 5星 虽然美队出场的时候就觉得他是反派了 第一次发现他抬头纹还挺多的 ps 虽然小说家老头的家人的确都性格恶劣 但是我还是觉得他只是和女主相处得还不够久才会觉得她好 任何人只要相处久了都      ,4
我真的长久以来对推理片不为所动  所有的逻辑推理都比不上人物的一点点小成长来得痛快 这些复杂的人物关系和角色弧光都是为了反转而存在 繁琐且不自由 我不喜欢 ,3
美队说得对  会下围棋的人真的很厉害 ,4
反正比上一部东方快车更阿加莎 剧本蛮周到的 虽然一半时间不到就揭示了死亡真相然后谁是坏人特别明显但还是阴谋叠加意外保留了不少猜不到的 把故事又讲了一小时 伏笔都圆上了 有那么点川普时代仇国境以南症的点评不过还是案件的娱乐性为主 幽默细节 乐颠颠把罪证叼回来的狗子 ps克雷格的南方口音太尴尬了 我发现了 南方口音可能是通常美音没问题的英国演员的死穴 ,4
像很多破案类电影神反转的结局揭示真相 剧情觉得巧妙的是用家庭成员矛盾融入了美国的政治现状和社会问题 有强烈的现实意味 ,4
好好看哦 好想知道美队被抓走时候那件大衣是什么牌子 也太拉风了吧  周中不学习一个人跑出来看电影 所以觉得更好看了 ,5
被称作家人的女护士来自哪里 厄瓜多尔乌拉圭巴西 巴西讲什么语 这家人才不关心,5
因为顶着阿加莎式推理电影的光环在营销的 必然也要来做一番比较 说真的 唯一的相似就是英式的自鸣得意 当然 这是美式的 以及舞台剧一样的演绎 问题是 拍摄方式太商业了 导致了舞台剧的表演显得格格不入 个人觉得 这一点上是失败的 但是剪接还挺不错的 是我喜欢的利落的风格 故事本身 对我来说有点乏味 整体一般 这年头的电影 期待的太高 就必然是这个结果 ,3
有黄金时期遗风的推理 如果把中间追车和接头的部分去掉 甚至可以当做话剧来看 通过神态与小动作精准展现出人物的个性与情绪 扎实的三段逆转 虽不华丽震撼 胜在叙述稳健而少有破绽 一些小细节很让人喜欢 棋高一着只因无心求胜 这个很虚竹的理念用来照应最后引出真相的关键并不违和 ,4
3 5 很浓的复古推理味道 可惜有点高开低走 铺垫好了每个角色特征后就闲置了 剧本还是无法兼顾群戏里的每个角色 有点可惜,3
比想象的差一些 没有被惊艳到的感觉 但也还不错 老爷子真是太可爱了 为他的死伤心 ,4
都挺好 除了丹尼尔的口音,4
RJ這些年很花心思為類型電影注入意識形態 本片就是意識形態大片 這家族就是美國本身 成員幾乎遍佈了左中右所有光譜 RJ以最娛樂化最通俗的語言將trump移民政策的惡以右派最惡毒的邏輯推演到極致  白手起家 不就是美國人祖輩的核心價值嗎 而當一個移民要來分取資源的時候 RJ就把這樣的情境內化到一部推理電影裡 當然還有那些故意扔在電影裡的流行文化梗 整個看起來很讓人開心 另一點是 在iPhone twitter 直播的時代 怎麼去做一個與時事鏈結的古典故事 也是一個非常好的示範 而一切的基點是 在這一則政治寓言裡 導演低到塵埃裡 而且還很善良 ,4
终极悬疑 玛尔塔到底哪国人 乌拉圭 巴西 巴基斯坦 厄瓜多尔 ,4
70分 影片自始至终都安守本分讲一单简单的谋杀案 像是一块好看可口的蛋糕一样 在各方面都力图做到最佳 明星阵容的班底 华丽又有细节的布景 构成了相当大的优点 虽然以古典本格的案件出发 由于发生的环境和作案方法及动机都有阿婆色彩 但我个人觉得它更像是东野圭吾对于阿加莎的一次模仿 把人心动荡铺排在反转 却又没有直接走入机会 两个点我不太喜欢 一是各家庭成员其实没有被好好表现 他们几乎是一个团队形象 二是女主的呕吐设定过于强设定而变成了特别有用的关键推动 ,3
始于阿婆式的乡间别墅命案 终于美国阶级社会缩影 沿着疑窦重生的古典推理之路 不断质疑 掩饰和推翻 只为让明嘲暗讽的利刃出鞘 虽然商业电影卡司自带剧透 但真相已然不是最终目的 重建才是最大趣味 批判嘲讽才是一直高悬于顶的达摩克利斯之剑 美国人一代不如一代 移民成了白人精英的主宰 处处高级黑 瞧瞧这一大家子吸祖辈血的戏精 可以和 寄生虫 互换片名了 普鲁默贡献了本片的泪点 小说家给自己的人生画上了戏剧化句点 为他叹息不是因为他死 而是因为本可以活 ,4
 评分这么高 2 3的时候开始胡言乱语了 剪辑零碎 剧情刻意 结束的时候没有一丁点爽的感觉,2
剧作上的胜利 讲好故事真的可以改变命运 悬疑推理片的教科书级别作品 唯一遗憾是 老头不由分说就抹了脖子 对自己真狠啊 只能理解为他为了把自己变成故事本身殉道啦 ,4
有悬疑 有笑点 美队演出了纨绔子弟的感觉 甜中带点坏 ,4
拿掉拉美移民 边境问题等花里胡哨的白宫特供梗 推理设计的确有花功夫 不似阿婆一个参天大诡计震慑全场 风格偏奎因 堆叠细节导出多路真相 在合理区间做序列选择 唐探都能撺掇成IP RianJohnson更应该往系列方向走 ,4
在现代社会的环境中恢复了古典推理的荣光 观影过程非常畅快 真的很久没看到这么精彩的推理电影了 特别是最后真相揭露的那一幕 无论是场景还是对话都充满了戏剧味道 当然仔细想想诡计方面还是有瑕疵 不过这部电影确实是偶然性和必然性有机结合的上佳作品 ,5
3 5 古典犯罪放在科技時代漏洞還是太明顯 所幸整體節奏不錯 除了最後的主題和反轉沒什麼意思 丹尼爾去演神探亨特這類老派偵探可能比007吸引人,3
极其稳同时又有些许惊喜的作品 在这类推理类型电影能拿出来对标的是新版东方快车谋杀案水平的现在 这样的成品实属让人眼前一亮 同时这片可能是数字拍摄后期模拟胶片效果最好的电影之一了 怀疑可能是印到胶片上再扫回来做的吧 几个出字幕的镜头看起来甚至是用胶片冲印做了个光学特效印上去的 ,4
原以为会是暴风雪山庄模式的单纯套用 没想到自编自导的莱恩 约翰逊在致敬经典的基础上大玩颠覆与创新 划开案件真相的利刃在前半段的山庄内初查后便已出鞘 俨然赋予了观众上帝视角 然而一切却随着此后山庄外的剧情推进 锋 回路转 进一步剖解出真相背后的重重隐情 影片内容丰富 格调复古 配乐出彩 节奏极佳 剪辑调度颇为惊艳 群戏亦是可圈可点 服化道精致华丽 恰到好处的黑色幽默更是令人忍俊不禁 利益面前一个家族丑态百出 发迹背后一个国家原形毕露 透过精心设计的结构和不时流露的喜感 讽刺人性与影射政治哪样都没耽误 如今能在院线看到这样一部酣畅淋漓的高品质原创悬疑片实在是一种奢侈 而下一次又不知将会是何年何月 ,5
最后Chris Evens那段发言是不是从川普本人推文里节选的,4
又是那种看完被唬住但是细想又漏洞多的片 不怎么想玩推理但却大有兴致讲政治的Rian Johnson最后却把自己给绕进去了,3
事实证明请不要随便自称 烧脑  整个推进都很功利 包括对每个人物的塑造从头到尾带着刻意 反转的力度还是弱了点 缺乏 wow 的那一下 ,3
3 6星 美队x007这种阵容你还要啥自行车 1 完成度颇高的短篇推理小说 2 十个字概括本片剧本 说谎没糖吃 善良有钱拿  3  只要有心 相同的物证可以讲出不同的故事  4 结局算意外 反转细节足 推理   勉强严丝合缝 5 美队的睫毛是真特么浓又长呀 就像达坂城姑娘的辫子一样 6 为什么本片每个人的法令纹都那么深 ,3
从克里斯蒂到 劳拉 到 双峰 的传承 连甜圈圈都齐了,5
整部电影一直弥漫着一股复古的情调 那座装饰光怪陆离的老宅配合着这个侦探故事 无不让人回忆起那段属于福尔摩斯与波洛的黄金时代 其中的种种细节让人回忆起柯南 道尔的经典名篇 而在故事结构上更是是高度模仿了暴风雪山庄模式与 罗杰疑案  在情感上饱含着阿加莎的温情 但老实说 安乐椅神探的推理演绎 脑补 成份过多 多少失去了推理的乐趣与逻辑的严密性 凶手最终认罪还要靠激将法来搞定 这就让人很失望了 这也是我对本片的不满之处 本片还有不少玩味之处 细节上的处理很是缜密 强烈建议细看  另 我要是有机会接近安娜 德 阿玛斯 我就不离开她了 美队这人真没眼光 活该单身大半辈子 最后要靠穿越才能服下那颗后悔药  ,4
像读阿婆的小说 像看波洛在办案 就连voila都在模仿 但是这个侦探缺少波洛的可爱和小聪明 怎么说呢 像是福尔摩斯之后的 丝之屋  当然还是要比 丝之屋 优秀一些 ,4
比想象中要好看 看过很多阿婆式风格电影 这部算是阿婆式创新 看到了导演更多不同尝试 很喜欢007一口英式腔 听着很是过瘾 美术上的精致和强卡们的演出也加分很多 值得二刷,5
