comments,star
1 论煽情韩国电影真的是一流的  2 爱上长颈鹿的演技了  3 请善待每一个残疾人 ,3
弱小的人可以相互陪伴 真事改编 二十年的陪伴可以抵过被抛弃的血缘关系 李光洙的演技比想象中好 没能把申河均利用好是影片的一大缺陷 在故事中减少了很多刻意煽情的部分 到了感人至深的部分才会忍不住流泪 ,4
平实朴素 段落精准 无需刻意呈现 观众自知感动 ,4
光洙太太太可爱了 ,4
演员都好喜欢,3
光洙真的太棒了 看到他哭的时候我也泣不成声 ,5
被长颈鹿征服了,4
李光洙的演技是真的好啊 两个男主角都不一般 共生依存的故事 还是戳中心里最软的部分,4
看到开头就会想到结局的片子 还是如所料那般哭成了狗,4
温情的陪伴,3
想着借这个哭一把的 但是剧情太套路了最后还有点想笑 两位男主的演技太可以了加一分  ,4
剧本非常弱 为了让东久在法庭上选妈妈 硬造出东九的误会 就通过看到哥哥跟别人有说有笑 牵强到无语 然后制造了这条线却不走到底 东久要离开时又好像不知道为什么自己要离开哥哥了  只重视戏剧走向为了虐而虐为了煽情而煽情 却罔顾逻辑上的混乱 最后的HE真是简单粗暴到无语 好似童话故事的一句话结尾 最后两位王子幸福的生活在一起了 over ps李光洙演的太好了,2
别让光洙演傻子了 他太像了,3
小傻子的内心世界都挺丰富的 光洙真棒呀   道理我都懂 但为什么大家都爱游泳 ,4
主题是 需要  ,4
嘿嘿 有点半假半真的,2
东久一个人回到责任之家时候 我跟着嚎啕大哭了 ,4
差点把自己也看成了智障 两主角一个像赵四老是抽抽 一个像李逵好像随时都会站起来抄起两把斧头开打 怎么看 我不是喜欢李絮真的看不下去 感人是感人 得看你对戏剧化处理的耐受程度在哪里 我个人基本上免疫套路骗同情 哪怕 我是山姆 这样的催泪经典 我也会觉得有选角不行演技不行这样那样的违和感 越是贴近生活的悲剧内容我越是倾向于纪录片或者伪纪录的形式 不够自然的戏剧化处理对我来说总是太多设计痕迹 ,2
李光洙是个好演员,4
 光洙是本色出演  啊哈哈哈 看到这句话的时候笑屎了 然后电影是笑与泪水交织 弱小的人因为弱小相互帮助 相互利用 相互成就 因为弱小而更加需要彼此 其实是彼此心目中强大的家人 PS 韩国电影真的比中国电影领先很多吧 ,5
就  一般 ,3
看到李光洙就想笑   電影還是可以的,3
李絮真好啊 身材好 还会唱歌 片尾曲  ,4
故事可能美化社会太多 考虑到电影创作需要也无可厚非 可以看的出导演的实力还是有的 不仅表现在许多细节的安排铺垫十分精炼 叙事结构最后的补充揭示 对于选择不同生活的客观态度 还表现在人物的设置 游泳女教练的设置太重要了 同龄女性的存在增添了影片的活力和柔性 也从一个非残疾却也在生活中有不少委屈的普通人的角度 思考了人生的问题 让观众们有更强的代入感 纵观中日韩电影 兼顾娱乐性和思考性的韩国电影真的是其中最好的 非常佩服韩国导演 能够将普通人生活中的细微之处抓住并呈现出来 唯一大的缺点也只是是煽情电影不可避免的通病 瑕不掩瑜罢了 后面看一下恶人传并期待一下最想看的寄生虫 对 就是这么喜欢韩国电影 ,4
李光洙的表演神了,4
标为喜剧大概只因为是happyending吧 ,4
李光洙演的如此自然甚至让我觉得这就是本来的他   ,4
最后游泳比赛那里还算有泪点 但几乎全是好人整体比较简单 对那个用嘴就能动的轮椅更感兴趣,3
我们回家吧   他们 只是想要个家 而家 最重要的 还是人,5
哪裡是喜劇啦   ʷ  ʺ ,4
弱小的人互相帮助才能活下去 兄弟情满满 好会拍啊 ,4
 现哥推荐 ,3
弟弟2次看到哥哥会被照顾得很好 才会选择在法庭放手呀 ,4
与韩国现实题材电影相比 中国还有很长的路要走 一部 我不是药神 就让中国观众大声叫好 但其实看看邻国 就能发觉 现实题材电影并不是一定需要多么复杂的情节 多么宏大的主题  而是把握好人物和情感 总足够的真诚 就能感动人心 ,4
故事有 无法触碰 的影子 李光洙真的演技很好啊,4
题材过于童话 残疾人是做不到相互照顾的 但韩国人偏就能把题材演绎好 并且又有泪又有笑的 ,4
百变光洙 我又哭了 ,4
不错 韩国导演很会把握感人的细节 ,4
主要是温情 两位男主角演的还可以 所言所行都符合各自的性格 其他倒没什么 ,3
从黑白配的 触不可及 到黄秋生与菲佣的 沦落人  韩国基于真实故事将 轮椅 系列再次升级 残障与智商的一次完美搭配 这才是真正的最佳拍档 本片在煽情部分相当克制 没有刻意的狂撒鸡汤 虽然没有在笑中泪目 也感受到了那份温情感人 另外给15分30秒的那个填表女职员的演技点个赞 印象深刻 ,4
哭惨我了,4
wuli光洙真的越看越适合帕布角色 鱼 帕布23333贼合适,4
李光洙老演傻子不腻吗  把整出剧水平拉低了,2
设定挺好的 就是觉得故事还是简单不够惊喜,3
俩男主演技五星 ,5
三个泪点 1 相依为命的两个残障儿童 照顾他们的神父去世 2 两条线索 游泳和母亲争夺抚养权 3 故事彩蛋 两个人性格的背后 自杀的线索 绝望的生活背后的希望 ,5
一筐猪傻子演得还真可以  ,4
谈恋爱都没这么甜的 ,3
无记忆点,2
韩国电影已经完全成熟了 并且独树一帜 这么一部电影 处处是套路 每一个情节和细节都是设计过的 可是设计得很精巧 直击人心 哪怕明知道是煽情 也依然会被感动 除了结尾有一丢丢拖沓 别的都挺好的 看完觉得很幸福 韩国影视好容易让人有幸福感哦 ,4
题材不新鲜 但光洙的表演和喜剧效果都不错 至于煽情 韩国人拿手好活 总的来说值得一看 ,4
泪目 ,4
这该死韩影 怎么老是能正中并狠狠戳我的泪点 光洙演的智障简直本色出演 捂脸 ,5
简介为什么要骗我 告诉我这是喜剧,3
还行吧 中规中矩 残疾人自强自立 ,3
韩国人在刻画小人物当面真是无敌了 多简单的故事也能把你眼泪给煽出来,4
Inseparable Bros 2018 1080p WEB DL H264 AAC NonDRM,3
没意思,2
韩国人自以为傲的感情牌都不会打了 ,2
我们在一起就是家 ,4
人物关系做到了极致and巧妙 李光洙真的很不错 ,5
8 3分吹过头了 两个主演演技还行 但是其他的就很一般了 而且又是看了前面就能猜到后面 然后结尾强行反转强行煽情的韩国电影老套路 这剧本放我国就是票房不过3亿口碑一般稍好点的命,3
李光洙牛逼,4
同行的人说 李光洙演技真棒 演的真像  演   像   明明是本色出演 ,5
无感,3
你是我的身体 我是你的大脑 没有大起大落的情节转变 所有的温馨和温柔都在日常的平淡里 被人关心 被人在乎 被人爱的感觉真好呀 ,3
与 触不可及 一比 这不是喜剧啊,3
轻松 幽默 不过度煽情 挺好 肢体残疾一级的申河均与精神障碍一级的李光洙从小都住在一个福利院 二十年过去了 他们习惯了成为对方的大脑和四肢 两个人生活上互补得很好 精神上也相互依赖 福利院的神父去世之后 没有钱维持福利院的运营 他们和福利院的伙伴们被迫分开 李光珠的妈妈忽然想要把李光洙接到一起住 虽然二十年前是她把儿子遗弃的 两兄弟不得不分开生活 电影里有感人的桥段 也有很多恰当的搞笑穿插其中 使得整部电影的观感特别温馨 申河均和李光洙演得不错 还有我喜欢的 小公女 的演员李絮 值得一看 ,4
相比起来海洋天堂真是弱爆了,4
是好看 但是被抬的过高 看着有点小失望 感觉还是有点说教式 同类型的 触不可及  就自然多了 没有那么多煽情的前段但是让人回味无穷,5
好哭也好笑 没有很刻意煽情 反而加了很多有趣的生活片段 光洙太棒了 是命运的羁绊让我们成为永远的家人 ,4
总有那么一刻会触动你的心,4
结局真好,4
哥 我們回家吧   ,3
有灌鸡汤的成分 女主忽略手机冲进游泳馆也是bug 但 两位男主的演绎实在出彩 光洙躺在废弃的责任之家那段也太好哭了 聚焦的这几个群体让人看到另一种人生 弱小亦强大 ,4
韩国电影就是这样 越套路 越能翻出花 故事能一眼望到头 但是申河均和李光洙真的是整容级的演技 ,4
感动 欧巴帕布阿尼哟 李光洙凭此片还入选青龙赏 真人真事改编哦 很难说他们是不是天生一对 但他们之间的感情也许只有他们自己最清楚 突然发现好像那些感人的片子 很多都是真人真事改编 是不是因为如果不是真实发生过的 仅凭编剧去构想这些感动的瞬间和细节 也许会很多bug而不能令人信服 也许吧 此片比 触不可及 更为难能可贵 ,4
有点干,3
两位男主演演技太好 扎实的叙事和结构 把平凡的温暖演绎得引人入胜 把可预见的套路演绎得具有可看性 韩国温情电影的水准作品 ,4
哥哥真的演技一级赞啊 太自然了 脑性男 光洙也是不负众望 游泳和八块腹肌真的身材超棒 演技也在线 李絮好好看 演技超棒 主演们的cp组合也超有爱 游泳池戳中泪点 很感人 最后的结局也很温馨 很适合悠闲的晚上 但是剩下一星觉得有几个点看的比较莫名其妙 就四星预留啦 ,4
两个男主长得可真像亲兄弟啊,3
冲着李光洙看的 并没有被打动 不过人生下来的责任就是要活下去 对自己负责 不管多么挣扎苟且 这句话还是很深刻啊 ,3
人生的意义只有在经历过后才能明白,5
我就想问 编剧是歧视正常人游50m连东久愣神几秒这工夫都追不上么 ,4
为人父以后眼泪更不值钱了,5
韩国真人真事改编 关注残障边缘人士的现实题材电影 智力障碍和身体障碍人士互相弥补各自的不足 很套路的韩国流水线片 一看简介就很催泪的那种片子 但是本片加入了喜剧元素 穿插了一些笑点 前半部分看起来还挺轻松欢乐的 后半段为了戏剧张力加了一些戏剧冲突 剧情很简单 很温暖 结局也是happy ending 但略有些刻意 韩国商业片这方面确实很出色 能把一些很套路很俗套的故事拍的很好看 而且看多了也不腻 男主和李光洙一对比太老了 俩人小时候明明年纪差不多 但这也不算缺点 演员方面李光洙最出色 肢体动作 表情 尤其残障人士的眼神 演的非常非常出色 也获得了自己第一个电影奖项 百想艺术大赏男配 导演技法根本看不到 靠故事取胜 纯剧作式电影 8 3分也太高了 也就7 7 5分的水平 折中一下我给7 3分 ,3
女主角选的不错 李光洙也演得不错 会当凌绝顶是孤独的 需要与被需要是东西方在个人价值上的一个重要区别 ,3
住在一个敢于反思的国家的隔壁    ,4
李光洙演的太好了 即真实的让人感到傻 又有感人 另外李絮虽然不是很漂亮 但是真是超级有气质呀 ,4
大晚上哭成 ,5
及格 李光洙演这种有点儿抽抽的人已经是轻车熟路了233真要是高位截瘫到那个程度 我选择死 像遇见你之前里的男主一样 ,3
太好哭了 好好看,5
哈哈哈哈李光洙要本色出演吗,4
特别完美 最后也没强行让教练和哥哥在一起 ,5
有点煽情 李光洙真的好像傻子啊哈哈,4
美好而现实 现实而美好  光洙的演技是又进步了吗 虽然总是演很符合他形象的角色 但总感觉在不断成长 真的感人 但不是刻意渲染悲剧色彩 就是平常细节也感人 当然确实有刻意的成分 但不令人讨厌  妈妈是后悔了才去找儿子的吗 而继父居然这么热心 一家人挑不出一点外心 好到难以置信了  真人真事 告诉我们弱小的人在一起可以互相帮助 相互依赖 相互成长 ,4
光洙演技越来越好 游泳场那一幕很感人,3
沒什麼內容的雞湯故事 不暖也不有趣 拍的氛圍也不夠輕鬆 整體來說真的有點太過俗套了 倒是李光洙真的太會演智力障礙人士了 每次都被他說服的服服帖帖 ,3
两个弱小的人在一起互相取暖,4
结尾没有重组责任之家 三个人有说有笑地一起生活 挺好,4
越是难 越是绞尽脑汁 ,3
温馨 还算有趣 但刻意的地方又极为刻意 ,3
健康完美的关系一定相互的理解和扶持 东九回归原生家庭后有更好的环境但却无法找到自己的位置 只有和世河在一起的时候他才有被需要的感觉 这是一种安全的幸福 我不推轮椅你走不了 永远都不会抛弃我 爱情也是这样啊 希望都能遇到 愿意永远只对他失望的人 ,4
有点 触不可及 的意思 两男主演技精湛 他是你的手脚 你是他的大脑 这才是命运共同体啊 ,3
最后的 哥哥 下次我会好好表现的  然后纵身一跃 奋力游泳 瞬间泪奔了,5
三星半 典型韩式温情片 也许就是为了制造冲突 所以影片中美化了生母一家 先抛弃孩子的 有尼玛的脸回来相认 谁给你的勇气来争夺抚养权 ,3
生而为人 就有活到最后的责任 演技五星 最后游泳馆那里还是鼻子一酸,5
嘻咦啊看上看到的 真正看的时候反而更为佩服人家的改造功底 显得很煽情 还蛮有种韩国风格的 所以我突然就想 这个题材如果是日本拍呢 如果是我国拍呢 会有怎样的变化 ,4
笑中带泪的温情 完美搭档,5
韩式温情老套路 对我不管用啦 ,3
申河均只要一个眼神我就不行了,4
wuli筐猪演技大发,4
没有完美的人设才显得格外真实 旧轮椅上裂开的扶手是个泪点 ,3
并不精致但很真切 ,4
弱者之间才会相互帮助,3
不是告诉我 说好的的喜剧么 以后温情片不许给我标喜剧的mark 谢谢 ,3
被李光洙的演技震惊了    申河均也超棒    啊啊啊啊啊啊啊啊  ,5
演技真棒 虽是相互利用 也相互扶持 感动得稀里哗啦,4
还可以 没有说得那么感人,3
6 10 标准韩国煽情片的拍摄方式 我家李光洙演傻子好认真啊 妈妈总给我一种反派的感觉 ,3
我什么也没有 却想给你更好的 我什么都不懂 却懂得为你好 傻子的感情 傻的单纯又美好 ps 为什么我看过的李光洙的电影他演的都不是正常人呢  ,3
化苦難為溫情 有笑有淚 將生活中難以想像的障礙和不易進行了幽默化的處理 更讓人為這對超越血緣關係的兄弟而感動 那些數不清的吸管和磨損的輪椅手柄都是這對兄弟這些年互相扶持的見證 李光洙不僅有綜藝之神的垂青 而且也是個很出色的演員 ,4
妈妈再爱我一次,3
好感人 温情又美好   ,4
哭成了泪人儿,5
两个演员演的真好 ,4
我好像对这种片子没什么泪点,3
豆瓣8 3的高分真令人惊讶 归类到喜剧上的本片其实也就是一部温情片 本身也不具备什么可观性 特别是对我这种对此题材不是很有兴趣的观众来说 整体来看本片也是稍显单薄 勉强得以及格的样子 人物刻画方面对于主角们不够深刻对于配角们则不够全面 整体剧情节奏舒缓而缺乏剧情推动力 情感浓郁却感觉不够真挚 整体来说没有大问题但也没做出什么大效果 较为一般了 ,3
很工整的一个故事 一颗星送给光洙欧巴 ,4
还是哭了 韩国商业剧情片真是厉害 ,5
RM某期光洙粉丝应援时候喊  我们哥哥不是傻瓜啊      哈哈哈哈哈,5
世河挑起的眉毛 东久推着哥哥幸福的傻笑 世河曾经想过死 但是东久从来没有离开过他 每一次 都是东久带他回家 虽然东久偶尔会迷路 偶尔会犯糊涂 但他总会找到哥哥 推起哥哥的轮椅 超喜欢他们吃方便面一幕 还有东久跳到水里救起世河 两个人躺在草地上 东久笑着说 哥哥我们回家 世河只是歪着头看着他微笑 ,4
申河均演一级高位瘫痪患者 可只要头能动 他蛊惑人心的魅力就光芒四射 ,4
蛮暖的 ,5
软弱的人要一起生活 一起生活才会坚强 ,5
 弱小的人互相帮助生活 弱小的人因为弱小才懂得帮助他人  谢谢你给了我活下去的勇气,4
挺好哭的 光洙演得真好 ,4
故事发展没有多大的反转 却能让你看完之后 久久不能释怀 我也好想有个这样的兄弟 一起吃喝玩乐一起笑一起哭 光洙把智力缺陷演得活灵活现的 李絮变得更加漂亮了   人 生下来之后 就有了坚持活下去的责任  ,4
会被感动到 搞笑中又带着几分温馨 ,4
哭了 他们远比我们要健全,5
两个演员演得太好了 韩国电影真的各方面都好优秀,4
演员演的真心好  ,4
两位都是影帝级别的表演,5
6分 这样的电影带来的背后的沉思更重要 到底是什么导致了即使拍这类生活商业片 中国也落后于日韩 靠一年一两部那完全没法和人家比较  视野的背后是教育 教育的背后是G点  分数范围5 6分 ,3
李光洙的演技可以 代入感蛮厉害 游泳看到哥哥立马下水去游给我哭的不行  两个人这么多年的感情太深厚了 最后还好东久的妈妈做了正确的事情 ,4
一筐猪是个好演员 ,4
跟老公都看哭了 结局真的是很好啊 看完了我跟老公说下次我们也吃方便面和泡菜吧 老公说不 我怕烫  o  ,4
人都是有缺点的 及时是正能量的电影 也应该更真实的去反应人性 这部电影在这方面有不错的进步 不过 个人感觉这个女性角色 有些画蛇添足 ,4
生理残疾和智力残疾 煽情程度就还好 比起两人之间的羁绊 倒是引发了我对这俩人一起生活真的好吗的思考 虽然解了心结 但最终工作的问题也没有解决啊 真实事件改编挺厉害的 特别是周围的人都挺善良 整体温馨美好 ,4
有些人就是注定要一起生活的呀 ,5
两兄弟演的真好  好电影  ,4
没有大起大落的情节转变 所有的温馨和温柔都在日常的平淡里 李光洙爆炸式的演技 感染力太强了 他推着超市的手推车走过层层地砖那个细节特别戳我 李絮小姐姐真是可性感 可小资 可温柔 可霸气 喜欢她 ,5
一般吧 没觉得有多感人 ,3
太感人了 满满的兄弟情 弱小的人在一起才会互相帮助 申河均和李光洙演技太棒了 ,5
万事本来就没有绝对的标准  也不存在谁就必须和谁在一起  自己的感受最重要   申河均好帅啊 ,5
看这片子的时候我一直在想 如果这是真事  肢体残疾人利用智力残疾人士照顾其生活 利用义工漏洞谋取私利 阻止智障母子团圆  然后配上抛弃儿子的母亲哭泣的照片 你想利用我们家东久照顾你吃喝拉撒到什么时候  我们会不会非常愤怒 ,4
还是有深度的电影 看错了 还以为 小小的愿望是改编这部  原来不是    ,4
宽容一点 是一部还不错的片子 ,4
一人作腿 一人作脑 不能说相依为命 但切实是相互依靠成长 没有利用 也没有被利用 所有都属于替代完成 轮子 把手 还有推车的动作都是生命里的东西 割舍不掉了 喂饭 闹钟 还有被推的感觉也都是日常想念 习惯使然  李光洙演傻子真的浑然天成 哈哈哈哈哈哈哈哈 嗯 还要表白李絮 ,3
三星半 感觉对于残疾人的部分还是不够细致 可能我要求太高  两位主演太强大 申河均为了李光洙收敛自己光亮不愧是影帝级演员 ,4
神父和两兄弟给我们非残疾人上了人生真相的一课 那些窥见真实人性后的相互扶持 令人感动之上多了一层敬畏 立意 反思和表演远超普通煽情片水准 ,5
生活终归是会善待那些善良的人儿呀,4
可以说轻松幽默无尿点 没那么多的煽情和故弄玄虚的东西骗人感动 挺实在地讲故事 李光洙演得令人满意 虽没那种无敌演技 但是整体喜剧成份加分不少 ,4
有点生硬 煽情的过于明显了 也不太符合常理呀,3
因为中日韩文化同根同源 所以看韩国电影很有代入感 真实而不造作 看了此片 虽然为剧中人物感到欣慰 但还是会痛心 可能还会有很多残障人生活遭遇没有那么幸运 政府应该承担更多责任 社会也应该更有温度,4
感觉中规中矩 但是根据真实故事改编 意义又不同了 怎么看李光洙扮演的角色都有种本色出演的感觉 还是挺励志的 片尾曲歌词尤其 ,3
习惯太可怕,3
怎么办 韩国人把套路拍的太好了,5
看片时请记得  光洙是有演技的 光洙是名演员   吃泡面的样子好搞笑啊 游泳的样子完全就是一个认真的傻子啊 哭的那一刻真的无助 棒子剧 我一直担心哥哥要挂了   真人真事改编  祝愿真实生活中的兄弟俩相互扶持白头到老  问 一筐猪为什么老是演傻子  因为  光洙是一名演员 手脚不协调 气质太像了 一个天生被喜剧眷顾的男人  能让你笑 也能让你哭,4
先放手的人 没资格说舍不得,3
不按照套路拍就好了 ,3
不是有血缘的就是亲人 一起度过漫长岁月在一起就开心分开就担心的才是亲人 弱者互相照顾 才能在这个艰难的世界活下去 李光洙怎么那么适合演这类暖心的弱智 ,4
 笑星 光洙真的是太会演戏了 在这里边把一个智力有缺陷的角色演活了 太有感染力了 从表情到动作都非常的到位   剧情其实很老套 换汤不换药的典型 这个题材在韩国真的很常见 好在演员比较讨喜 营造的比较温情 每个角色都很善良 传递出来的东西自然而然是非常美好的 有笑有泪就足够了 不得不佩服韩国电影的细腻 很多小细节真的很棒 四星 ,4
7 8 10 朋友说李光洙本色出演智障 笑的晕厥 哈哈哈 ,4
完成度中规中矩 李光洙的表演难说优秀但足够吸引人 典型的韩式煽情电影套路 过于平庸的质感导致观感很乏味 ,3
故事太电影化了 不过故事的确励志感人 ,4
很棒 剧本很戏谑生活 演员表现上佳,4
先放手的人 没资格说舍不得,4
没有逻辑 故事老套7分最多了,2
就听一般的 申河均还是很有魅力 光洙能不能换个类型啊 ,3
小时候的男主真的像李光洙 只有弱小的人才能体会弱小的心酸 在一起力量才更大 失去妈妈的时候 只想为妈妈游泳 失去哥哥后 只愿为哥哥奋斗 失去 才会知道可贵 每个人都是一个家 不是家人 而是成为另一个人的家 ,3
身体残障和智力残障互补过日子挺好的 俩演员演的还行 别的方面有点普通,3
哥哥 没有我你哪都去不了吧,5
听声音猜罐头 夹娃娃 吃泡面 不要抛弃我啊 也就哭了十几次吧 ,5
温馨的小品 故事意外的简单 ,4
主题点赞 单看剧情的确没什么新意,3
老生常谈了 韩国电影人牛就牛在 你明知道故事该怎么狗血 你也知道情节该怎么发展 但人家就能让你在该笑的咧开嘴 该哭的地方流眼泪 ,4
韩国最擅长的题材 先搞笑最后煽情 好看 ,4
人设的冲突点设计很赞 一个四肢发达头脑简单和一个头脑发达四肢动弹不得的两个人 结尾很棒 ,4
人自出生 就有责任活着,3
弱小的人互相帮助 一个 烫 字 两个片段 好搞笑 温馨 感人 好片 有些人的命运是无法改变的 比如残疾 我们能做的是尽可能的帮助 能活下来不容易 互相体谅吧 ,5
去年和格格在690看的 我哭的稀里哗啦 李光洙演的吃面真的把一个智障孩子演绝了,4
女主不好看 但是看着挺舒服,3
标签里的真人真事  应该是真的吧  男1头脑好用 但是瘫痪 父母都不在了 自己一个人 男2头脑不好用 身体好 是被妈妈遗弃的 除了他们两个 其他在责任之家的 都有家人 男1想到了自杀 是男2救回了他 之后20多年 两个人一直相互陪伴 男2是男1的手脚 男1是男2的大脑 每天晚上固定养成的习惯 让男2无论是什么时候 都会到点就醒 给男1翻身 后来男2的妈妈在电视上看到了他 来找他 男2因为觉得 自己离开了 女主也会陪着男1 照顾他 所以他选了妈妈 可 其实他离开后 男1过的很不好 男2也很想他 后来两个人 终于又能在一起生活了 ,3
他曾是离开过这个世界的人 世界的美好都与他无关 可他遇见了带他回家的人 哥 你不会离开我吧 你不推我 我哪都去不了 ,4
讲不出来,2
一段超市推车经过各种路面的镜头竟然给我看哭了 爱德华怎么能离开阿尔冯斯 ,5
真人真事本身就叫人感动 演小时候的东九的演员也好可爱 ,4
李光洙真的是我男神了 演得真的好啊 ,5
你吃泡面的样子真的好欠哦  7 10 ,4
很温情 但是问题来了 弱智怎么会烫一个辣么帅气的头   ,4
wuli光洙演技真好 ,3
把每个小人物都塑造得那么成功 真的太厉害 申河均和李光洙都演得好好 ,4
8 2  诶哟李光洙你好会哦  ,4
真人真事加一星,4
互相陪伴与协助却被所谓的亲人拆散,4
李光洙太适合演智残人士了 褒义,4
因为没有家人而失去生的欲望 因为有了家人而重拾生的勇气 东九的一句我们回家吧 给了他生的理由 生活本身就很难 弱小的人要相互帮助 ,5
