comments,star
一级兄弟是什么 是每天半夜不用闹钟一样能醒来的习惯 是随时随地带着的一兜子吸管 是推着带轮子的车就能找到回家的路 说到的都是东久对世河的付出 但却绝对不是利用 世河在法庭上说的 如果说世河利用了东久 那么东久也利用了世河 如果说世河帮助了东久 那么东久也帮助了世河 真的是太感人了 哭湿了两张纸巾 而且经常有憋闷在嗓子眼 哭不出来的心情 ,5
真棒 社会冷暖总是那么贴切,4
感觉两个男人煽情起来好奇怪   触不可及就好一点,3
只有脑袋能动的演技 记住一个单词뜨 거  ,4
 有人接受过错并理解你的话 我们将能重新振作并能活下去 ,4
烫,3
还是情不自禁的跟触不可及比较,4
笑中有泪 印象深刻是神父的话 一句话生下来就有责任活到最后 还有一段是证婚词 ,4
论煽情 必须是韩国电影,4
韩国电影对人性的把握娴熟稳妥且一刀见血 ,4
李光洙智商从娱乐低到了电影里,4
又是一部看完笑中带泪的电影 被人关心 被人在乎 被人爱的感觉真好 ,5
8分 温馨又幽默 两个人坚强的活着 李光洙演技不错啊 ,4
弟弟以为女孩可以照顾哥哥 即使智商停留在孩童时期 也是知道 也许这样对哥哥会更好 可是十几年的相处 每天照顾哥哥 当哥哥的双腿双手已经是日常习惯的事情了 而哥哥就是个嘴硬的小傲娇 也是很感人啦,3
趟在工地上哭的李光洙就是幼儿园里等迟到家长时的我啊,3
 弱小的人互相帮助生活 弱小的人因为弱小 才懂得帮助他人 只想着自己 只有死路一条 但帮助他人一起着想的话就不会死 我们就是这样互相利用又互相帮助 一起活到现在  ,4
李光洙本色出演啊 ,3
世河和东究就像是组成一个满圆的两半拼图 各有残缺 却互相成就 如果分开 不管给它做多么美丽 用心的装饰 都只是一个残缺的半圆啊 ,4
 我的一级兄弟  一个半身不遂残疾人 一个精神障碍弱智者 两个都无法自理生活的人互相搀扶着一起顽强的活着 即便如此生活还是没有善待他们 还是给他们布满了常人都无法轻松跨越的荆棘 那又怎么样 两个人如同一双脚左右配合结伴前行 显然他们少了谁都无法独自向前 已经比父母都更需要对方 李光洙很适合这个角色 喂泡面真搞笑 相比之下有着健全身体和正常智力的我们却在生活中原地踏步抱怨人生该有多惭愧     ,4
1 2 1 2 1 李光洙真的很适合演pabo,3
连死亡都没办法自己决定的一个人 我感到很绝望 但是电影一点都不 很好看 是愉快的观影体验,5
haha演出费结算一下 谢谢,4
也许那些外人看来为什么还会继续的情感 就是因为这样的羁绊吧,5
李光洙的智障角色根本不用演啊   本身这一段互相 利用 的友谊或者说亲情着实令人感动 真的不得不佩服韩国电影业近年进步的飞速啊,4
李光洙是个好演员 ,4
原来我的泪点很高 ,3
普通励志喜剧片 韩国普通,3
平淡的兄弟俩过着不平凡的经历和生活 没有刻意韩式催泪 就是简单叙述了故事 当哥哥离开东九后 东九想着哥哥时 弱小的人相互帮助 一切都变得不那么难了  有腿又怎么样 有腿也只是原地踏步 ,4
郭麒麟的演技果然要比他爹好出不少 ,5
 弱者只有相互支持 ,4
并不只有不能走路才委屈 即便能走路 但一直原地踏步也挺委屈  人出生之后 就有活到最后的责任 ,4
很难不打五星 我只是一个想好好看一部电影 从中获得感动的普通人而已 别扯什么电影技法 最好的剧本就是最棒的技法 在这部电影里 你可以被感动 韩影在这方面实在是手到擒来  最后和老婆一起哭 ,5
不管怎样都有活下去的责任 ,3
好兄弟 一辈子,5
同类型看多了,3
很温馨的故事 令我受到了很大的鼓舞 人从出生开始 还真是有责任活到最后一刻,5
咋说呢 一般般 没感觉 ,3
普通题材也能拍的有笑有泪的 很可爱的片子 李光洙和哥哥演的都很好 李光洙一直是被综艺大神眷顾的好演员 笑  ,5
弱者只有互相扶持着 才能活下去 比无法走路更可悲的是 只能在原地踏步 光洙好棒 ,4
光洙可以 ,4
这个庸俗的结构坏了它 做的太过煽情 但一些台词写的很有质感 能看出来是有真情实感的 你能选择出身在一个什么样的家庭么 如果她的生活那么完美 为什么她还需要他呢 正因为是弱者才去帮助弱者 为了他人才活得下去 ,3
生而为人 就有活下去的责任  健康真好  色彩真好 ,4
人既然生下来就有活下去的责任,5
人啊 只要一出生 就有坚持活下去的责任 明知催泪弹 偏要全看完 感动得一塌糊涂,5
李光洙这两年接的电视剧和电影都挺有特点 ,3
那个小闹钟依旧在凌晨三点响起 一塌糊涂的睡眠里始终是哥哥和弟弟的相爱相杀 ,4
演的真好 ,4
还是挺好哭的 倒是并没有刻意苦难 比较温情暖心吧 每个人心中总有一处回忆连结着人与人之间的羁绊,5
一个受困于身体 一个受困于灵魂 今年来同类题材作品不少 多是催泪电影 相互救赎 抱团取暖的的创作方向 故事已不新鲜 只不过这部是几个事件的拼凑 李光洙的眼睛里还是透着机灵的感觉 申河均倒是还可以 ,3
李光洙可以是我喜欢的南韩演员之一了,5
他们就这么自然而然地成为了对方重要的一部分 家人就应该是那个陪你分享不管好的坏的总之是无比珍贵的人生点滴的人啊 ,4
传奇励志的真人真事改编 智力残障与身体残障的两人相濡以沫的感人故事 两位男主表演挺好 ,4
嘻咦啊看,3
傻子李光洙本色出演 智力残疾和肢体残疾的相辅相生 ,4
眼泪不值钱,4
韩国类型片情感渲染的套路已经玩的炉火纯青 不管是先抑后扬还是先搞笑后煽情都是驾轻就熟 人物和故事情绪的对比和表达都很浓烈 总能设计几个高泪点的时刻让观众泪奔 李光洙太适合这个角色了 演起智障来简直本色出演 太可爱了 对他路转粉 ,4
多一星给申的演技和最后掉水真相的剧本 太真实了 ,4
韩国电影真的有一种魔力 让你真正进入故事的世界里 说出的评论永远不是电影如何 而是真正的把他们当做身边的一样来评论 真的很棒 ,4
韩国的温情片工业化程度真的挺高 李光洙基本就是本色演出嘛 和本人综艺定位高度契合 ,3
题材有点沉重 但是处理成喜剧不给观众太多负担 真好 ,5
那为什么审判的时候要选妈妈呢 妈妈都抛弃了又回来找傻儿子就是为了赎罪而单纯的对他好   ,3
如果我不推轮椅 哥无法去任何地方,5
朋友推荐的 超赚我眼泪   ,5
我在这里敬告每一位人父人母 先放手的人 没资格说舍不得  Android,3
光洙欧巴的人设可以换换么 ,3
虽然是韩国一贯的温情片 但没有过分煽情 申河均大叔的哥哥有点小傲娇但对傻弟弟那可是真的宠 互相 利用 互相帮助的不完美的兄弟俩 融洽 短发李絮小姐姐也很招人爱,4
别让一筐猪演傻子了 因为他真的像 ,3
年度佳片 非常细腻 感人至深  无法触及 的类型 但更出色无论是演员还是剧本 最近好片太少 看的非常享受 ,5
"两个 弱者 相互扶持的小感动双男主很棒 傲娇毒舌的世河与憨厚温顺的东九特别合拍 申河均的讨厌恰到好处 光洙就是个努力的傻瓜呀 没想到电影院夹娃娃配乐和片尾曲是很多年以前 在一张婚礼主题专辑里听过的歌 ",3
温馨的片子,3
哭成大傻子 光洙不是傻瓜 是催泪弹,5
很喜欢神父的那句话 当你独自感到痛苦时 遇到他人 就能相互扶持相互依靠 爱情不会永恒不变 但是心怀一颗接受对方过错的心 才能恒久 当时说的是爱情 也是所有的感情 每当看到真人真事改编故事 总会让人感慨 世间事无奇不有 人的想象力何其匮乏 常怀包容之心 接纳自己 接纳爱人 ,4
想了又想 他俩生活在一起简直天衣无缝 再合适不过 ,3
演技在线 故事没什么新意,4
李光洙神演技 自然地像本色出演,4
这故事本身就足够美了 有一点瑕疵也没关系 李光洙演的太棒了 发现彼此的善意 共同度过难关 像亲人一样 这就是朋友啊 ,4
思密达啊 唉 老是出产探讨人性的作品 而且还那么好  ,4
笑中带泪,3
五岁孩子的智商 长大了感觉比少年时更傻 傻在面部 还好是个好的结局 ,4
有时候我们就只是渴望一根稻草而已   ,4
3 5 很有人文精神 把残疾人面临的生活困境和社会现实表现得很好 李光洙的表演也很精彩 不过总觉得他这个角色的都合感有点强 需要他能干的时候很能干 需要他犯傻的时候又傻得不行了,4
悲喜交加 的会感动 但没哭成狗 3 5 可以一看    ,4
交换着牙刷刷的那幕是第一次见 哈哈 傻子小时候超帅啊 身障和智障互补的俩兄弟 分开后果然就是不行 泪点不少 老问去游泳好吗 应该就是要去泳池边找妈妈吧 最后又轮到找哥了 ,5
看到这个故事设定就觉得有意思 更何况还有李光洙 演5岁智商绝了 跟二十年没见的母亲相遇那场戏 既要表现他的难过又不能显得太聪明 这都做到了 在废墟的那场戏 虽然哭得很难听 但我们也跟着一起难过 欧巴真是个好演员 最后终于在泳池相见了 互相需要的人 如愿以偿了 韩国电影总是让我跟着哭得找不着北 还是厉害啊,4
长颈鹿演技在线 有笑点和泪点  ,5
虽不是什么喜剧片 但是也还不错 真实故事拍得很好,4
看这部纯属好奇李光洙演技 下载在电脑里以后每次选片总会把它的排位往后放 就这么跨过了二十多部电影 一直放了一个多月  今天才看  哇 我是真的没想到 能被这个看哭的啊 我是真的真的真的好久好久没看电影哭过了 但是看他从泳池上来 把手放轮椅上 眼泪失禁决堤   哥 我们回家吧  ,5
看解说哭得停不下来,5
取长补短 各自不足之处都需要对方的长处予以弥补 所以两兄弟在一起才是残缺的完美 ,3
3 5,3
真好啊 残酷人生的那一点点温暖光亮 ,5
温馨感人,4
虽然整体上都很棒 但让我印象最深刻的竟然是出镜时间不足十分钟的神父 为了责任之家那种拼劲 全片的主题都在于一个情字 此情可以是兄弟情谊 也可以是家人之间的情谊 几十年如一日 他虽然傻 但并不笨 心中念念的是朝夕相处的哥 却宁肯为了他心中的哥和老师放弃自己想要一起生活的人 对于一个智商只有小孩的他来说这是一个艰难的抉择 影片着重于两人之间轻描淡写的生活细节 虽然琐碎 但也是本片的灵魂所在 ,5
世间自有真情在 ,5
内心毫无波澜 4,3
给我哭 ,5
这次套路的应该只有7 5分的水准吧 8 2虚高了 互相依赖的残缺兄弟 没那么搞笑也没那么动人,3
好些人生 金句  比如 因为弱小 才会互相依靠互相帮助 人既然出生了 就有活下去的责任 如果可以自己选择家人的话 虽然略套路 却令人无法铁石心肠 光洙平时的综艺表现让人觉得他是本色演出 但我想他还是做了不少功课的 比如一些手指的小动作和眼神 小演员长得挺像光洙的哈哈好可爱,3
我们都是受到伤害的懦弱的存在 经常会让他人感到失望 并且自我绝望 这时 如果有人接受过错并理解你的话 我们将能够重新振作并能活下去 ,4
非常无聊的剧本 毫无新意的进度 并没有特别感动 因为每一步的走向都让人眼熟   ps 抓娃娃抓的这么好 真的是智力低下的人吗 李光洙的角色还不如 没关系 是爱情啊 里面的污言秽语抽动症的角色来的生动,3
典型配置 突然想起了我的天才宝贝 韩国对套路研究得有多深呢 托腮羡慕状,3
李光洙演的挺棒的 两个孩子长大后的性格和小时候比反差有点儿大 跟换了个人似的 最大的矛盾点在于与亲生母亲争夺监护权 最后化解的方式也是一场意外后的善良 你是我的腿脚身体 我是你的思想意识 有点儿像法国的那个电影 ,3
又哭又笑的,5
答应我不要再让光洙演傻子了好嘛 真的是太像了 ,4
从头哭到尾 李光洙还真的是本色出演哈哈哈哈哈哈 他的哭戏不错 而且这个电影居然是改编自真人真事的 有点惊讶 ,4
人家只有头能动还坚强活着,3
演技爆棚,5
同病相怜才是最好的陪伴,4
彼此需要才是最大的安全感吧 ,4
还是很欢快的圆满故事 ,4
太感动了 这么有爱的兄弟 ,5
好看啊我太喜欢了 韩国人太擅长拍这种题材了 555我真爱猪,4
知道是泪坑也要跳 演绎的超棒 ,5
弱者 首先需要尊重 而不是所谓的帮助 不要随意评判别人 不要颐指气使 不要盛气凌人 不要有优越感 尤其当面对弱势群体或相对自己而言的弱势一方 任何人都有权力选择自己的生活方式 不要以为自己的才是所谓正确的 合理的 人家愿意喝奶茶 吃夜宵      只要不影响你 不要随意指摘 因为那自有其原因 而你并不知道 ,4
非常温情的电影 人无论如何 都有责任活下去呀 ,4
觉得申河均性感 发生了什么事,3
非常饱满的剧本 别有一番意味的韩版 雨人 ,4
在这个二人世界里 他们才是正常人 依赖并不丢人 利用也并不可耻 ,4
为什么每次都知道要怎么煽情但还是会哭的稀里哗啦啊,4
题材和原型故事蛮好的 剧本还行 遗憾的是导演的叙事架构和手法很中规中矩,3
剧情有点老套路 演员是真的赞,3
温情又美好 演员完成的特别精彩 尤其光洙让弟弟的角色更加的可爱和惹人心疼 特别难得的 在每次冲突之前都有足够的留白 给煽情的剧本一些面子FROM 我的一级兄弟 ,5
弱小的人要相互帮助才能活下去 对不起 我又哭了 ,5
