comments,star
 48  一部被表面功夫  讨巧人设 福利情节 华丽视觉  给完美粉饰的隐性粪作 特效惊人到违背动画形式的初衷 歌曲塞得满到似乎一度要变成音乐剧 除此之外都差强人意 剧本构建所用元素既视感不要太明显 前作设定不足以编出一个故事 所以强行加入什么水火土气自然之灵 蜘蛛侠2  魔法森林和人类文明的矛盾与和解 沉睡魔咒  找了半天结果发现自己是第五元素 第五元素  前作的冰雪史诗被做减法到如今一场冒险即可完成全部叙述任务的超小格局 更别提情节牵强之处无数 如 安娜为必然复活的雪宝和爱莎哭泣 然后还要献祭新歌渲染气氛逼观众跟着共情 幼稚到不行 人物成长可以用几个字概括 想起前作的群像刻画  这就算了 但艾莎那么有寓意的冰雪魔法设定 活生生从带着诅咒的天赋降格成无敌金手指 这已经是赤裸裸的ooc了吧 ,2
剧情不如第一部 不过歌的音乐性比第一部复杂好多 更音乐剧 Elsa的头发效果惊艳 disney每部公主动画都把cg头发技术推进一步啊 ,4
非常特别好 有一点可惜的是高潮戏拍的再荡气回肠一点就好了 ,5
Elsa单刀长驱 勇渡暗海 力擒天马 打通结界 破茧成蝶 涅槃封神 赞赞赞 ,5
电影是窗子 镜子 梦 在迪士尼这里 电影就是梦 对获得王子和公主那样完美人生的愿望是人类前行的原初动力 只要我们还被现实的复杂性压得喘不过气 而希望生活简单纯粹如小孩子过家家 迪士尼就永不过时 可这部六年之后的续作 对于满怀期待的观众来说实在是太工整了 从故事到技术到主题等等 每一个环节都太工整 挑不出毛病 但也毫无惊喜 而在人物和故事 这两个核心的要素上又不思进取得让人气极反笑  冰雪奇缘2 就像一台极其先进的机器人 完美无缺 但毫无生命力  谁会真正爱上一台机器人 即使它能满足你的所有需要 从开头到结束 角色们没有真正的变化 故事也就不存在 存在的只有桥段和歌曲 角色变化了 故事就要结束了 如果角色不变 续集便能一直拍下去 这是迪士尼的算盘 但这样拍出来的电影依然只是机器 有用 但无趣 ,3
美国人终于承认对native American做的糟糕事情了 Elsa问Anna说她有一个问题 我还以为她要跟安娜求婚了 喂,4
百合即是正义 艾莎帅炸了 ,4
融入北欧萨米驯鹿文化 以 地火水风 第五元素 的印欧古信仰和北地反坝运动串联故事 有效拓宽了上集的世界观和情感主题 故事也没那么厌男了 是好事 水中的特效镜头令人惊艳 只是随时随地开启麦霸模式的迪斯尼动画套路让人厌烦 自然美景不够 还要配上迪厅效果的灯光 更显恶俗 ,3
近年最美动画没有之一,5
 超幸运 两部都能在老家跟我弟看 这次还带上寿星妈 要是我爸没感冒就完美了 太短暂的一段历险 幸亏没看过预告 一山一水的壮阔绚丽都留有惊喜 找寻过去是一场赌博 故人卸妆 未必扎不透脆薄心胸 就连Olaf 都开始思索成长与转变的命题 看得透平宁安康中的心惊肉跳 欢聚一堂的风流云散 这一部的人情世故 正像那一地秋叶 一下子红了 老了 也许北上在即 看这必然大团圆的电影 也屡屡有眼红的迹象 最爱的一首歌 是小乔唱的 Lost in the Woods  你不在 我乱掉了南北左右 看不清日月星辰 同样不懂女人的Ryder在旁 一下子穿回到 寻  他又成了Patrick ,5
那么多年了 看得就是情怀 当镜头快速推进 从海面延伸至城堡 再到城堡窗户n年未见的女主角再度现身 激动不已 眼眶湿润了 我生来就是与众不同的 注定要过不平凡的人生 这不就是我吗 故事整体寓意着世界民族为一家 最后结尾字幕揭示迪斯尼描绘的北地人的原型是萨米人 ,5
 冰雪奇缘2 如果你们真的是因为 音乐多 而去给迪士尼的这部电影打差评的话 那我真为你们的艺术素养而感到悲伤 为某些中国人的审美观念感到悲伤  对着别人的优点而去品头论足 这种思想我觉得放眼世界真的是好掉面子 自己没品味就没品味 还要打个差评说自己没品味我可真的笑了 就听神曲 let it go 是有品味 别的都是魔音穿耳 迪士尼多让你听听歌委屈死你了 ,5
标准流水线生产 无惊无喜还好观赏性依旧在线 ,3
一直唱唱唱 唱你妈呢   ,3
安娜对着山岭巨人放嘲讽 ,4
看的时候特别纠结觉得 完了 elsa又变美了 我不是世界第一美的小公主了 我完蛋了  然后想到elsa是女王 我又释然了 我还是全世界最美的小公主 基于此 我很满意,5
自我回顾的片段过多了 Elsa和Anna的姐妹情意动人 相互的关爱 揭开阴霾从少女的成长 到这一部有责任 坚韧的成人模样 In to the unknown到剧情中段再释出 整首歌一定会更有能量 观感更佳,4
他知道安娜要去砸水坝 知道阿伦戴尔会被淹 他没问一句为什么 他说没问题 ,4
那个壁虎也太cute了吧   imax观影感受很加分  雪宝你话太多了  ,4
别问为什么 它就是为女孩筑一个美梦 那些闪亮亮的 透明梦幻的 浅浅的色彩 柔软优美的身段 让人忍不住随之起舞的旋律 和依然相信勇敢努力就会圆满的天真梦想 这种喜欢是少女间不言自明的秘密 是幻想还没熄灭的证明 我会庆幸30岁的我依然懂得这种喜欢 ,4
那首歌像 站在高岗上 ,2
Elsa披发真是美到惊艳 论肤白发多的重要性  水型与冰状的马确实做得太细腻了 Olaf的官方吐槽赛高 其他也就差强人意了 ,3
也只有在童话里 殖民者和原住民能有这种平等河蟹的结局吧  ,4
Do you wanna build a snowman  我想要雪宝这样的男性朋友 눈へ눈傻嗨雪宝让我疯狂泪流满面 打是亲骂是爱 눈へ눈          Elsa和Anna两姐妹更显百合姐妹情了 真羡慕有这样的姐姐 TvT 喜欢Anna的一整套服装 Elsa变身冰雪女王后圣洁亮白的服装也好美 金毛Kristoff真的又帅又惹人爱 原来女主爸爸小时候也挺帅的 故事整体太过简单 我简直没明白这五大元素是干嘛的 无论是剧情还是音乐动听度都远不及第一部 缺乏脍炙人口的歌曲 以及我竟然有点怀念Hans了  Into the Unknown 算是越听越洗脑  全片最好听的要数Jonathan Groff演绎的蕴含怀旧味的 Lost in the Woods  而且片尾的摇滚版竟然还是Weezer唱的  惊了 ,4
刷分刷得真是丧心病狂hhhhh,1
续集平庸 没有let it go加持 套路无惊喜 ,3
elsa怕吵醒妹妹小心翼翼的关门然后却大声唱歌直到叫醒所有人  关键时刻一定会唱歌 感觉这一点还蛮白娘子传奇的 ,3
剧情稀烂 也只有歌能听了  不过很多场合都有点尬,3
连个boss都没有 这俩姐妹的人生也太顺风顺水了吧 ,4
 和平影都  3 5分 哈哈哈哈 被各位友邻把预期拉到地板之后 觉得还挺好看的   特别喜欢Christoff那段Memoji MV风格的失恋情歌段落 设定退化 形同女实异男什么 maybe  ,3
居然看了个KTV式的歌曲大联播 每首曲子的间隔时间都如此整齐划一 更可怕的是主题的贫乏和政治正确化 以及人物的扁平浅薄,2
三峡大坝2太好看了 仙女儿海上骑水晶马 老太太我这心肝儿哟  智商我喂狗 4星你拿去 还想2刷 ,4
狗尾续貂 然而 沉迷Elsa的美貌无可自拔 ,3
7 5 我必须承认这部续集让我感到了一丝失望 但肯定算不上烂片 最多就是不及预期罢了 无比精致华丽的画面和动听的音乐一直是迪士尼的看家法宝 在影院的效果更是让我一度忽视了在故事上的种种不足 直到故事进入高潮 突然结束 我才猛然发现些许不对劲 前半段是日常短片合集 中段像是用mv水时长 因为不少唱段对故事推进没什么作用  高潮不高 收尾平平 没什么戏剧冲突 以至于解决问题都没让人兴奋起来 安娜与男友更是沦为工具人 即便如此我依旧被制作人员的奇思妙想与创造力所折服 片中的种种奇观令人赞叹不已 Elsa的扮相也美得不行 一部动画片的美术与创意不容忽视 否则我为什么还要看动画片呢  Elsa换了那么多造型 玩具能卖到疯  ,4
虽然明显不如前作 可还是想再看一遍,4
真 大型MV 完全是看了3D动画片的音乐剧嘛 泪点还是有的 毕竟迪士尼煽情是强项 我泪点的地方在于 Anna作死要去当英雄冲进危险时 男朋友骑着驯鹿冲过来接上她只是说what do you need me to do 那真的是不问原因无条件的信任和爱和支持哎 迪士尼对于这种纯粹的爱与勇气的点真的都戳得准准的 突然觉得 迪士尼就是女孩子的漫威 漫威就是男孩子的迪士尼嘛 我觉得世界上存在一些这样的电影挺好的 尤其是想象一下有个小姑娘从小看了Frozen后觉得自己也可以像Elsa一样承担责任拯救世界呀不止是男孩子可以这样做 就觉得很棒 人类永远需要童话,4
 艾莎传说 冰野之息 ,4
我身骑水马走三关 我改换华衣回Arendelle 放下Northuldra无人管 我一心只想Anna妹,3
是女神 是梦 是心中完美的迪士尼电影 ,5
又一出给印第安人精神赎罪的故事,3
感觉看了无数个mv     ,3
如果现有的安稳生活是建立在祖辈的错误之上 那我们宁愿激怒巨怪 揽炒冲跑这座港湾小城 拨乱反正 重新开始 上一集好不容易从城堡回家 这一集就换了个更遥远的城堡离家 发现自己更适合不断追求未知的冒险生活 以为长大后一切都会make sense或许是童年最大的错觉 海上怒涛驯马和九十年代尴尬情歌 Lost in the Wood 也不错 各种内容立意和细节段子虽然出彩 但因为迪士尼卡通的合家欢需求 硬是拧巴敷衍出一个假大空幸福结局 烂尾严重,5
现在公主不仅不在城堡等待了 出门屠龙的时候还让王子搁家等着 ,3
我还以为第二部是印度电影呢 一直唱歌 你听 是寂寞吗 我有个邪恶的想法 第三部能不能姐姐跟妹妹只能留一个 一个搞死另一个 ,3
看完 冰雪奇缘2  兴奋得搓手手 骑着白马 跨海而来的不一定是王子 还有可能是变得更美的女王 show yourself也很像对同类的呼唤  真是化小 姬 情为大 姬 情 驯鹿男什么的 只是剧情需要 整部电影依然是安娜和艾尔莎的互相成就 最后 安娜和艾尔莎 一人掌管阿伦戴尔 一人掌管北境森林 两个地方消弭世仇 结成友好联盟 安娜和艾尔莎都成为了女王 女王和女王的cp 嗯 强强联合很带感  这个故事也告诉我们 技术改变生活 北境森林的增强现实视频 让艾尔莎发现祖父的秘密 艾尔莎冰冻之前发的微信 让安娜知晓了真相 呼唤进击的巨人 拆毁大坝 最后两人看似分居 但技术让距离不是问题 联系很方便 安娜想让艾尔莎来玩 直接发个微信 艾尔莎开着车 骑着白马 就过去了 简直了 ,4
阿伦黛尔肯定没有KTV 岳云鹏屁股脸 ,5
艾尔莎开挂了 ,5
特效做得真的太好看了 细节令人眼花缭乱 颜色和构图美跪了 剧本衔接有问题 整体也太套路 但幸好还有真诚感人的公主灵魂时刻 Jonathan歌多啦 加分  ,4
WTF were they thinking  Why did they put lines like  I prefer my fiance in leathers  in an animation for children ,3
明明就很好看 女人在忙着拯救世界的时候男人连求婚都整不明白 就给我这么拍 ,5
相比于 冰雪奇缘 大胆的颠覆式创新  冰雪奇缘2 则是保守的 虽然迪士尼无可挑剔的动画制作仍旧呈现了一个足够美轮美奂的童话世界 但在这部电影中 剧情的平庸  看点的匮乏 都使电影固然一如既往的拥有优美空灵的旋律 却再唱不出那声动梁尘的 let it go  ,3
美国人挺实在的 calling就真的是voice calling 人物进入 灵魂黑暗 时刻 并没有太多困顿 就开始唱起了歌 配器轰轰地上 这就是主题乐园 情境只是娱乐的引子 它达到了某种设计效果 比如模仿90年代男团MV的谐谑感  却难再触动人心 当大热金曲成为某种路径依赖 电影就降格为金曲 以及其他卖点的周边 我们从中辨认出了古老的神话 如同幽灵公主 和新时代的元素 多族裔的共同体  我们辨认不出的恰恰是真相 梦想已成视觉的春药 还有什么unknown ,3
感觉比第一部好很多 音乐非常棒 姐姐从跳海逐浪开始唱的那首歌听得热泪盈眶 ,4
哈哈哈哈哈这是Avatar吧哈哈哈哈哈哈哈哈 Earth  Fire  Air  Water  Only the Avatar can master all four elements and bring balance to the world  And I totally predicted Elsa would  SPOILER   so maybe one day she ll go  wintering in Rome   literally and figuratively hahahaha  just like a certain Scandinavian queen who also  SPOILER  lmao ,4
三星全给视效 至于故事本身 只在两面派王子的回忆雪雕被艾莎打碎时略有触动 其他都meh   没有一首歌能达到let it go的洗脑程度 into the unknown不行 show yourself更不行 那里特效很好 但拯救不了歌的plain  她妈开头唱的摇篮曲倒是不错 ,3
这才叫无中生有 凭空编造 你无法为了一个空穴来风的声音去寻找真相而产生情感共鸣 没有铺垫的行动就是傻子作怪 没有什么意义 还有那段男配单恋的独唱 简直low到爆好么 听的我鸡皮疙瘩都起来了  ,1
爱莎终于从半仙升为大神 安娜更招人喜欢 可能是因为她让老百姓看到普通人也可以做到很多 剧情略复杂却可以自圆其说 想说编剧牛逼,5
三星半 续集是必要的 解开一堆谜团 包括Elsa超能力之谜 身世之谜 父母遇难之谜等等 加进环保主题也是切合的  水拥有记忆 的创意灵感来源是骗子江本胜的伪科学么 作为动画片 画面美得无敌 说故事敷衍什么的 第一部恐怕更敷衍和硬来吧   歌曲比起第一部大退步 唱了一堆没一首好听的也记不住 克里斯朵夫越来越没存在感的最后还要模式化插足越来越稳定的姬情 真讨厌 最后 那个大坝真不是 终结者黑暗命运 同款 看着好像 ,3
冰河铁马 放鸟归林 来 泪点有奖竞猜 奖金一百 ,4
与上一部相比故事悬疑色彩更强 价值观上真很女权 女性的坚毅 执着 勇敢和友爱表现得非常直接 相信看着Elsa骑冰马跨越冰河长大的女孩们 一定会成长为完全不同的一代人 ,4
最后elsa骑白马而来 妈呀 这是什么玛丽苏剧情啊 姐姐娶我 ,5
I have so many questions   ,2
一眨眼6年了 时间如梭 故事还是那个故事 人却得了抑郁症 电影画面美轮美奂 现实世界千疮百孔 这样的故事已经不再属于我 但我还有看他的理由 总要活着 哪怕是骗自己 还有美好 还有美好 ,4
为什么你们elsa越长越像Bingbing Fan了 anna的衣服怎么都这么好看,5
Elsa好御啊 歌不好听 故事老套 elsa请谈一段橘味恋爱 一旦接受elsa像柳岩就非常无感了哈哈哈哈 ,2
平庸华丽得像看春晚似的 在追求安全美好合家欢的道路上一去不复返,3
      开头安娜唱 你都长这么大了  我一下子就哭了  冰雪奇缘 对我来说意义太大了 所以我反复问自己这六年来的期待是否值得 可是结论我依然没有想通        六年前 冰雪奇缘 上映的时候 恰好是迪士尼动画部自建厂以来最为窘迫的时间 重金打造的 无敌破坏王 和 魔发奇缘 叫好不叫座 奥斯卡也接连失利 而到了六年后 我们还是可以明显地发现 迪士尼少了些敢闯不顾一切的勇气        这是一个极好的真人童话剧本 放在动画片里却太过稀松平常了 我想可能所有人都明白 冰雪奇缘 有多火 所以才会如此保守地不允许它失败 这些年来我看着迪士尼变了这么多 它的商业化也一直被诟病 那么这部 冰雪奇缘2 无疑是其这阶段问题的集中体现 在遗憾之中 我已经分不清我走进电影院前该期待什么 ,3
怎么衡量一部续作是否成功呢 当你看完之后脑子里全部是前作的影子那显然续集是不成功的 而我现在满脑子Let it go的旋律 不光是音乐方面没突破 故事陈词滥调让人昏睡 美术方面还是很高水准 可是我这电影票钱去逛美术馆它不香吗 动画最重要的是什么 想象力啊 电影里呈现出的一切 我看不到一丝迪士尼这种体量下迸发出的想象力 创新方面毫无作为 迪士尼自己越来越像灭霸了 至于怎么像 大家仔细品品吧 ,2
第一部竟然是6年前的电影了 中间那段塞尔达还行 其他烂透了 迪士尼今年整体吃屎的很 还狮子王真人版 他妈的狮子王有人么 ,2
编剧实在太偷懒了 转场全靠MV 迪士尼的第二部永远都处在一个尴尬的位置上 ,3
六年过去了 就给粉丝看这个 除了画面还有技术层面这种已经夸烂了的东西 这部有任何一点值得称道的地方吗 剧本简直差到以为是雪宝写的 冰雪奇缘2之白发魔女的崛起 ,2
竟然还有人说冰雪奇缘2好看 迪士尼 你竟然把 冰雪奇缘 续集搞成这样 这还是电影 你确定不是音乐录影带 剧情简直就是狗屎 迪士尼 你飘了 你已经不是那个能给我们影迷带来惊喜的迪士尼了 相当失望  ,1
珠玉在先 这部的剧本确实弱太多了 冰雪姐妹花歌曲大串烧 却没能再现 Let It Go 的奇迹 唯一值得记住的可能就是迪士尼再也不愿意玩 王子公主 的梗 把 姐妹情深 一撸到底的尽头吧 ,3
这系列最大意义是能让这一代小孩儿有一个elsa这样的公主吧 短评说只有那匹马变成人才配得上elsa的 怕是玉蒲团看多了hhhhh,4
法术高强的姐姐 不离不弃的妹妹 没有存在感的男人 一言不合就唱歌 这真的不是新白娘子传奇么 ,3
唯一喜欢的歌是Kristoff那首8 90年代感MV,3
姐我身骑白马 走三关,3
用偶像劇手法拍的續集 配角的戲份實在可有可無 整體劇情都是講幾個主要角色的自我完整 所有的音樂段落都是內心OS放大 但內心戲除了形而上的空話沒有實際內容 人物的心理變化動人的前提是 需要有足夠的戲劇性為前提 沒有前提 所有的矛盾 衝突 自省就都很做作 兩姐妹吵架的段落不就是party內開會批評與自我批評嗎 王主任我不批評你都不行了 你這個錯誤非常嚴重 你怎麼能這麼不愛惜自己的身體呢  大量的獨角戲和大頭戲 除了雪寶某一段還有一些趣味之外 其他也就是流星花園級 之所以兩星 因為它還算是個日版的流星花園吧 最後credits的三首歌可圈可點 我都不知道panic at the disco這麼想變Sam Smith ,2
在迪士尼星球里依然信奉 按钮按下 幸福来到 的童话故事 单向因果循环 阴郁的对岸永远是光明 对于充满希冀的孩童来说最好不过 但对成年人来说 枯燥乏味甚至单薄 故事苍白的像张纸 续集探究艾莎的魔法获得的原因 用一段未知的歌声引诱真相谜团 于是主角一行开启冒险旅程 过程无需赘述 但这个系列的特色就是用演歌表达情绪的饱满 姐妹情 爱情友情 思念之情 通通寄托在歌声里 20分钟的故事 用80分钟来抒情 当然迪士尼的微妙之处在于 总能用细节捕捉共情的能力 你还时不时的能被感动 撇开创作的各项环节 画面技术真的吊打一切 天马行空 大气磅礴 艾莎勇渡暗海 力擒天马 让你在光辉的英雄情节里看到宏大的民族信仰 成长和智慧并驾 勇敢和能力铸就 价值传递落俗但永不过时     ,3
I don t know about anyone else 但我太喜欢这个续集了 各种自由驰骋的感觉稳稳戳在我的点上 以及北国风光也太美了 好想家   ,5
美国特色自由主义环保样板戏,3
在ktv狂哭的感觉,5
1 后座一位老爷爷独自来观影 看到姐妹俩拥抱的场景 发出了  噢 艾莎和安娜 的感叹 2 看到结局 老爷爷愤然提前离场 3 看的时候我脑内总是跳出奇迹暖暖的换衣现场 出现北地二字时我在内心惊呼 这套我收集过 4 整体剧情温吞 好在第一步为cp打下了坚实的基础 成功转移了观众在故事上的注意力 5 女王衣服美丽 同时为女王宣传的 再美丽也要穿秋裤 这一理念点赞 ,3
Elsa的水晶裙子挺好看的 澳大利亚需要Elsa 为什么小孩儿都喜欢Elsa啊 老是皱着眉头 每集还都离家出走 小姑娘们不喜欢樱桃小丸子 白雪公主这样身边热热闹闹的吗  妹妹Anna为了救森林 决定淹掉自家王国 怎么结尾还当了女王 这能做个好女王吗   所有的歌都不好听 也是挺难得的呢,2
躲不过的劳役  那段90年代ktv风的mv是怎么回事  视觉效果很棒 故事嘛  安娜和克里斯朵夫的故事线都什么鬼  ,3
音乐整体上比1更好听 除了姐姐骑马给我印象最深的是克斯托夫在树林里90年代卡拉OK式诉衷肠 拍摄手法让我忍俊不禁 非常喜欢这种带有年代感的梗 姐姐真的太可以了 满足姬佬的一切幻想 每次变装都美到新高度 看到她哭我也跟着哭 ,4
我要的是性别平等 不是性别倒置    不知道是不是迪士尼前几年被批的厉害 这几年恨不得脸上贴着政治正确   审美疲劳告辞 ,1
我阿伦戴尔还能再战500年   ,5
艾莎女王的美丽等级又上一个新境界 海上驯服冰马那段真的是太酷了 恭喜安娜公主升级为女王 一个系列出两个女王没有第二了吧 不仅双女主吃得死死的 连母亲大人都是父亲和国家的拯救者 这是一个三个女人拯救世界的故事 ,5
至灵的女性电影 泪流不止 世界失衡的原因 父权造就的大坝 父权谎言 没了大坝水会淹没世界 阻止水淹没世界的真正力量 女性力量 根源 水与女性力量一脉相承 女性出路 找到真相与本源 找回自己 评分不高 意料之中 评分若很高 世界不会是现在的世界  继独角兽之后马形态最美幻兽灵又集一个 水精灵 这个设定太迷人了     ,4
和第一部云泥之别 动人的歌声我确实睡着了 很适合做迪斯尼乐园剧场版,2
睡了睡了,3
动画版 湮灭  还可以 比第一部好看 几个剧情高点 音乐 歌唱 都很烘托气氛 也挺好听 画面也是十足 女主造型是变身提升的过程 所以人 也是要不断提升自我的,4
Elsa没有找到女朋友之前我是坚信会有续集的 她和魔法森林那女孩有点儿火花啊 看哭好几次 感动 o     o ,5
结什么婚生什么小孩 老娘还要驯波涛 骋风浪 阿伦黛尔皇家造型师你值得拥有 不想在意整个故事跟沉睡魔咒2拷贝不走样  一开头就猜到结局 为了 漂亮 加一星,4
虽然没有第一部惊艳 但在4D厅奇特效果的辅助下 依然和4个小朋友收获了一次愉快的观影旅程    艾莎唱 Show Yourself 的换装真漂亮    艾莎和安娜姐妹间的某些亲昵举止有点蕾丝的感觉 而克里斯托夫与同样会 替 驯鹿说话的莱德之间则有点男同的意味 雪宝演绎前作故事以及片尾彩蛋真有意思 长途路上的话唠联想到 怪物史瑞克 里的驴子 卖萌的火蝾螈则联想起 魔发奇缘 里的变色龙帕斯卡   电影里还看到了小飞象 大白 米老鼠 的身影     二刷完成 国语版配音依旧给力 喜欢 ,4
其实跟Moana在某些地方有点像 讲了女性的神性觉醒 当男性力量在以暴力 威吓 欺骗等等手段完成 征服 时 女性力量则是以倾听 沟通 理解来完成这同样的过程 而只有这样的 征服 是能够得到天地自然的接纳的 驯服水马的一幕极其美丽 Elsa不断地投身巨浪之中又不断跃出水面 最终让整个大海化为冰原 策马疾驰向Ahtohallan 这一幕让人想到Moana中火山女神的两面 温柔与暴烈本就是二位一体地构成着女性力量 ,4
这种剧本 吐槽都是抬高它了 好看 真好看 两星半,2
Anna你确该诚实地面对自己的性取向 ,3
观感就是无聊 歌没有抓耳的 故事比第一部还简单粗暴 四大元素挨个过招也是走马灯流水账 基本就靠视效画面来撑 中间直接给安排了一段MV我都傻了  这个ip还是踏实挣周边钱吧 别再往下生编了 两星半,3
后段剧情的强行收尾很让人意外 迪士尼用着最好的技术 做了最漂亮的公主 表演了一场最华丽的音乐会 ,4
看到森系小哥出场 还以为男主要放弃女主和他组CP了 可惜了他的颜值 看到艾莎骑着 海马 狂奔 总会想起 铁马冰河入梦来 这句古诗 意境唯美 第一部是妹妹空手接白刃真爱救姐姐 第二部却变成毁大坝替祖父还清人命债 难怪观众接受不了 猜想第三部 安娜有了孩子 外族入侵夺走她的孩子 为了救孩子她要牺牲姐姐之类的故事 ,4
在阿姆斯特丹看的4DX版本 有腾云驾雾之感 视觉和感官效果非常好 加一星 但是剧情只能给三星 歌只能给两星 根本记不住 恨铁不成钢 ,4
剧情非常单薄 歌唱得太多了像巨型MV Kristoff的独白歌曲更是让我目瞪口呆 这男的怎么这么自作多情呢 画面是真的美 神仙Elsa骑着冰马太浪漫了 但只为这个画面的话还不如去看 海洋奇缘 呢 希望美国的动画片多多开发下北美原住民的传说 ,3
太无聊了 四倍速 五倍速 完全没留下印象的动画MV合集 故事本体还是缺乏创意老生常谈的美国殖民与原住民的矛盾 夸种族爱情 水火风气四大元素  无聊至极 唯一的看点就是小乔唱歌了 想看 妈呀 预告片都拍出了史诗感 疯狂期待了,1
