comments,star
首集的魔力就像艾莎的法力一樣褪了色 故事主軸完全無法自圓其說 四大神明為了懲罰冰國國王的殖民而降災 卻又把第五個神明重生在國王孫女的肚皮 這是祝福還是詛咒你們口徑倒是統一一下啊 這災罰晚了三十四年來來不說 最後被艾莎解決災難 冰國絲毫未損 被殺的原住民卻依舊是受害者 神明這是在赤裸裸的偏坦白人 故事設定吃書也吃得厲害 老爸天天哄年幼的艾莎上床睡覺還縱容她用魔法玩家家酒 這叫家庭關係差 老媽生在一個精靈魔法滿地爬的魔法森林 怎麼還會怕艾莎玩冰怕到把她關自閉十幾年 迪士尼破了九十年來不拍續集的傳統就只是為了飯碗 ,1
昨晚看睡着了  迪士尼每况愈下 好莱坞快变成坏莱坞了   一点转折都没有 太难看了吧 之前还有歌曲撑撑场面 现在这首曲子all ls found 也太一般了 还好意思配那么多音乐 简直就是剧情不够舞曲来凑 如果之前8分  那这部就4分 不能在多了,2
这大概是我第一部期待赶紧唱歌的迪士尼电影 因为MV比正片还好看 当第一部颠覆性打破迪士尼公主电影桎梏时 也限定了作品的格局 所以本作冰雪姐妹花算是被迫营业 非常简单的故事 用歌曲MV充成了100分钟 但迪士尼对娱乐效果的极致体现是肉眼可见的 场面戏和视觉风格太赞 再加上固有人设魅力 艾莎御姐女王范美得不要不要的 所以本片很喧宾夺主 歌曲都很好听 但没有let it go那种经典了 总感觉调子好像啊  艾莎依旧贡献了最飒的MV 最喜欢克里斯托夫那段 怀疑他是西城男孩出来的,4
告诉你要拆坝保护自然的歌舞超级大烂片 看了这部的奥斯卡评委会不会觉得自己当时没投票给疯狂原始人是傻叉 ,1
只有我觉得这部更好听 甜乔三分钟solo和Elsa变身之歌全场最佳 冰风雨雪过后 环保少女成了新一代迪士尼女王 你说讽刺不讽刺 雪宝太抢戏了 简直是行走的剧情复读机 苦逼直男克斯托夫在这部姐妹搞姬大片里终于有了姓名 可喜可贺 至于什么是成长 从随它吧到发现真相就是成长  死 过一次又一次才会珍惜拥抱的温度,4
想了一下第一集为何成功 大概是其不按套路出牌的勇敢和深入内心的真情 而这部为了迎合观众期待所采用的保守策略 则与其初心背道而驰 平庸的叙事进展 混乱的歌曲编排都显得六年的期待无所必要 当然影片并非一无是处 雪宝消失安娜觉醒那一段足够触动人心 相信每一个在黑暗中呆过的人都感同身受 ,3
画面精致 表情逼真 动作流畅 但动画电影未来的方向不会是也不应是真人电影 Elsa负责深明大义 Anna负责真爱无敌 Kristof负责备胎傻冒 雪宝负责卖萌搞笑 人物的单薄扁平完全体现了创作团队的不思进取 还得吐槽一下歌 每一首我都有认真学唱 结果没有一次找得着调 我是音痴都怪我 ,1
画面做得更华丽 故事也编不出什么超过第一部的东西 音乐上感觉很想重复let it go的成功但所有歌都真的不太行 树林里kristoff那段后街男孩风mv我憋笑憋到内伤 ,3
就我个人而言 除了没给我第一部时的那种巨大惊艳感外 其他各个方面几乎都完美了  如果是第一部是讲述从少年到成年的成长 那第二部便是展现成年后经历风雨后的成熟 ,5
六年之后 女孩们长大了 从盛夏冰雪来到深秋密林 新的旅程却指向家族过往的秘密 Jennifer Lee聊起角色时有个很有趣的论点 她说Elsa是神话人物 超凡卓越 拥有巨大的力量 和悲伤宿命的底色 而Anna是童话人物 热忱勇敢善良的乐观主义者 第二部的结局也许让人意外 或者释然 ,4
很明显有技术进步 特效很不错 其他方面除了Elsa和Anna的CP坐实真感情 剧情和音乐基本没什么亮点 逻辑散碎 感觉并没有成功灌输第五元素到底是什么 是Elsa本身这个答案简直就是糊弄观众 对北境和艾伦戴尔的关系解读如此简单 人物成长也不大 官配BG的Anna和Kristoff的感情线连剧情绿叶都轮不上 最终草草收场 而且音乐明显不如上一部的感染力 反倒把几首独唱弄成了MV 本来就散 音乐反而把剧情切得更碎了 ,2
 请勿在MV中插入电影之有彩蛋   多一颗星给时长 再十分钟要睡着了  都是穿插电影 怎么斯皮尔伯格的 头号玩家 在彩蛋里插电影就那么好看  其实这一部说的是环保主题的故事 违章建造的大坝影响了周边环境造成了森林雾霾 于是Elsa和Anna一起齐心协力拆毁大坝恢复生态平衡 韩寒之前写过一篇杂文我很喜欢叫做 三峡大坝是个好大坝  我全程都在想这一篇文章   Olaf真的太惨了每一部都要挂一次 下次别挂了好吗 散发的Elsa真的美死了 她换装那一幕我竟然被美 哭 了 但是  that s all  场景宏大了点 但故事还是太单薄了 我一直觉得Elsa才是真女王 女主 但Anna又真的太女主运气了 最后Elsa有自己的一个大自然元素的领地真好 披下头发就放飞自我吧 骑着水马   那一幕是帅爆炸了 ,3
有趣的是 一心守护阿伦戴尔的公主必须摧毁城邦的才能解救城邦 而实际上身属北境的女王必须献身北境才能解救北境  牺牲自己的成全 最后都拯救了自己 又得到了成全  太童话以至于像真相 ,4
电影可以是艺术品 也可以是消费品 而 冰雪奇缘2 则是一部迪士尼生产的半成品  安娜和艾莎 求求你们俩不要再唱了啦 原地永远在一起才是真正的HE啊 ,2
这部动画最神奇的地方在于 情节弱智像是给小孩子看的 但歌词又像是给由于要不要出柜的成年人看的   ,2
五十六种语言汇成一句话 爱我Elsa爱我Elsa爱我Elsa   ,5
❶老规矩 随时开唱没商量  ❷贴 心虚 心地安排雪宝回顾前情 片尾彩蛋再次重复这一手法 并无喜剧效果  ❸追溯魔法森林 阿伦黛尔的历史 深入阿塔霍兰 小幅填坑 进一步完善世界观  ❸以前还没觉得艾莎这么美  ❹水灵 海 马 惊艳 海底的惊悚感昙花一现 也是惊喜  ❺官方自嘲 艾莎再次面对 Let It Go  难掩羞耻感  ❻ 冰雪奇缘  王子不是好人  冰雪奇缘2  国王不是好人  ❼高潮 平衡了各人发挥的作用 安娜解决主要危机 艾莎没沦为花瓶 克里斯托弗也没沦为陪衬 ,3
不如盼她骑马归来 ,4
1 画面太美了 有几个镜头震撼到眼眶一热的那种美 2 今天我们来欣赏一下年度横渡英吉利海峡兼水底赛马选手elsa为大家带来的精彩演出 3 elsa和anna才是真爱 克里斯托夫这种功能性男人就不要凑热闹求婚了谢谢 4  如果觉得找不到未来 就做好下一件事 5  我找到永恒不变的东西了   是什么   爱  ,4
虽然跟预期的有点落差 整体还算是完成了续集各方面的必要输出 只是从故事到这次的原创歌曲到一些场景 环境的设计 总会觉得少了一些更惊喜的东西 艾莎美丽又强大 安娜可爱又勇敢 雪宝仍是又逗又萌 ,3
这次配乐歌曲如果还能在日本火一次那真是毁三观 有首插曲估计叫lost in the woods 就是迈克学摇滚那种四级英语最糟烂80年代芭拉歌 在电影院听这种歌还不如回家躺平听学猫叫 ,3
五十六种语言汇成一句话 爱我Elsa爱我Elsa爱我Elsa   ,5
❶老规矩 随时开唱没商量  ❷贴 心虚 心地安排雪宝回顾前情 片尾彩蛋再次重复这一手法 并无喜剧效果  ❸追溯魔法森林 阿伦黛尔的历史 深入阿塔霍兰 小幅填坑 进一步完善世界观  ❸以前还没觉得艾莎这么美  ❹水灵 海 马 惊艳 海底的惊悚感昙花一现 也是惊喜  ❺官方自嘲 艾莎再次面对 Let It Go  难掩羞耻感  ❻ 冰雪奇缘  王子不是好人  冰雪奇缘2  国王不是好人  ❼高潮 平衡了各人发挥的作用 安娜解决主要危机 艾莎没沦为花瓶 克里斯托弗也没沦为陪衬 ,3
看见Elsa骑着透明马在黑暗恐怖的海面上一往无前地飞驰 我的恐惧瞬间消散殆尽 这个画面像漆黑海面上的一个灯塔 照亮前方 ,4
整个一个大型MV 散场的时候有人在楼道和电梯模仿影片中一直呼唤Elsa的声音妈的笑死我了 看了下短评都说这是蕾丝片 其实没有 只是Anna用力过猛给自己加戏尴尬得人脸疼 这么大的IP续集竟然失败到极点 满场全是孩子居然都听不到几个笑声 真不知道迪斯尼是被下降头了还是什么 真不推荐去but do go if you wanna see Elsa s new hairstyle and outfit,2
虽然跟预期的有点落差 整体还算是完成了续集各方面的必要输出 只是从故事到这次的原创歌曲到一些场景 环境的设计 总会觉得少了一些更惊喜的东西 艾莎美丽又强大 安娜可爱又勇敢 雪宝仍是又逗又萌 ,3
美国迪士尼狼子野心 炸我三峡工程 实现领土吞并,2
这次配乐歌曲如果还能在日本火一次那真是毁三观 有首插曲估计叫lost in the woods 就是迈克学摇滚那种四级英语最糟烂80年代芭拉歌 在电影院听这种歌还不如回家躺平听学猫叫 ,3
不曾想姐姐是仙子下凡惹 ,5
剧情非常莫名其妙 动机牵强 音乐也乏善可陈 姐妹情雪人情也不如第一集真挚动人 倒是小男友戏份增多憨厚可人 ,3
情节推进太快太突兀 当中一段男主的情歌MV真的是大可不必 虽然在观影前我很怕有人把这个片子和哪吒比 但是看完我甚至觉得哪吒在情节上都比它好看 至于为什么我给了3星是因为其他方面实在制作太精良我下不去毒手 ,3
年度影院最差体验之一 几乎睡着 单调得就像一款叫 艾莎无双 的割草游戏 角色脑袋上好像一直有一个箭头 跟着走就不会错过剧情 一路砍怪到底  ,2
相比前作 除了对冰水混合物的表现力全面提升 无处不倒退 总体不动人 就比如 第一部最喜欢小安娜一边唱着歌儿一边在空旷的城堡中独自玩耍的段落 那些跟名画儿和盔甲的 互动  别致中透着荒凉 当她贴着锁孔问出那句Do You Want to Build a Snowman 老阿姨我心中瞬间涌起无限哀怜 眼泪不知不觉就掉下来了 而这部所有音乐的出现都是印度歌舞化的 充满了一言不合感  而且都太难唱了 不是人调儿  醒醒  只有All Is Found是可学的   克斯托夫那段对老MV的戏仿反倒成了最有意思的 笑到变形  说到克斯托夫 第一部中是个多么富有个性魅力的阳光帅小伙儿啊 这一部成了傻子 面对这种剧情俗套人物平板但技术炸天的作品 就有一种吃造型翻糖的感觉 然而谁在乎老阿姨的意见呢 小姑娘们好喜欢啊 祝迪爸爸的新裙子大卖 好看 真心好看 ,3
妹夫的戏码应该全部删掉 都啥时候了还精虫上脑是难以理解的 把戏份让给在森林里蛰伏了三十四年的卫队长吧 他应该是一个已经加入了北族 否则无法存活 但依然不忘维护皇权统治 亦正亦反的矛盾角色 沧桑隐忍的面容下 复苏的人性和愚蠢的效忠始终在内心交战 这样改是不是好看多了 此外 尽管刻意安排了功能 初期几个拖油瓶如此黏人也是难以理解的 心里是真没数啊 直到女主恢复独来独往的属性 电影才好看了那么十分钟 当然我承认妹妹还是给力的 妹夫和雪宝滚开 ,3
除了核心剧情太简单 太容易预测外没有缺点 但作为大众向儿童向动画 剧情简单也可以理解 视听体验无与伦比 传达的价值观清晰明了 已经是这一类电影中的上乘之作 且剧情简单归简单 还是有很多细节可以回味 甚至是一部可以结合时政深入解读的电影 尤其是如何处理历史积累的种族仇恨 在 后真相 时代如何面对 真相  如何化解创伤和愧疚等  甚至于视觉上直接简单粗暴地展现 墙 的崩塌 也可看作在特朗普时代对创伤大众的一种心理释放和疗愈 现实的困境当然不可能如此简单直接 但谁都需要希望 不是吗 ,5
 C 我看见的 是全方位的技术进步和内核退步 第一部是迪士尼在时代变化下所凝结而成的极致精华 而第二部 就是在当下社会 政治与民族的对抗和冲突中 所做出的 商业妥协  为了商业而商业 为了妥协而妥协 迪士尼所代表的好莱坞 已经 鸡肋 到不忍直视了 ,3
克里斯托弗的森林迷路pv笑死我了 這一部是精靈寶可夢吧  ,3
好难看 救救迪士尼 ps 歌很难听 真的很难听,1
全面倒退 利用第一部 有意 留的边角料架构剧情 高潮则倒置第一部 五个元素的设定不新鲜 歌曲也就一首半好听 ,3
迪士尼Woman Power杰作 续集更加明确这是30 女人的自我觉醒与解放 多余的爱情桥段败笔 最喜欢与海搏斗 踏马行水  老人与海 的迪士尼版不是吗 ,4
3 6星 又名 冰雪奇缘2 魔法起源 1 可以不要再动不动就开唱了吗   崩溃捂耳朵 2 主题曲不够抓耳 具体可以参考一周以后幼儿园孩子们有没有用 受腰儿塞尔夫 取代 来特够  倒是雪宝的独唱很有趣 原声里还有一首非常复古 很像八九十年代欧美乐坛情歌时代西城后街风格的情歌 很抓耳 3 姐妹是真爱 男人是累赘 4 雪宝扛起搞笑大旗 5 剧本完成度很高 几乎没有硬拗 且没有让安娜沦为鸡肋 编剧水准可以 但我不喜欢最后的 改朝换代 设置 6 魔法特效再上一层楼 7 我其实不太懂第一部为何会大火 ,3
和Maleficent  Mistress of Evil一样 为了续而强行续出来 只好从头打造一个更新更大的世界观 而且设定还不如前者 音乐方面虽然不指望可以直接复刻一个爆款奇迹 但这些唱段的安排和曲风 连迪士尼自己的招牌都保不住了吧 音乐剧都要失格 ,3
艾莎老师的驯鹿王子妹夫可太烦人了 ,2
女王包袱真重 睡觉都不带卸妆的 眼影腮红还是超防水游泳也不晕妆,4
平心而论是好看的 视听体验做得挺好 有这么两段特效处理气势磅礴 但是故事层面未免过于顺拐和缺乏起伏了 不论悬念的揭示还是危机的处理都过于简单了 不过影片最不能让人满意的还是其中的歌曲实在是太难听了 除了小乔的那首90年代风格情歌和那一句into the unknown 其他的真的不知道在唱啥 ,3
再次感叹迪士尼的电影工业 一个远在北欧的故事 美工和冰雪结合的同时也和地域元素结合 音乐也是北欧化 全片紫红色调的光 完全就是我今年极昼时去到北极圈 天空呈现的颜色 这些细节都能得到完美还原 如果说天气之子是雨 这部则是把冰雪特效做到极致 ,4
私心是更喜欢这一部多过1的 Frozen2首先是自洽地肯定了它作为续集存在的必要性 由雪宝提出的对于未来和变化的恐惧 是对第一部童话结局的一次质疑 而安娜又完美地为这个问题提供了标准答案 永远没有一成不变的稳定幸福状态 续集和新的危机总会出现 而作为勇敢的主角我们能做的就是do the next right thing 其次 Frozen2的议题是更宏大而多义的 对真相的追寻 自然的平衡 两姐妹作为桥梁两端的设定也显示出一种迪士尼近年难得的大气 和从cp层面上的带感  最后 克里斯托弗林间皇后乐队 后街男孩式的mv不带感吗 伴唱的麋鹿团和阿拉丁的敲锣吹号猴肯定并列我今年最爱动物角色第一名 ,4
艾莎公主一换装 萝莉家长抖三抖  迪士尼果然人类灯塔 感觉讲故事倒成了其次 拍续集主要是为了价值观疯狂输出   外加新一轮的周边抢钱计划  ,3
故事一般般 但是 我 就喜欢政治正确 ,4
误入国语场 然后想起五年前在小镇上看第一部同样是国语 时过境迁 这一次觉得满场的小朋友很可爱 倒是银幕上的两姐妹惹人厌烦 用人生创伤带出一个全然虚假的故事 只看到人物表演各种情绪 表演各种悬空的困境 表演拯救与被拯救 只是用相当急躁冒进的方式 把第一部的内核又炒了一遍 情节紧赶慢赶 毫发无伤地奔向happy ending 炫技降格式复读最为致命 ,2
风火水土的世界观太老土了 想象力除了水上马也无甚贡献 旁边座位的小姑娘全程艾莎上身手舞足蹈一惊一乍 看来艾莎真的是她们的白娘子 ,2
恐怕第一次听见迪斯尼公主说 前男友 这个词 拇指 水马很酷 火蜥蜴可爱 毛绒玩具果然还是老鼠本行 歌那么多没一首有达到1的水平 故事潦草根本配不上制作 ,3
你保护世界 我保护你,2
迪粉属性自动加颗星 尽管视效升级 可无法避免的 终究是缺了那种第一眼惊艳之感 当然也缺了一首爆款级的LIG 但没有突破并不代表不优秀 这部的剧作其实比前作更复杂更丰富 世界观的延伸更广 只不过束缚在动画合家欢形式下 迪士尼怎么都会选择简单浅显的方式讲故事 所以在完成度上并不够好 前半段歌曲密集轰炸 后半段又太赶导致节奏失衡 歌都很好听 可确实有些唱段没必要 雪宝的独唱基本上是吸引小朋友硬给的 男主仿MV式的唱段诚然喜感十足却也很违和 歌曲的感染力和叙事参与度下降造成了大家歌曲太多故事不够的错觉 其实上部的歌并不比这部的少 好在人物立得依然稳当 且各自都有成长 结局的安排一定会有人不满意 但我觉得挺好 最后只想说 人美景美歌好听画面好看还要啥自行车 难道本来不就是去影院听歌就完事了 放心看吧,5
花一张电影票的钱逛一次迪斯尼主题乐园 感恩 ,3
1 毕竟是迪士尼打磨数年的旗舰制作 各种水体的拟真感 树叶 冰晶 雪花的3D漂浮感 各种复杂环境下的动态打光 还有毛发 纺织面料的渲染 面部表情的丰富度    这技术呈现 两个字 无敌 三个字 集大成  2  音乐太平庸 相比第一部几乎没有什么记忆点 好音乐大概比好技术难得得多   3  Kristoff那段森林尬唱已经不是像MV了 那调度那剪辑 就是字正腔圆的MV 其地道程度已经颇具一种恶搞感 反正我是看笑场了  4 海面御马那一段的动作想象力着实牛逼  5 片中角色数次让雪宝闭嘴 我深表附议  6 看着湿身安娜在岩洞里点亮火把 还有拆大坝时走哪塌哪就是摔不死的风采 我瞬间穿越到了古墓丽影  7 连我都发自肺腑地觉得姐妹俩的每一身衣服都太好看了  遑论那些小女孩了 估计周边又要卖疯了 可惜动画片好像没法报名最佳服装设计啊 ,3
感觉比第一部的主题更宏大 如果说第一部说的是少年到成年的历程 那么这部是成长到成熟 响应召唤 解开谜题 担负使命 这是成熟必经的考验 两姐妹不离不弃 携手完美解开难题 大团圆结局并不俗套 而是顺理成章 特效太惊人了 细腻度简直像是真的 在暗海征服水灵一段极为精彩 蜕变后的艾莎美爆 衣服设计一流 雪宝和火灵担当起卖萌大任 男主倒显得有点弱 整体来说观影体验非常好 时间充足的话再去补一遍IMAX ,4
套马杆的 Elsa 你威武雄壮,3
雪宝 以一己之力拯救全片的男人 哦不 雪人  艾莎更飒了 场面更多格局却更小了 没了有趣的主线 变成了一首接一首的mv放松大联欢  第一部是颠覆传统与认知自我 这一部是寻找自我和种族和平 但 不就是把多年前的风中奇缘的主题再来一遍吗 啊 多么的政治正确 ,3
预定为明年奥斯卡最佳动画片 虽然剧情比起第一部会相对薄弱 不过这部主要已经不是在说故事而是在说一个人的成长心历了 艾莎虽然得到别人的理解但依旧觉得格格不入 安娜会发现自己不能再那么天真不理世事 克里斯托弗对跟不上安娜的脚步惴惴不安 雪宝对于成长的烦恼 这些都完美呈现在角色歌里 有几幕配上歌和同伴都哭得稀里哗啦的 也听到电影院里有抽泣声 就连现在写心得回忆都鼻酸 这是第一部所没有的现象 配曲的话 比起第一部只喜欢let it go 第二部所有歌我都喜欢 无论从对应到剧情还是个人经历来说都完美契合 已经打算买官方碟了如果有的话 可以看到迪士尼真的花重本在特效上 有很多幕逼真得我以为一个真人套上卡通头套在演 沙子啊头发啊海浪啊细节部分更是让人惊艳 总的来说也许不会比第一部卖座 但口碑会超好,5
艾莎总能抢先泳有淋淋演唱会最想要的舞台效果厚 下一部要生娃玛琳菲森了 ,2
全片长104分钟 掐掉片头片尾和彩蛋 还剩84分钟 掐掉所有的歌 还剩54分钟   只有我一个人觉得艾莎很难看吗 挣扎皱眉的表情太扭曲了 ,3
这还不是骨科我根本不信 ,3
与 沉睡魔咒2  星战9 共举 表面更花俏 内核一包草 的绣花枕头迪士尼续集电影 还都在2019下半年扎堆上映 是约好的 ,3
迪士尼请不要再传播 水有记忆 这个经典谣言了,4
印第安原驻民和西方殖民主义的议题终于不局限在艺术创作中了 ,4
通宵陪你帮你准备向别人求婚 看着你怀里的戒指 我笑得多开心啊 A 我骑着马 只为向你飞奔而来 两对不好吗为什么要形婚,3
购票就看奇迹莎莎在线性感换装,3
进步的只有技术 金玉在外 败絮其中 华而不实 空洞无趣 连原声带也没有前作好听了 ,3
姐妹真好啊 之前比较喜欢elsa 现在更多的喜欢anna了  elsa回归森林也获得她追求的自由 anna也拥有了从小渴望的爱情 非常美好的结局 姐妹虽然分居两地 但心中仍然是彼此最重要的存在 我想这就是童话吧 我们需要的童话 ,5
赶紧忘记吧 就当我没看过 ,2
時代進步最好的就是公主不必再靠白馬王子拯救 自己就是又帥又美又能救國的白馬公主 女人一樣可以成為自己想成為的人 兩位公主王冠之下始終姐妹情深 這比任何愛情都打動我 ,4
迪士尼算是把新女性 权 主义的公主片模式做到了极致 双公主 女王  不需要王子 有也是坏的见一次打一次  甚至不需要男人 有也  是笨笨的中途就消失没用的  解决问题建设美好生活仅女人就行了 是新时代独立女性思维 也迎合了当下好莱坞女人与黑人就是政治正确的潮流 除了人与自然   或不同种族之间 和谐的低幼主题外 片中还讲先进文明通过帮助落后 原始 文明修大坝 或修其他东东 而对他们的掌控阴谋 耐人寻味 充满隐喻 整体上 影  片制作佳 想象好 画面美 歌动听 情动人 笑料足  不输第一部 若家有适龄女孩不带去看 我都觉得不是亲生的哈 Ps 字幕出完有一彩蛋 好精彩   ,4
elsa 把人一生机勃勃的村子变成了暗无天日的冬天德国 大反派没问题,3
翻译过的一本书 还没出 里有一句调侃 2013年以后 欧美国家每一个八岁孩子在自己的生日派对上都要打扮成艾尔莎 小时候看过的动画 喜欢过的角色塑造了我们心里某个未必能达成的自我 如今小姑娘们喜欢艾尔莎 渴望拥有对抗全世界也保护全世界的强大力量 能冒险 能作战 多好啊 ,5
打五星是因为第一部是一百颗星 其实没有第一部好看 但是作为第二部拍成这样也很不容易了 毕竟第一部是神作珠玉在前是不可能超越的 姐姐美哭我 太美太美了 姐妹情感人肺腑 同夫克先生拼命找存在感然而怎么感觉更悲哀了 PS 请带小娃的家长一刷去看国配好吗,5
我最喜欢这个IP的一点就是 情感永远不会被困在痴男怨女的爱情里,4
 冰雪奇缘2 预告片诚不欺我 尽量IMAX和杜比视界才能对得起贯穿全片的美术水平 世界观的扩大带来了远超越第一部的冒险 奇幻元素 给视效充足的发挥空间  秋 冬这个视觉基调简直是帧帧戳心 Elsa真 极限 颜值   至于角色关系 只要稳就是赢 毕竟该该破该立的第一部已经说的很清楚了 那种颠覆性的惊喜也是不可复制的 这种处境其实和 沉睡魔咒 很相似 但 冰雪奇缘2 主创团队的处理就好得多   意料之外的小惊喜是两处对喜剧元素的处理 雪宝真是个讲故事抓重点的好手hhhhh 千万别错过彩蛋 也是一段雪人型小剧场 另一个是男主 效果类似于 无敌破坏王2 中对公主电影的戏仿 只不过这次特别有八九十年代抒情摇滚MV的鬼畜感 尤其是在片中就可以和其余歌唱段落形成迷之反差hhhhhh  ,4
迪斯尼从来不会让人失望 ,5
糟糕的故事,3
比邻里美好一天更美好 同性恋题材迪士尼请给我再来一打 骑白马的公主请再多一点 被无视的男主角请自觉和森林勇士搞基 ,4
好像不适合孩子看吧 海里那段堪比恐怖片大白鲨 造型是好看的 坐在电影院里想伸手摸Elsa的头发和脸,2
迪斯尼不光在炫技 还在秀时装秀   爱莎的服装太美了   ,5
anna男朋友的土味MV真不能忍 ,3
