comments,star
续集时隔六年 照说这个制作时间也不仓促啊怎么还搞得这么平平无奇好像为了续而续一样 上一部所有的亮点全都没有了 变成了一部平庸的无意义的不算好听的过目即忘的童话 气死了两星 想了想不舍得 为了我爱的艾莎女王勉强加一星吧 她战斗的时候多美啊啊啊   ,3
泪点在雪宝变成一冢新坟 洋洋洒洒的雪花飘落在Anna的肩头 Anna失去姐姐 失去雪宝 失去光明 她独自一人坐在黑暗的山洞里 唱起那首要迈出下一步的歌 唱起要做下一件对的事 有的时候 对于黑暗情绪包裹的人来说 最难的就是迈出下一步 the next right thing这一首歌是我的最爱 Elsanna冲呀 ,5
其实是有些失望的 剧情太差 老套俗套又不符逻辑 忽然唱起来的歌曲经常令人觉得很尴尬 也就是从第一部延续的一些情怀和特效厉害艾莎造型超美 发型除外  让我给个三星及格分 哦对了 雪宝还是超可爱的 ,3
橘里橘气2太 他 马 好 看 了 特效 舞美 人物 表情细节 音乐 包袱 全都太棒了 除了剧情 我可以吹上天 那些打一星的 是不吃辣的人专门跑到巴蜀火锅店来逼逼赖赖吗  ,5
随它吧 随它吧 想超第一部已经没办法,3
画蛇添足的一个故事延续 已经到了完全不必在意人物矛盾的地步 空余自作高潮的歌舞片段 ,2
啊啊啊啊啊啊啊啊啊啊elsa嫁我       ,5
人类应当对自然保有敬畏 有错误就要承认改正 即便会有极大的代价 勇敢追寻真相 爱是永恒的 来一个温暖拥抱吧 喜欢这些简单的道理 喜欢迪士尼用恢弘 美轮美奂的大片来讲述这些简单的道理 骑白马的不一定是王子 也有可能是公主 本片绝对女权 公主都是勇敢有爱的女英雄 ,5
Elsa美 好美 太美了 没了 ,3
迪士尼如何做烂一个IP 请不要做疯狂动物城2了 本来挺好一线索,3
我猜下一部剧情是艾莎收获爱情 ,2
从2016年标记到现在 终于看了期待已经五年的冰雪奇缘2 或许有人会觉得不如1 但这个系列带给我的影响是深入骨髓的 从第一部的找到自我 找到爱 到第二部的做回自己 让我更加坚定的面对人生 画面和特效都美哭 除了男主的一些情节处理的稍微不太完美 其他很棒 不失为一部优秀电影 高光时刻在艾莎歌唱蜕变 揭开真相的时候 全程忍不住流泪 配音方面 双女主回归 周帅的艾莎比起第一部的青涩多了一丝温柔和成熟 安娜还是一如既往的活泼和甜美 克斯托夫比起第一部的潇洒多了一丝可爱 赵路的雪宝灵动多变 赋予了这个角色生命 还有惊喜客串的范楚绒和姜玉玲 李潇潇和胡维纳的配唱几近完美 在高光时刻似乎又回到了随它吧的那一刹那 也令我回忆起了贝娜 多年已逝 故人已去 感谢冰雪奇缘 感谢多年相伴 ,5
小祯 快去排队 Elsa跟Anna又出新衣服啦  我为什么不躺床上再看两遍那集康熙  不过 要实名表扬同场的几位小朋友 你们比那些碎嘴子大人棒太多 安安静静地看 整整齐齐地笑 嗝儿嗝儿得我都好开心了 ,2
Elsa的紫色眼影也太重了 而且一直都是那个铺满的紫色眼影 为啥不能给Elsa画个淡妆 或者变换衣服的时候换个眼影 紫色满铺有点显老 还有就是为Kristoff感到不值 Anna心里根本没有你 只有她姐 你鞍前马后的完全就是个工具人 她为了她姐能一秒抛弃你 不值啊不值  200114 冰雪奇缘2掉了奥斯卡提名 带字幕复习了一下 第一部就没有特别喜欢 这一部更是感觉一般  ,3
真是太美了 ,5
非常不怎么样的一部续集 不否认有一两处华彩段落 但整个故事其实细想起来非常尬 为续而续 四元素说 爱的力量 水有记忆 第五元素   感觉看个电影得不断脱帽致敬的亚子,3
旷野传奇 冰雪大世界 第五元素 偶有亮点整体boring 妹妹想要绑在姐身旁 姐姐偏偏不让妹妹绑在姐身旁 借着为对方担忧之名的撕吧硬制造冲突 支线的烂梗真的受够了 这部rio往MV里插剧情惹 不过就算当作音乐剧也有让人迷惑 捉急 的时候 女票走了追啥 愣着唱歌啊  不过这段 迷失森林中 MV的复古风格整挺好  你姐遇险了魔力消散了 想法子救人作甚 哭着唱歌啊  我是真的很不解 到最后揭开阴谋 歌颂爱情 咋说呢 就挺低幼的 看在雪宝耍宝的一分钟剧情讲解和新萌物的份儿上给三星吧  PS 片尾字幕显示制作期间得有二三十个baby出生 才反应过来芙蓉镇1是快六年前的片子了吗   ,3
奇怪这部电影为什么这么低分 Frozen是比较贴近迪士尼古典动画的路子 但并非单薄单一如某些人所描述 特效华丽惊人自不必说 故事完成度也比较高 艾莎脱下靴子扎起头发 一遍遍冲向滔天巨浪 安娜孤注一掷地走向断裂的坝桥 她们一脉相承的勇于担当 都燃炸天了好嘛 艾莎穿着白色裙子策马扬鞭的姿态真是美艳绝伦 整部电影都在欣赏女王冰肌雪肤的容颜 她真是和冰雪一样纯洁勇敢 内美外美 无所不美 第一部其实略低龄了一点 但第二部就好很多 不知会不会流失很多幼年粉呢 ,5
Elsa的梳化服都比Anna仙太多了吧 特别在跨越大海骑马那段 3 5星,4
开始学会面无表情地坐在影院里看迪士尼的合家欢电影 算不算迈向成人世界的第一步 ,2
阿伦代尔的公主也太难当了吧上山下海攀岩奔跑 可见自从上一集之后天天可能都在硬核训练 下届奥运会包揽铁人三项金牌,3
Kristoff的独唱片段是高光时刻,3
仍然保持了好莱坞musical的audio dissolve等特征 整体拍得一般 ,3
特效五星 音乐没有上一部令人印象深刻 剧情没交代清楚 衣服挺好看的想来一套Elsa同款睡衣,4
跟 沉睡魔咒2 套路真的好像 在困难中转向关注自我本源 迪士尼世界里忠心的摄政王就是安娜了叭 艾莎解决了这一部的问题之后竟还开疆拓土了 一开始买错票误入中文场 中文翻唱尬到jio趾头抠地 满场坐着鬼哭狼嚎的幼儿和姐姐阿姨 妈妈们一脸慈爱大声给自己大喊大叫的熊孩子讲解剧情 孩子不领情哭得撕心裂肺 迅速逃出重新买了英文场 影厅里果然正常多了  ,4
没那么差 工整 节奏也可以 就是伪男主90年代mv那段有点莫名其妙 冗长 ,3
大型音乐剧现场,4
女二 穿皮衣更好 我 whore  me too ,3
不像別人對迪迪尼有那麼多期待 所以看得很開心 安娜還是最討人喜歡 雪花做成八角形讓我有點難接受 重點錯 ,4
 老艾莎与海 ,3
二胎宣传片 歌比第一部还难唱 小裙子都美翻了 近几年迪斯尼公主系的主题都是 即便你是公主 即便你拥有魔法 也要特别努力特别拼 对抗既有的命运和随时出现的意外 ,4
整个片子靠雪宝一个人耍宝撑起来的 人物没有任何成长 戏剧冲突也是标准模版 无聊程度超出预期 最重要的是 作为一个歌舞动画 歌真的不好听  中间插的几句let it go都顺耳得多,2
完全不如1好看   看困了都 剧情烂透了这是大型MV这是吧   ,2
所有女孩 看过来 Elsa新一季时装发布会来啦 正常发挥的续集 没什么惊喜也并不难看 画面美 但是这一部不会再有传唱度那么高的歌曲了 晚九点场 厅里一个 公主 都没有 观影极度舒适 ,3
应当说这一回终于让我能重新正视这个系列了 迪士尼这回做对了 而且剧情设定到此才完善起来 剧情说实在的第一部也就那样 这部够可以了 歌曲完全不比第一部差 只是相对有点慢热而已 而且歌曲数并不比第一部多 此前因为第一部影响让我一直犹豫是否去看 现在看来确实不虚此行 不过这也意味着我以后看待这个系列只能从第二部开始了 之前的作品全部作废  ,4
不理解评分为何这么低 也不理解为何没有入选奥斯卡 片子很好的承接了上一部 还深化了姐妹之间的感情 特效更是没的说 唯一的缺点是情节推进稍显突兀 但整体上不失为一部优秀的续集 ,4
歌曲还是一如既往的好听 特效吹爆 羡慕现在的小孩童年就有这么棒的动画电影 艾莎终于完整接受了自己 安娜真的好勇敢蜕变成为女王 父母的形象也鲜活起来 男主和驯鹿 雪宝也非常可爱 以前是公主等王子 现在同样可以男主等公主 在追逐爱的时候遇到和爱人分道扬镳的时刻如何选择 原地等待的人儿等来了他的爱 雪宝的成长就像是我们小时候 想懂一些道理 还是不懂 慢慢体会最后成长 电影剧情还是很一般 但是这样的动画迪士尼拍一部 我也乐意看一部 ,4
终于来看啦 仙气飘飘的艾莎 回到精灵之列 行动力超强的安娜 成长为女王 感情和梦想的每个方面都顾及到 体贴好看的电影 艾莎的裙子太美 连我都忍不住憧憬,5
剧情内容和逻辑略糊弄 但特效画面是真的牛逼得没话说 看到评价称这是关于  神话人物Elsa 童话人物Anna和同夫男主Kristoff  的故事简直精准 感觉全片最有记忆点歌曲就来自同夫男主复古又戏精的八九十年代情歌男团质感献唱 ,3
这一作的故事是真弱 不过两位主角却是更可爱了  大海的场景如果再曲折一些 可能更好看  男人没有去拯救世界而是在谈恋爱 嗯 ,4
6 歌和画面算是迪士尼正常发挥 但其他方面真的没追求 本质上是个卖周边的广告片 第一部女性价值的探索和再定义到这部变成了一个非常传统的冒险故事 人与自然的冲突 种族间的倾轧也都是老梗 了无新意 迪士尼的倒退真是肉眼可见 所幸歌是好听的 画面是炫目华丽 票房和衣服是可以卖的 但也仅此而已了 现在我对疯狂动物城续集的质量完全不看好了,3
冰雪MV 奇缘2 MV太多 少了些原有的叙事 画面依然很美 看来因为上一部let it go的大火在这一部里加入了很多歌曲 这也没什么不妥 只是可以少一些 ,3
等了很久很久的彩蛋 以致于第一次和影院工作人员攀谈起来 他说看了彩蛋就会知道电影白看了 这真有点夸张了 不过整体真的是比较平淡啦 ,3
如果说第一部的叙事形态大致还属于童话范畴 第二部则更接近于神话 用荣格学派理论来进行解读 也许会是有趣的 禅宗说  急需认取仙人面 莫认仙人掌中扇  抛开商业化的制作手法不谈 内核还是自我的成长之旅 开始一段的空灵飘渺的歌声 以及艾莎公主走出王宫那一幕 可以令人联想到悉达多王子半夜逾越王宫出家修道的故事 当然 内在动因的深刻性不足 解决也仓猝 倒正符合现代人所谓内在成长的自我构建的神话 ,5
第一部是假歌舞片 第二部是真MV 姐妹接力化解危机而男性角色功能被去中心化不错 观影经验有一点被冒犯到 但是瑜不掩瑕吧 剧作表达核心相当保守 设定也不太说得通 看完出来没一会就发烧了 真 冰雪奇缘 ,2
我也想要这样又美又飒会魔法 身骑白马奔向我的姐姐 ,3
退步 整的第一部有多好似的 有啥区别,3
太爱这里面的服饰了 第二部的剧情整体上没有第一部好 但是特效上真的让自己很舒服呀 雪宝真的太萌了 克里斯托弗说真的你那段苦情mv我真的好想笑 ,4
不得不说迪爸爸的技术在肉眼可见的进步 不过虽然有几个高光画面 但是这部的美术还是太敷衍了 很多pattern完全没新意 Elsa有些魔法特效还特别像建模软件的自带模型 最可怕的是 我真的是第一次在电影里看到这么多纯色背景且只有一个主角在前景的场面 还有一段直接黑背景  剧情也十分随便 全靠音乐在撑,3
艾莎变身时我感觉怀中钱包一紧 nm衣服又出新款了   ,3
画面延续精美 雪宝继续笑点担当 角色各有内心侧重 音乐已难以超越 Let It Go  跳出乐风Kristoff那首复古MV内心独白反倒最深刻 ,3
好难看啊 剧情太弱了 场面也不华丽 ,3
    三七分是好看我现在立刻马上要去吹头 电影就算了吧幸亏是单位发的票我没出钱,3
个人觉得很好看 没什么好挑剔的,5
这部各种串戏到降世神通和Moana 听说本来还打算给Elsa安排女友但是因为某国censor干涉作罢 太可惜了,4
歌难听 戏难看 只有特效还值得一看 ,3
整部电影充斥着迪士尼那味儿  画面很震撼 但是剧情真是白开水  ,3
不要再唱了     ,4
x,2
美死啦 艾莎就是个天仙 ,4
我还挺喜欢的 就是那种会推荐所有女生看的片子 ,4
陪猫看的 她很喜欢 ,4
画面美到窒息令人震撼 但是故事性不强 ,4
女儿在电影院看的第一部迪士尼动画片 她看得很入迷 ,3
音乐部分    一般般 片尾曲  Panic  At the Disco 乐队的版本 十分的赞 ,3
虽然画面特效什么的真的很不错 但剧本什么鬼 唱的什么玩意儿 不知道的以为我在电影院看mv呢 ,2
剧本也太敷衍了吧  ,2
anna一定很奇怪为什么她姐每次离开后再回来就会换一条新裙子并且美出新高度,5
Kristoff的中途退场 我仿佛听到脚本会议是这样的  这个角色没啥用 别占时间   你不觉得这样抛弃他太可怜了吗   呃 那给他一首歌的时间   弄点复古MV   来点90年代失恋情歌元素  于是我把这场戏列入我看过的最尴尬的top 10 musical scenes ,2
中间男主   mv 自带的90年代迪斯科土气让我大笑了二十分钟 说实话 今年再看frozen基本已经把第一部的姐妹情仇忘的一干二净了 导致有点儿看不懂 ,3
骑着白马踏着海浪的Elsa literally帅哭我呜呜呜  请给Elsa一个女朋友 ,4
与其说是故事的胜利 不如说是包装的胜利 这一次的人物造型依然可圈可点 但歌单恐怕很难出圈了 以及 从 音乐之声 到 冰雪奇缘 系列 仿佛好莱坞出品的音乐电影主人公必须张开双手转圈圈 ,3
 C  两星水准 多半星是娱乐性尚可 迪士尼优秀动画生产的又一表达 场面 镜头 制作趋于完美 仍然遥遥领先于世界 迪士尼同样也还写的出一部完整的悬疑性剧本 但与此相对 明显的是 它已经完全失去了讲好这个故事的能力 每一次重要节点的变奏 幕与幕直接的衔接 每一段的表达 每一首歌曲的再现 完全就是按部就班 机械化的表达 死气沉沉 甚至这样还表达不好 只能用不少尴尬的硬性搞笑 多次的自我致敬 甚至可笑的场面 大型歌曲MV的插入 来掩饰自己的无力 全片唯一剩下真正动人的地方 就只剩迪士尼有史以来最美公主姐妹花的脸了 我爱艾莎   看迪士尼自己的自我退步 只需看 冰雪奇缘2 中高潮部分艾莎独唱与 冰雪奇缘 的一首 Let it go 的差距 看迪士尼与皮克斯的距离 对比处理雪宝与冰棒的结局 高下立判 ,3
迪士尼太难了 头一部系列作品的原声比故事本身还受期待 故事本身及格 但没出金曲成了减分项 迪士尼太难了 ,3
比一差多了 剧情不可理喻 Dyke的双关隐喻  ,3
歌舞MV不错 唱腔可以 ,2
太难看了  ,1
技术上确实代表了当今3D动画最高水准 服饰细节 水体流动 光影明灭 虽然是卡通画风 但整体还是比 大镖客2 这样的游戏画面扛把子更出色 音乐同第一部一样多 可惜 Let it go 这类神曲毕竟不是想写就有的 除了更进一步明里暗里捧女性力量 剧情比之前明显是退步了 挖掘前人历史很牵强 希望别再有更牵强的第三部了吧 ,3
迪士尼本部最近的动画续集真的不太行啊 这么万众期待的片子 故事还是讲得太差了 故事本身没有问题 是成立的 问题就出在矛盾和冲突设置上 导演意图太明显 大多唱段又强行高潮 可惜 ,3
唉 就这样吧,3
艾莎美到可以让我忽略其他的槽点 ,4
没有想到2拍得这么认真 水中的马真的超乎想象 这次最出彩的歌不是来自Elsa,5
本来1就不喜欢 这2也太差了吧 不能看了 ,2
Elsa 我很高贵 男人没有机会,4
模拟人生小棱锥 4加星级dancing queen合成雪花大舞池配环绕Inside Out荧幕 后街驯鹿和声钢铁直男 阿娜雪宝已经尽力 水电站破坏生态之灵 跨族交产出女巫终究归属野人 歌也完全低个档次 懒得原创就吃力不讨好,3
全场都是小朋友竟然没有吵 说明中文配音剧情简单不恐怖也不无聊是止熊利器 ,3
豆瓣评分接连下跌 一定是大家期待太高了 这一部续集没有在戏剧张力上让大家高潮迭起 而且没有上一次爆发式的主题曲助性 但在情感内涵和人文深度上是有增无减的 音乐和画面依然很美,4
悉尼影院里到处是欢乐的小孩子 作为第一部的粉不得不承认有点失望 模板化的故事和很多歌曲都不如第一部 只有美哭了的华丽视觉效果和画面 这部似乎更加努力在朝musical的方向做 加了好多歌曲 每个主要角色都有各自唱段 可惜没能超越第一部的几首金曲 最感动震撼是Show Yourself一段的歌曲和画面 看完只想回去再看一遍第一部Let It Go的部分  ,3
这部描写的是成长到成熟 通过 水是有记忆的 和 苦恼之时唯有行动 两个穿插的核心完成了爱莎和安娜各自的突破 找到了自我价值实现之路 后篇两个人都太有魅力了 姐姐破冰行动后驰骋在辽阔无垠的世界无比动人的样子可能会深深地印在每个小朋友眼睛里 妹妹独自选择了城市的命运鼓起勇气真正的承载 行动 的力量也让人得到正向能量 歌不好听但是人很 ,4
流了幾把淚,5
画质党的福音 见证大型舞台秀的诞生 还是加全息投影的那种  虽然主演里有个唱 汉密尔顿 的 但也不至于这么浪吧      不论严格还是不严格 这都不算传统电影了 依靠音乐 走位 华丽的计算机镜头语言 这就是那种 可圈可点 的电影 突出表现为视听卓越 剧情混乱 结尾彩蛋还以Good Story嘲讽了一波观众 潜台词显而易见 我们迪士尼无论怎么浪都能搜刮你们的钱 一场MV也不例外  P S  感觉让迪士尼去做青稚以及顶上之战有戏 艾莎迎着挪威怒浪逆流而行太帅了 ,3
能再看到Elsa还是很感动的 但是编剧不太行 我能看到他尽力了也没编圆回来 因为没有足够的剧情动力 所以人物性格有些地方崩得厉害 动画也显得演绎很用力 有彩蛋 可以一看但是有点失望,2
这种电影 平庸就意味着不合格,2
迪士尼有三宝 和解伐木累公主唱歌好    没有什么事情是公主唱歌不能解决的 一首不行 就再来一首    我觉得安娜也是有魔法的 看完了也木有 看来是得憋到第三部    爱莎通过水的记忆看到先辈的过往 五维空间里的马修 麦康纳都觉得似曾相识呢    各种似曾相识 才是迪士尼的常态 第一部让 王子滚开 非常具有开拓性 但迪士尼常有 开拓性可不常有    你应该也不会期待故事还能达到第一部的高度吧 你应该也不会期待再有一首 Let it go 级别的歌吧    技术太牛逼了 柔滑细腻 晶莹剔透 尤其是那匹水马   ,3
艾莎依旧美出新高度 闯迷雾施魔法踏海浪降冰马 尽显高大上尊贵女王风范 而安娜在本部里也成长许多 努力扛起肩上的担子为爱而战 王子继续花边酱油 存在感还不如雪宝 求爱失败森林尬唱那一段笑死 剧情则是非常套路的寻找父母身世之谜化解双方仇怨 不过片里的几首歌是真的挺不错 个人觉得完全不输 Let It Go  特效也足够美轮美奂 就是希望迪士尼下一部能好好打磨下剧本 总是一味的保守合家欢很容易视觉疲劳 ,3
男配唱歌简直像拍MV 还好他不会问我和你姐哪个重要 ,4
如果这都不算爱 为了性取向还是放弃les 两姐妹都成为女王 冰雪女王才是王道 安娜始终长不大 雪宝也是可爱不想长大 火精灵蜥蜴也是搞笑 驯鹿也是单身鹿 男主算是吧不在单身狗 可有可无的角色 还能出3吗 迪士尼还有救吗 音乐电影只有音乐   ,4
地火水风这个梗迪士尼真的用不完了吗  安娜的配音为啥老是喷麦   期待Elsa的小火蛙 流马 项链 周边  ,4
真难看 没完没了KTV 海里套冰马算是个亮点,2
歌是真的好听 画面是真的好看 但剧情也真的是没什么看的 ,3
 当你看不到未来的时候 那就做好眼前最紧要的事   天哪太好看了 不逊第一部 艾莎女王新造型美死我了 神仙姐妹情 ,5
剧情好弱  ,3
9分 艾尔莎太美了吧 好仙 好喜欢 魔法的世界太令人想往 ,5
剧情不够歌来凑 求导演来个无打歌剪辑版 驯鹿小哥是不是被编剧讨厌了  雪国想坑鹿国结果搞得鹿国锁国 emmm   看起来好熟悉,3
四星半 半星给双女主  想起在英国时收到的雪宝 ,5
   裤脱看这 真的是 知心爱人之姐姐妹妹站起来 MV中穿插了很多特效强制高潮 风火水土什么的元素神奇宝贝当然也是比不上百合大法和万年备胎了 ,2
前半部分略无聊,3
故事世界很好的 稍慢 克斯托夫唱歌一段败笔 ,4
飞机上边看边听弟弟剧透了大结局 然后我们就快乐的去玩猜英语单词游戏啦 想说Elsa的新裙子比第一部好看哦 很少女心了 ,3
皮肤和头发渲染不错 感觉raytracing不要钱 但又觉得特效有点钱花少了 我想可能大家对特效有一种相对真实的预期 在动画片里你随便做做就看着很真了 但放到实拍片里只要有一点没做好就会觉得很假 这是一种双标啊同志们 ,3
看困了,3
不能改变的过去这就是最大的反派吧 米娜桑 你的童年 你父母的经历 还有你祖辈犯下的错 都等着你去发现去和解 有点想吐槽的是剧本的政治正确以及自然主义 不过特效这么棒 姐妹情这么深 女性这么独立 原声这么棒 对迪士尼还能有什么要求呢 Elsa必将成为单身者的守护神 只身探访北海的那一段根本就是哈利波特翻版啊,4
我的意中人是个公主 她会骑着白马施展魔法来救我 心中有百合 看什么都像百合  ,4
 4K ,2
这部电影讲述了一段某君主制国家转变为二元君主制的历史 误  烂漫无邪 绚丽夺目 迪士尼能改变世界是有理由的 女王骑着冰马 在汹涌的大海中奔驰 今年看到的最浪漫场景 技术上登峰造极 真人电影里也少见如此灵动的流体特效 扣一星是因为剧情不如上一部跌宕起伏 他们看起来就不会有事 而且歌曲的穿插有些退步 没那么多洗脑神曲了  影评人 国庆档给 攀登者 打五星 给这部打三星 是收钱了还是觉得雪山绝恋更好看 不过观众自己是会投票的 ,4
不要给新女王男朋友任何solo机会 拜托拜托,5
傷心北冰洋 不是 和吃瓜馴鹿好好笑 Elsa的衣裝部一定是頂配 ,4
当我看到阿伦黛尔没有被大水冲毁时 我感觉自己长大了 突然深刻感受到happy ending只会出现在童话世界里 成人世界不会 六年好快 ,4
吉隆坡点映 超好看 鸡皮疙瘩没停过 又有很多首记忆深刻的歌 和前作的故事结合了起来 超精彩 我永远爱迪士尼 ,5
观感上给人一种梦境般的体验 但是故事逻辑经不起仔细的推敲 ,3
假续集 真姬片 预料到了会逊于第一部 但没想到居然这么无聊 全程除了看姐妹俩深情对视抚摸牵手 就是看雪宝卖萌搞怪 后面观众的笑声一波接一波 而我却完全不知道笑点在哪 只能继续对着大屏幕呆坐 比较意外的是这次连特效也没能收买我 画面还是好看的 但还是无法弥补剧情的幼稚无聊 倒是Elsa披下头发的一瞬间着实惊艳到我了 实在太美了  另外一言不合就唱歌也就罢了 关键是为何没一首好听的  至少没戳到我 很努力地去欣赏旋律 却还是以失败告终 以至于看到最后耳边留下的回忆就只剩下 右边男生吃快餐的塑料袋声 左后方小孩和家长的对话声 以及右后方一家人中小孩的哽叽声叫喊声 妈妈的安慰声 爸爸的讲话声和外放视频的声音了 倒也是一种别样的体验 ,3
雪宝浑身 宝里宝气 的 一刻也不能停止对世界的困惑和好奇 有说不完的脑筋急转弯和冷知识 到处蹦蹦跳跳 希望有永恒不变的美好 希望快快变成大人 偶尔也会有冒出类似 大自然用无情的季节更换嘲讽着我 的小诗 像我妹妹 偷笑  万物生变 面对还是逃避 即使你想忽视 生活也会毫不留情把你推向另一条路 做好眼前事 我们要进入森林 一步一步前进 森林里有黑暗还有潮湿和空洞 但当我们都经过 想必一切嘈杂都将平息  ,4
大爱Elsa Elsa美出新高度 Elsa值满分 个人偏爱   ,5
剧情也不能算直给 就是太套公式了 一说第五元素大家都 哦 的那种感觉 像是迪斯尼MV精粹夹一点过场戏 目的主要是唱歌和姐妹换装秀 这部OST个人觉得比上一部还好  姐姐拒我千百遍 我待姐姐如初恋  百合线太美了 今年冬天想找个雪多的地方堆一个Olaf   ,4
就不能再给艾莎一双鞋吗  ,4
女权片 评分一定很高 政治正确,1
