comments,star
本周在影院看到两次 意志的胜利 片段 而且这部和 A Hidden Life 的开头都选了几乎相同的几组镜头 希特勒阅兵时右肩部特写我再也忘不了了 这两部一前一后看 衬得这部简直不能看  也许是我今年尤其刻薄了 但关于纳粹 I don t ever want to feel good  即便是点缀幽默的可爱小孩成长故事 是儿童眼中过家家般的法西斯 是玫瑰色的初恋和美丽的母亲 是丑角化的希特勒 它也不应该让我 feel good 它不应该将感动 安慰与劫后余生轻轻松松交予我 让我以为那些微小的反抗与人性的坚持是童话般的英雄主义 ,2
竟然还藏了一条暗戳戳的基佬线,3
幻想人物 儿童视角 荒诞现实 所有手法都不新鲜 体现出了好莱坞善于将一切艺术创新融入主流叙事的本色 质感做得过分鲜亮了 感觉是影城里拍出来的 所有对邪恶的展现都过于幼稚 这用 孩子眼中的世界 是解释不过去的 毕竟拍的不是儿童片 只有老妈死的那个场面稍微有点触动人心 不过说实话 斯嘉丽对这个角色而言有点过于漂亮了 ,3
 ９ １０ 也许所有的喜剧本质上都是悲剧  影片的主题是告诉德国小孩犹太人也只是普通人 但这部电影本身 又何尝不是告诉观众德国小孩同样是普通人呢 满脑子纳粹思想的乔乔 本质上只是个想成为 了不起的人 的孩子 但在那个时代氛围中  了不起的人 又能是哪些人呢 纳粹根本不可能教孩子们英美人权思想之类  了不起的人 只能是纳粹 而乔乔心中幻想的鼓励自己成长的英雄 只能是希特勒  老实说我小时候看了哆啦A梦后 也幻想过穿越到过去和东哥做朋友 并阻止某些事发生 好让东哥变成完美的人  ,4
孩子们没有想像的那么幼稚 他们的世界中满是色彩斑斓 满是多彩多姿 他们最恐惧的是鬼 是幽灵 是怪兽 是大人们看不到的多维的图纸  大人们也没有可见的那么睿智 他们的世界满是权利 金钱 美色和你死我活的争执 他们最害怕的是自己都看不清的人心 和真善美渐渐地丧失  孩子终将变成大人 但可以选择留守住那份纯真和看这个世界的清澈眼神  大人终不能回溯成孩子 但可以选择将那份纯真和清澈的眼神在孩子身上保存 ,5
1 用童真与梦幻来展现杀戮与残酷 杀戮与残酷显得更可怖 童真与梦幻也显得更可贵 2 他终于学会了为心爱的女孩系鞋带 就像他的母亲曾为心爱的男孩系鞋带一样 3 最后一幕太美好了  现在我们做什么呢  不如跳舞 ,4
这样浪漫化地处理法西斯不太好吧 而真正终结了二战的盟军几乎不可见 最后那战争的镜头是要把勇猛保卫德国的纳粹塑造成英雄了 当然最后有美国国旗 苏军呢 这是在资本主义内部试图让法西斯主义 合理 化 因为你看他们也是受害者 他们中也有好人 ,1
片头德语版披头士和片尾德语版大宝简直大型犯规现场 可除却望鞋认母那一场的精心设计 在伪儿童视角下被糖衣包装的苦难终究显得尴尬 ,3
小屁孩装大人的一副样子又欠揍又可爱 逗趣糖衣包裹的伤感内芯 不同于 美丽人生  这部更荒诞还略带奇幻 一肚的蝴蝶 母亲的皮鞋 不停的Heil Hitler Heil Hitler Heil Hitler Heil Hitler Heil Hitler Heil Hitler Heil Hitler Heil Hitler Heil Hitler Heil Hitler Heil Hitler Heil Hitler Heil Hitler Heil Hitler Heil Hitler Heil Hitler Heil Hitler Heil Hitler Heil Hitler  ,4
三星半 这个 小粉红觉醒 的思路比较奇特 以喜剧演绎 也可见导演对人性充满着乐观 从 生而有罪 这些传记来看 现实中要沉重得多 人也更难反思自己的经历 即便真的与犹太女孩成为朋友 多半也只是像当时的许多德国人那样认为 犹太人是魔鬼 但我认识的那个犹太人确实是好人  在这里 历史的沉重变成了电子游戏一般的冒险场景 而一切似乎都只是一个有着拿破仑情结的小男孩的幻觉 这不免轻巧了 当然 这个视角下的纳粹德国及希特勒 倒是颇有卓别林的遗风 以漫画手法将之解构了 ,4
找些讲英文的小孩来开这种玩笑 好笑吗 ,2
越往后越好看 因为在儿童的同时并没有拒绝成人世界 斯嘉丽约翰逊的戏写得很震撼 不仅给予了一人分饰父母这样的合理情节 而且还是一场颇有难度的传递本人情绪的家庭环境的戏中戏 但我并不是很喜欢小女孩 她在很长的一部分太像为犹太人代言而不是为自己的角色表演 这也是儿童视角的故事有时会陷入符号的过程 包括希特勒的运用其实也是把剧本变得更简单难度更低 而不是写出像 成为朱莉娅 那样的戏 ,4
JoJo跟小王子长得一摸一样 他的心里有朵玫瑰 叫妈妈 当看到妈妈的鞋挂在广场 小王子心碎了 妈妈死后 犹太小女孩成为他的另一个玫瑰 他怕失去她 所以说慌了 把她关在笼子里 连同他的良心 最后他还是带着她出了门 爱是自由 他把希特勒踢出窗户 他成长了 月升王国 美丽人生 ,4
2 5 Warm but cheap  儿童视角 的遮丑效用远远高于其他 今年奥提里的最差应该没跑了 ,2
用童话拍浩劫 既浪漫 又残忍 ,4
 澳门国际影展开幕片 先是用妙趣横生的喜剧 荒唐不经的戏谑与天马行空的幻想让观众放松警惕开怀大笑 进入到纳粹帝国儿童的天真臆想世界中 再猛然用残酷的转折将小男孩与观众拉回血与仇 生与死的战争地狱 催泪效果极佳 山姆 洛克威尔和寡姐的表演拿捏精准到位 再加上导演本人出马 代替父权的希特勒恶搞形象 这三个角色与小男孩凑在一起 既有 无耻混蛋 的荒诞黑色  美丽人生 的亲情温暖 也有对告密洗脑的讽刺揭露 对正义反战的深情歌颂 并非完美神作 但也是极佳的商业制作 四星半,5
这魔幻类型不亚于穿越回去跟毛爷爷谈恋爱,2
非常非常可爱 整个氛围色调让人想起了月升王国 我多给了一星 是因为我们需要这样的电影 加上最后还有里尔克的诗   在一个疯狂的世界里 需要清醒善良的人去保持最后的一点光亮 为那些陷入疯狂的人留下一丝回头的希望 尤其对我们对此时此刻而言   今年重读魔戒时对其中的一段话印象深刻  推动世界之轮的功绩 常常正是遵循着这样的进程 当伟人的目光投向别处 是那些微渺之手因为感到责无旁贷而采取行动    我相信善良质朴的力量 也相信蕴藏在普通人性中的微渺之力是推动世界之轮的真正力量 像是引领哈利寻找格兰芬多之剑在黑暗森林中穿越的牝鹿 是星光点点的组成守护神的力量   而我今年最大的进步正是 对给予自己微渺之力感到责无旁贷 ,5
披头士开头大宝结尾 我觉得OK 月升王国里的美丽人生 小男孩演的真好 我好喜欢和妈妈跳舞的那一小段 captainK和副官是给西皮吧 最后那仿若粉红救兵  对jojo最后的一点温柔看得我哭唧唧 ,4
害怕犹太人会伤害妈妈 于是在妈妈做饭洗澡的时候要拿着铁条在门外守着 假装内森写信给小姐姐说分手让她伤心了马上又写了一封哄哄她 危难当前 明明前段时间还那么恨的犹太人啊 还是会勇敢地对她说 Dont worry about JoJo 让她逃 天啊 明明是那么善良可爱的小孩子啊 求世界永远世界和平 不要再伤害这种纯真的心灵了 ,4
可爱 天真 奇趣 与残酷 黑暗 现实交织在一起 爱是什么 是胃里扑腾的蝴蝶 是跳跃的舞步 是最强大的力量  ,5
失望而归  没有 少年斯派维 玩得飞起 没有 希特勒回来了 批的尖锐 没有 穿条纹睡衣的男孩 温情 也没有 月升王国 美学统一 不是刻意对标 而是描了皮却没有骨 男孩真的可爱 但还是狠了心没有多给一星 ,3
能把一个题材这么苦大仇深的故事讲成这样 导演一定有一颗才华满溢的赤子之心  系鞋带那段心都碎了 jojo是个如此强大的孩子  ,4
幻想人物 儿童视角 荒诞现实 所有手法都不新鲜 体现出了好莱坞善于将一切艺术创新融入主流叙事的本色 质感做得过分鲜亮了 感觉是影城里拍出来的 所有对邪恶的展现都过于幼稚 这用 孩子眼中的世界 是解释不过去的 毕竟拍的不是儿童片 只有老妈死的那个场面稍微有点触动人心 不过说实话 斯嘉丽对这个角色而言有点过于漂亮了 ,3
用童话拍浩劫 既浪漫 又残忍 ,4
年度儿童片了,5
片头德语版披头士和片尾德语版大宝简直大型犯规现场 可除却望鞋认母那一场的精心设计 在伪儿童视角下被糖衣包装的苦难终究显得尴尬 ,3
笑着笑着就哭了 演jojo的小男孩太赞了 ,5
在伟大的元首眼中 温顺的兔子不是懦夫 在清澈的少女面前 冰冷的铁鹰更像囚徒 桀骜不驯的德国灵魂 高呼万岁 就算遍体鳞伤 也没丢了热忱 彷徨无助的犹太罪人 心怀光明 就算东躲西藏 依然保持童真 梦中的蝴蝶飞进老虎的眼睛 脚上的鞋带残留人性的余温 谣言与绞刑架背后的童话 又有谁相信 维迪提退步了 又或者说他变得更保守 儿童视角 反战题材 几乎就等同于主流电影中的免死金牌 稍微花点心思 分数就不会太低 但明眼人都看得出 不管是异想世界 还是乔乔与兔子 都是一个残缺的表达 异想世界只有元首 没有世界 兔子更是有头没尾 除了开篇仅存的一丝荒诞 后面完全脱节 节奏和情绪全散架了 用一个多小时的闭合空间来讲述跨国忘年恋 真的与反战主题对得上么 你真以为弄几张讽刺犹太人的画就是描写战争刻画爱了 成熟点行么 ,2
太难得了这个片子 最后一句话看的我躲在厕所里哭了好久  在网上凭着我零碎的记忆找到了这首诗叫 go to the limits of your longing 也许是最近真的非常的stress out毕竟要不是这样我那天也不会出来看电影 结果看见最后大屏幕上的Let everything happen to you beauty and terror  Just keep going no feeling is final我就开始哭的不行了 艹 ,5
披头士开头大宝结尾 我觉得OK 月升王国里的美丽人生 小男孩演的真好 我好喜欢和妈妈跳舞的那一小段 captainK和副官是给西皮吧 最后那仿若粉红救兵  对jojo最后的一点温柔看得我哭唧唧 ,4
失望而归  没有 少年斯派维 玩得飞起 没有 希特勒回来了 批的尖锐 没有 穿条纹睡衣的男孩 温情 也没有 月升王国 美学统一 不是刻意对标 而是描了皮却没有骨 男孩真的可爱 但还是狠了心没有多给一星 ,3
冲着这个新西兰导演去的 他的片子都很搞怪 再加上他还演了个那么好笑的希特勒 我承认 这确实是今年最容易哭的一部喜剧 悲喜交加 JOJO这个十岁孩子被迫接受着洗脑 但也困惑着 质疑着 经历着战争的残忍 如今纳粹正披上各种外衣准备借尸还魂 历史从来不会只敲一次门 这部片子不但告诉孩子怎么面对人性泯灭的残酷世界 更是让我们这些成人警惕 不要创造那样的黑暗世界给孩子 主角小帅哥演的太好了 演技自然流畅 还有他的好朋友小胖 丝毫没觉得他们在演 前途无量 小盆友 ,5
美式童话 让德国人民说起了英语 通过对人 怪兽 动物 强者 弱者 先进 落后 战争 家庭 希特勒 里尔克等一系列二项式的反向滑动 最终完成 到底谁特么救了谁 的逆转叙事 问题在于 在接通神圣罗马帝国的浪漫主义德意志种族建构 大屠杀幸存者的见证悖论 本雅明阿多诺阿伦特福柯阿甘本等人的纳粹论述面前 再融贯的轻浮也不是无辜的  2019IFFAM,2
 C  才华横溢 不如说是黔驴技穷 师承 美丽人生  反而对比出贝尼尼的尺度拿捏是如此得当 用孩子的视角去揭示战争 可它简直轻浮的难以置信 在这部 Jojo Rubbish 的衬托下  1917 的战争立场与意识形态竟是那般 正确 且 伟岸  ,2
害怕犹太人会伤害妈妈 于是在妈妈做饭洗澡的时候要拿着铁条在门外守着 假装内森写信给小姐姐说分手让她伤心了马上又写了一封哄哄她 危难当前 明明前段时间还那么恨的犹太人啊 还是会勇敢地对她说 Dont worry about JoJo 让她逃 天啊 明明是那么善良可爱的小孩子啊 求世界永远世界和平 不要再伤害这种纯真的心灵了 ,4
6 0分 电影本身除了提供一个还算新奇少见的视角外 并没有多少可咂摸之处 我的惊喜倒是在这个电影的文本之外 听到一群德国人操着一口流利的英语 看到的画面中的海报上写着的却全是德语 我忽然意识到 在电影的表意系统里 语言 声音 音效更被允许撒谎和扭曲 它仿佛天生就被默许可以具有更强的主观性 影像的视觉性元素却还必须保持住某种经得起感性审视的的真实与客观 电影就这样在主观与客观的双重世界中交叉穿行 难分你我 ,3
塔伊加 维迪提选择的二战叙述角度极富勇气 当表达主体为纳粹浸淫下的德意志少年 战争的成败与事物的对错都渐渐变得模糊 只有人性的本质才是切实的 与母亲 与懵懂 与爱情 与执迷 与贪生 与勇气 在迈克尔 吉亚奇诺的曲作间游弋 罗曼 格里芬 戴维斯 托马辛 麦肯齐两位少年尤为出色 ,5
能这么酒吧化处理 或者说cosplay 这段历史 让人不由得惊叹 这届美国人似乎除了爱 什么都不理解 既不理解二战 也不理解纳粹 更不懂德国人  水平和同类题材隔着十部 美国队长 的距离 拿出多少孩子的眼泪给我看 我也不能接受这个 童话  你敢告诉他们那面旗其实不是美国而是苏联吗 三颗星给斯嘉丽 ,3
想象力和幽默感都蛮一般的 远没有 吸血鬼生活 那么灵气爆棚 但鞋子用得好 第一次特写是美好 第二次是残忍 ,3
在乔乔母亲死后 我以为电影终于要落地现实 没想到还是把戏谑的风格的延续到了最后 轻佻地表现战争与死亡 这样的儿戏处理 让乔乔与其它成长题材影片中的少年无异 特殊的战争环境沦为一具空壳 没有带给他更深刻的人生体悟 纳粹思想只作为坏思想的笼统代名词出现 没有体现出这一思想的独特性 而且这样表现战争的方式和态度 我也表示怀疑,3
能把一个题材这么苦大仇深的故事讲成这样 导演一定有一颗才华满溢的赤子之心  系鞋带那段心都碎了 jojo是个如此强大的孩子  ,4
很多人还没有把希特勒踹出窗外呢 ,4
真 善 美 太好看了 纯真 善良 坚强 勇敢 幽默 乐观 几乎可以把所有形容人性美好的词汇都献给这部电影 刚看完迫不及待想看第二遍 太多画面值得截图保存 服装 家具 建筑 街道都值得细细品味 好想钻进电影里去拍胶片  ,5
小胖子好可爱 想捏捏他的肚子,5
跳舞的人是自由的 那座桥曾经遍布舞动的情侣 那个国度本该是花与阳光的天地 那些小孩 没有纳粹或粉红种种扭曲狭隘的概念 他们该去爬树 然后在不经意间摔下来 藏起一个充满童真的过往 事到如今 在似曾相识的残酷世间挖一口冰淇淋 觉得勺子都是利器 而那些绚丽的色彩和烂漫的爱成了圣体 看到那双红白皮鞋垂下 心无可挽回地痛 而稚气的人 该当长出志气了 四星半 ,5
我腹黑地想  乔乔用谎言从此霸占媳妇了  这次的寡姐 演的才是最让人想拥有的女主角 全程发光,4
这剧本糊弄人呢 说过誉都是抬举,2
肚子里的蝴蝶 里尔克的诗句 爱的力量 一起跳舞 感谢漫威放过斯嘉丽 让她又能重新做自己 ,4
用戏谑希特勒做噱头 但在战争伦理上毫无新意 甚至只是把战时德国做布景搭建一个coming of age的故事 前半部分花了很大力气实验这种快节奏的舞台剧式的夸张而疏离的美学 有些地方做的也的确很幽默 但是后面为了让观众有所共情又不得不回到正常手法 以至于整个观影过程很分裂 用这样沉重的题材来实验这样一种现代消费主义时代产出的美学 有点Fleabag自说自话的感觉  我觉得不太合适 另外 同样是讲政治 这部片和隔壁的Joker 寄生虫比一比 时代精神在哪里 ,2
三星  开头1 3特别好 带着Screwball comedy的气息 疯疯癫癫的反讽 犹太女孩出现后的故事显得甜腻而简单化 或受儿童视角所限  小胖子很可爱 音乐的使用 误用 也有意思 ,3
这个视角很棒 让我想到自己上小学时 也曾无条件地相信当时的宣传教育 而长大之后就醒了 ,5
小粉红的逆袭 ,5
三星半 原著自带的暗黑讽刺风 加上导演偶有的灵光乍现 再加上一组颇具看点的群戏表演 整体的娱乐性还是很高 ,4
What a cute  humorous  heartwarming but also sorrowful WWII film  令人惊喜的角度来探讨那一段历史中的一面 也是对propaganda 的另一种理解 在残酷与恐惧的背后 依然不要忘记舞蹈 ,4
we can be heroes  just for one day,4
喜歡taika呀 因為BOY認識他 後來居然拍雷神啦 又酷又可愛的人  ,4
不是强有力的BP 但是优秀的儿童影片 你敢直视老虎的眼睛吗 你敢将肚子装满蝴蝶吗 Scarlett的确值得提名女配 想看导演拍吸血鬼生活之儿童吸血鬼 从来没想到元首演讲和披头士这么配 ,4
这前半段的风格像极了韦斯 安德森 甚至一度感觉导演就是韦斯 后半段就越发的残忍 用小孩的角度去看战争 反而更加纯粹 残酷的童年和成长史 没有刻意的煽情 很多东西点到为止 加上全片都用喜剧来包裹 不仅没有淡化它的悲伤 反而加重了战争的荒唐 把电影的主题表现得更清晰 讽刺的同时又流露出最自然的感动 山姆 洛克威尔一如既往的抢戏 ,4
 意志的胜利 今年有点过于被滥用啊 ,3
戏谑的态度是从始至终的 在一种扭曲的价值观里展开叙事 当然 都知道是反讽的手法 但还是很难适应前两幕的语调 孩子互助的模式也在很多二战片里见过 并无新奇之处 只是赚些感情分 不断回想起韦斯 安德森的灵动 然而寡姐的可爱角色会是一个入口 第三幕的鞋子有如一把钥匙 直接打开泪腺 切入最残酷也最现实的图景 童话的气泡被戳破 自此 整部电影终于向 美丽人生 疾速挺进 在里尔克的诗里 换来一个欣慰的笑容 ,4
一直以为是个特别恶搞的纯喜剧 老阿姨我被打得措手不及 这几年见到乱世中善良的人和披着狼皮的羊 都很好哭 当然这个不能和狮子王比 但我一瞬间想到辛巴失去木法沙的场景 还不会系鞋带的jojo扒拉着妈妈的鞋 老阿姨心都碎了 后面还有独眼gay教官turns out心地善良 心碎X2 片尾Heroes听完 走回现实世界见到满街的真Nazi 还有什么好说 再听一百遍heroes吧,4
最好笑的片段 是Jojo Rabbit激昂地冲过来夺走手榴弹 却投掷失败 把自己炸飞的强烈对比  最紧张的时刻 是贝茨勒和手持证件的军官对答后 特务头子说等等的时刻 那一刻我屏住了呼吸  最可怕的台词 你已经十岁了 乔乔 别再像个小孩子似的  最痛心的一幕 当然是乔乔站起转过身看到了熟悉的红白女式鞋子的一幕了 我以为 属于自己的死亡不可怕 可怕的是你转身看到你深爱的人已死去  最喜欢的一个角色 小胖子 真是一个天真 乐观 不盲目崇拜的孩子 似乎所有的苦难都打不败他 面对迷雾般的未来 他需要的仅仅是好友的一个拥抱 ,5
Sam Rockwell出现的那几场戏 都是全场的高光啊 寡姐演得也真好 出现鞋子的那幕心都碎了 ,4
我是导演的粉丝 他演希特勒玩得很疯 但不成功 只要还在弱智化纳粹 还在以 他们就是错的 的态度去刻画 我们就永远难以根除我们心灵里的法西斯主义 ,3
武汉的SARS还在扩散 现在不是拿命去看电影的时候 韦斯 安德森拍的是几何幽默 这个导演拍的是童趣 能去电影院的一定去电影院看 ,4
前面实在太无聊了 盖世太保搜家之后才稍微好点 但是结尾又太无聊了,3
I was expecting something properly controversial here with all that fuss  instead I saw the safest  perhaps most unoriginal way of making fun of the Nazis  Scarlett Johansson s character  with a perception that s clearly modern and new  is completely out of place  The entire Nazi environment depicted in the film was made up purely of the writer s tabloid  superficial  mis understandings of Nazism  Filled with hackneyed symbolism and plain kitsch  there s absolutely nothing bold or adventurous in this film  the only  good  nazi has to be a gay  how surprising   Anyone who says this film works against political correctness doesn t know the first thing about contemporary politics ,2
本片的类型比较多元 可以归类为儿童荒诞战争喜剧 论剧情完全是现实题材之上的奇幻故事 充满夸张的元素及设定 全片开头是披头士的歌曲 结尾是大宝hero的德语版歌曲 首尾呼应 跳脱开二战的背景 融入当代韵味 开头的推进比较缓慢 后面渐入佳境 视觉 服装设计美 具有看点 小男孩是我近些年看过的电影里最漂亮的 他的表演也是可圈可点 不过整体的故事叙事比较弱 透过小男孩的视野才显得丰富饱满 本片不是儿童片 适合至少青春期以上的孩子观看 残酷战争的奇幻版 ,4
最大的问题是喜剧部分没处理好 笑点普遍比较尴尬 片头算是亮点 Beatles德语版I Wanna Hold Your Hand配合希特勒新闻素材剪辑 挑明了集权国家只能存在一位顶级偶像的铁律 ,2
孩子眼中的艰难时世总是格外动人的 二战阴影下的柏林 纯真与邪恶 柔情与残酷交织在一起 用喜剧的方式表现出来 好笑又好哭 最喜欢的角色是小基友 出场不多但太可爱了 ,4
非常非常棒 英语再好一点就能听懂更多笑点了   旁边的大哥一会儿笑一会儿哭   ,5
我们乔家世世代代都是绅士 打中的点挺对的 如何避免成为法西斯 打开自己的知觉 不切断自己对于疼痛的感知 在认识到具体的人的同时也意识到普遍的人 但这种对普遍性的知觉很大程度上却反而要靠这样的具体来打开 儿童视角只是个幌子 重要的是儿童身上那种 尚未枯萎的灵魂  ,4
从少年纳粹的角度来讲二战 幻想中的朋友是希特勒 因被困在墙中的犹太女孩而开始反思 叙事角度太棒了 剧作非常扎实且流畅 第一次看到绞刑架时 妈妈扭过乔乔的头让他直面 妈妈扮做爸爸与乔乔的相处 妈妈的鞋出现在绞刑架上后屋顶的眼睛 还有配乐都太让人印象深刻了 ,4
You drink champagne if you re happy  Champagne if you re sad  You drive a car  You gamble if you want  Own diamonds  Learn how to fire a gun  You travel to Morocco  Take up lovers  and make them suffer  You look a tiger in the eye  And trust without fear  That s what it is to be a woman ,5
配合 第三帝国的语言 服用更加,4
纳粹赢了战争 德国男孩就能和心爱的犹太女孩跳舞了 这是 铁托与我 和 月升王国 之后看到的最好儿童片了 ,5
挺可爱的 仅此而已 思路挺新 但是执行太教条了 ,3
低龄视角 成人思维 大体会导致小孩看不懂 大人不喜欢的结果 拧巴中的荒诞有设计也有顺拐 天真烂漫的人脑子里怎么会有纳粹呢 幻想希特勒的少年大概是踹断父亲三根肋骨 亲自勒死人民的纳粹们吧 ,3
整个电影都好可爱 小男孩的小卷毛小制服好可爱 小胖基友好可爱 寡姐好可爱 Rockwell和Theon这对 也可爱 还有怕是影史最可爱的希特勒了 要加入我最喜欢的二战题材电影清单 heartwarming heartbreaking房子的眼睛和最后跳舞 We need in love to practice only this letting each other go ,5
五彩奔腾希特勒 丢雷错误示范 里尔克泡妞宝典 舞鞋与视线平齐  较 美丽人生 更低幼些的战争童话 不妨碍好看,5
用童话包裹童心 以喜剧揭开悲剧 独特的反差叙事 以小孩的视角审视二战的残酷 解构德国法西斯的行径 带着孩子的纯真 赋予故事的多面性 影片前半段色彩斑斓 光影明媚 好似 月升王国 的安德森附体 荒诞滑稽 轻快俏皮 后半段撕下糖衣包装 展现真实的世界 成年人褪去童真后 却满眼都是残酷和悲伤 乔乔异想的 希特勒  斯嘉丽饰演的乔妈 暗格里生存的犹太女孩  都是奇幻世界到美好向往的点睛人物 同时也是撕开真实的转泪点 电影对人性的刻画和对偏见的讽刺深刻又轻盈 举重若轻 温暖悲伤 悲惨底色隐藏在欢乐与戏谑里 在大笑之余又不得不暗自伤神 好在在和平到来的第一天 他们得以自由舞蹈 正义在黎明前终将胜利     ,4
这个5星由各个半星组成 故事 编剧 妆饰 表演 配乐 插曲等等  而当最后一幕 大宝爷的Heros 前奏响起的时候 瞬间泪目 满星补齐  let s dance  war is over   u r my hero     ,5
