comments,star
全片像是神游即兴发挥状态拍出来的 贬义  没一个明显的重点内核 节奏较遭 太拖沓 从头到尾找不到共鸣和代入点 不深刻属于意料之中也说不上扣分项 可甚至都不够幽默不好笑 ,2
 Let everything happen to you  Beauty and terror  Just keep going  No feeling is final     Rainer Maria Rilke 有笑有淚的好電影 ,5
太难看了 即便框架宏大 这样强挠人胳肢窝的喜剧还是少拍为妙,1
可能是我太苛刻了 但是我真的觉得美国人拍二战片比起德国人拍的二战片 复杂度和深度都差太远了 最多算是个成功的温情family weekend电影吧 加半颗星给小男孩惊为天人的演技 再加半颗星给片尾那段话 Let everything happen to you  Beauty and Terror  Just keep going  No feeling is final  鉴于我最近的情况 真的被感动到了 ,4
Yorki是树懒吗 超可爱的 我可以 ,4
能回來在大銀幕看好戲總是珍貴的 ,4
这种快餐电影拿最佳改编剧本 ,3
大问题 1 既然母亲从事地下活动反对纳粹 以身作则 有原则有人性的母亲怎么会不正面对待自己的孩子 而且艾尔莎也已经提出了这个问题 乔乔会举报艾尔莎我觉得只是影片必须考虑自洽的借口 毕竟父亲已经去 参战 了 之后那么多时间难道不值得正面教导孩子关于纳粹的问题吗 2 结尾乔乔回到家中 艾尔莎问乔乔安全与否战胜与否 乔乔给予了谎言来应对 之后又顺水推舟借口协助艾尔莎逃走 直到走出大门艾尔莎回头来扇耳光 乔乔都没有告知真相 此处存在的疑问十分恼人 其一 可以理解上尉的死是一种铺垫的心理刺激 因此导致谎言 那乔乔内心还是认同纳粹啊 其二 他没有办法面对已经构建的世界轰然坍塌 只能选择以谎言 即便最后不堪一击被扇耳光 来抵御 PS 我很害怕乔乔借谎言让艾尔莎再也无法离开 或许这才神了 ,2
自由的人才跳舞 ,4
还是歪提提熟悉的怪异风 小孩子演得太好了 就问迪士尼敢不敢在国内上这个片 ,5
立意挺好 以儿童视点去呈现被洗脑的德国环境 但在执行上有很多力有不逮之处 最突出的是调性 前面的反讽挺刻意的 残酷与可爱融合得有些草率 小男孩试图软禁这种行为不是不行 但有这种转变 铺垫还是不够 最美妙的戏 都在寡姐身上 就像蝴蝶与鞋 这样的浪漫化处理才是高级的 但愿 每个小 粉 红都能有这样一位坚韧性感的引领者 ,3
塔导不论作为一位导演还是一名演员 这才华脑洞与诚意和童心都是宝藏级的啊 ,5
with 小亮和晓渔 感觉非常平庸虽然我全程傻笑 并且感觉他们俩分分钟要睡着 ,3
全程在感慨拍得好美 墨绿配金黄太好看了 角度很新颖 剧本好 但也因此削弱了很多残酷的部分 ,4
 No feeling is final    有一个视角我好难过啊 elsa说we were chosen by god的时候我哭瞎了 犹太人真的太惨了  各种意义上,5
这应该是暑期档之后 公映的第一部高制作水平的非类型剧情片 可对比导演前作 追捕野蛮人  2016  依旧是略边缘人物的成长故事 就像可以定义野蛮人是没有公路的公路片一样 本质上这是一部没有偶像的偶像电影 我们在看 昨日奇迹 中Beatles歌曲的穿越 是用偶像的意义定义人生或生活态度 这部中极端的希特勒崇拜到熟悉的钢琴师 拉贝日记式的桥段 Jojo初始成长童趣是他的伙伴希特勒 伴随战争带来的是偶像世界的崩塌和人的价值观重建 观众用已有的认知理解对纳粹的讽刺  偶像 的缺失手法实是一种反类型的价值观认同 ,4
颁奖季最大惊喜 昨天刚去大银幕重温美丽人生 今天正好又看了乔乔兔 也是一种缘分 两部电影的是有共通之处的 都是举重若轻 伟大喜剧的内核永远是悲剧 维迪提很棒 前半部有韦斯安德森的感觉 ,4
太棒了   哭得稀里哗啦 天才小演员 超棒斯嘉丽 所有小朋友都很可爱 ,5
扯一个不相关的 能跟我妈一起去电影院看这一部 我觉得很幸福,4
喜欢即使身处在黑暗的环境 总有人能看到光明和希望 也在用自己的实际行动去实现自由 这才是直击心灵的好电影 ,5
小朋友懵懵懂懂 记忆都是看不到前因后果的片段   ,5
看到最后真的泪目了 浅口鞋和藏青裙的主人悬在被硝烟染透的街道上 她不知道男孩和女孩会相对起舞 而那些青年团员与盛装军官一同冲锋时 身披的是位处两极的荒谬 至少最后还有希望 乔乔让艾莎得以生存 艾莎则教会了乔乔生活 断瓦间 一个人终于挣脱藩篱束缚 一个人从此再无心锁 ,5
2020025 一星平庸 导演的逗比行为套在这种历史题材里就显得很幼稚了 希望导演以后多去探索类型片的边界 少拿真善美价值观来感动人 ,1
和现在又有什么区别 只是少了这么伟大的母亲 ,4
猶太小姊姊跟喬都是小兔子 在戰爭中活了下來 希特勒是喬最初的世界觀 兔子喬經歷過磨練覺醒了 最後猶太小姊姊出門前問外面危險嗎 喬的回答跟媽媽回答的一樣 小男子漢終於成長了 ,4
真的有够可爱的 像极了隔壁月升王国 全程姨母笑 但说句实在话笑点有点些许刻意 本片好就好在定位清晰 完全没浪费戏谑元素  轻浮 的同时又不失 稳重  许是颁奖季可以拿些奖 提一句Scarlett和小胖子是本片加分项 ,4
一切都恰到好处 不多不少 抱住妈妈的双脚又想要帮她把鞋带系好那里心碎了 Yorki承载了好多笑点 and 我真的很想让现在的斯佳丽做我妈 我是说真的 因为感受到的无比的温柔 给五星满分 ,5
要是全中国的小粉红都像主角这么良善无辜就好了,3
片中  片尾完全对不起片头 ,3
POV关乎一切,5
三星半 对极端民族主义的洗脑出之以儿童的视角 淡化了历史的厚重和悲剧感 对我们也有很多可以借镜之处 以前看 安妮日记 的时候 觉得就这样和喜欢的人躲起来读书写字也不错 现实生活常常令我感到无趣 好像只有封闭起来 沉浸在一些事情上才能真正自如 斯嘉丽 约翰逊的那个角色 背负着那么多还能跳舞游戏 殊为不易 其实 很多事情只要不是我们的错 就不必自责 过好自己的生活也是一种反抗 ,4
2 5 剧作构思从根本上就有问题 虽然沿袭了 美丽人生 的战争童话的思路 但并未意识到  美 对战争的美化处理本身就是植根在 谎言 这一母题基础之上的 也就是说 观众很容易看破这一层糖衣 注视到其中的伤痕 从而起到更大的情感冲击 而本片则完全断章取义 直接把战争片拍成了儿戏 最后还要画风突变 字面意思上的 连色调都变了 地残酷一把 突兀得令人尴尬 更别提剧情安排也奇怪得叫人绝望 拍了两场母亲和犹太姑娘的深夜对话戏是什么鬼 幻想希特勒这种关键设定空成赘余 仅做搞笑用途 模仿 美 的线索呼应铺垫用得很肤浅 人为痕迹严重 漫画式视听风格只为遮掩贫瘠的调度功力 临近结尾的战争戏便可见一斑 虽然也不至于很难看 但奥斯卡提名还是省省吧 我倒是想看续集 这角色设置 正太开大车  也太可爱 保证火花十足 ,2
又想起了 穿条纹睡衣的男孩  只不过这部是以喜剧的外壳隐藏了一个悲哀的灵魂  小男主给死去的妈妈栓鞋带 captain K救下小男孩的那刻被触动到泪点 有人指点说K这个角色身上有G的元素 于是又倒回到59分钟那场戏 好像是有那么一点点哈    我的基达好迟钝55,4
年度优秀作品 几乎可以算是儿童视角版 无耻混蛋  小胖纸Yorki全场最佳 ,4
意识形态是让他人相信自己是美好的 而真正美好的东西向来是充盈而澎湃的 心中有爱 那些荒唐的东西自然被挤走了 ,4
国内可以翻拍一部文ge时期的红小将眼中的异想世界,3
粉红们看到这种东西的时候真的不会发觉自己是五十步笑百步么 真的,5
如果有一天你自由了 最想做的事情是什么  跳舞 自由之舞真是太美了 好喜欢这部2020年看的第一部电影 ,4
对小朋友就很难connect,3
时隔半年终于又进电影院了 上次看还是朱维尔的哀歌 也是Sam Rockwell主演 我好喜欢他啊 简直是Gary Oldman的代餐   开头很像月升王国 但越往后看越多层次 是真的融残酷于喜感中 Waititi一如既往地在没溜儿中煽情 大半年第一场大银幕 哭的酣畅淋漓 搞纳粹不如跳舞 谈政治不如跳舞 在全球民粹主义一起抬头的当下 重看反思二战主题的作品 比以前任何时候看都更有切身之感 ,4
 It s definitely not a good time to be a Nazi   对我来说片子本身并不新鲜 是可以做得更好的 额外一星是因为油管上有人说Jojo和他的胖墩朋友就像缩小版的Simon Pegg和Nick Frost 采用摇滚乐配乐太聪明了 德语版的I Want To Hold Your Hand和Heroe 还有个那首Everybody s Gotta Live 正式预告里还用到了Believer,5
棒,5
真善美值得讲 ,4
相比导演前作 轻浮无趣的雷神3和吸血鬼生活 这一部不仅有趣 还增加了些许厚重感 镜头快速伶俐 视听效果也比前作好了太多 各方面相对平衡 这才是优秀喜剧片该有的样子 ,5
Love every bit of it  Sam Rockwell每次出场都让我身体里蝴蝶飞舞 ,5
 论一个被希特勒极端主义洗脑的小纳粹童子兵如何成长为一名保护犹太少女有担当的小男子汉   有点 月升王国 的味道 导演本人在里面饰演了希特勒,4
Görlitz 既视感太强烈 反而查了一下是布拉格  哈哈哈 有意思的地方可爱之处也明白 开篇 Beatles 结尾 Rilke   Bowie 也算是心头一笑  p s  大师的摄影是真没感觉到,3
 这个男孩比其他人更优秀 更勇敢 感谢上帝你被他照顾  真的很喜欢这种有点儿超现实主义手法的作品 ,5
二战电影还能拍成这样还是很惊喜的 温情和黑色幽默 以及现实的残酷都很好地融合在一起了 很好看的电影 只是无力面对的是 一个jojo虽醒着活着 却有千万个jojo已经化为齑粉   而今天的叙利亚 非洲 不依然还有无数人 正在和即将这样无谓地死去 ,4
太可爱了 童真与悲伤结合的那么好 其实每个人都很善良啊 战争才是最无奈的事情 真心希望它能拿下奥斯卡 开头披头士我就笑了 结尾德语版版hero更是好哈哈 ,4
一个人的认知 决定他所看到的世界 认知的一次次颠覆 以及颠覆后的合理化 是人为成长所付出的代价 童话便是削弱残酷的一种防御机制 我有时候觉得 能够一直活在一个世界的人 是可怜的 但亦是幸运的 ,3
乍看是讽刺纳粹 再想是因为它发起的这场战争在celebrate will power的同时恰恰利用并毁灭了这种冲动 让会在出征时装点羽毛吹响号角 captain k  会酒醉起舞和猛虎对视 rosie  会讲远古神话的百兽平白死去 只留下靠精明存活的兔子 小小乔最后从房子地下的窟里钻出 而现在的我们都是兔子的后代 在没有野兽的草地上忙着吃草 ,5
过于戏谑了 不喜欢把这种沉重话题萌化和简单化的处理 这跟网友给火神山雷神山拖拉机起小名的感觉差不多 令人不适 ,3
3 5 孩童视角是一个十分讨巧的视点 整个电影几乎用超越现实的 异想 来实现整个电影时空 幻想的希特勒 夸张的喜剧表演 奴化教育的再现 全英文对白 以及整个电影轻松俏皮的基调 皆是对于天真儿童的谄媚式模仿 孩童的觉醒与说教意味还是一如既往的简单直白 平铺直叙的剧情让位于异想出的战争世界 以至于最大的矛盾到最后三十分钟才出现 并且轻易地被真实历史同步带过 当然 本片最奏效的还是少年乔乔 角色和表演都是极好的 ,3
导演太有才 导演演的假的希特勒真是又逗比又可爱 整个片子太暖了 这才是残酷世界里的善良 你才不是纳粹 你是个十岁的小男孩 顶住压力也要把兔子放生 遇见了喜欢的女孩子愿意把那个脑海里一直崇拜着的那个希特勒踢出窗口的勇敢的小可爱 斯佳丽太牛了 这个妈妈的角色我太喜欢了 寡姐姐每次一把抱过jojo的时候我的肚子里也全是蝴蝶 ps 戴眼镜的小胖子肉肉的我想捏捏 还有那个德国来搜屋子的长官是生活大爆炸里amy的相亲对象呢   ,5
三星半 从儿童的角度去看待二战 故事轻巧有趣 导演饰演的希特勒是亮点 每次出现都妙趣横生 影片问题也是过于清浅 厚重的底色和主题被掩盖和消解  尽管导演本来就想用消解的态度处理 对比之下 就会觉得 潘神的迷宫 对儿童视角与真实历史的残酷处理得更出色 此外 没有使用德语也是败笔 让影片好莱坞味道十足 不过 看到片中少年真诚信仰的失落 仍然感慨万千 ,3
很想知道 那些饭圈孩子们看到乔乔妈被吊在那里时 会不会还说活该,4
影院的其他观众都当那段历史是个玩笑的滑稽剧 我一直在等某种内核的呈现 然而我没等到 ,3
最有趣的点是片头恶搞beatles的mv 最感人的是片尾bowie的heroes配上二人起舞 中间只能说是乏善可陈,3
不给十分给多少呢 ,5
小小鲜肉的演技太牛了,4
I want to hold your hand和Heroes都有德文版的哈哈哈 配乐超神 罗曼真的可爱呀 就怕长大了会变油腻 ,4
Thomasin McKenzie is Elle Fanning with talent,3
比 美丽人生 当然是好的 它努力描绘了不知而不愠的小粉红如何被反洗脑的过程 而 异想 的说服力远大于 美 前半段儿子出世前的傻逼格调 不过 少年的爱情能在东西分治的冷酷柏林幸存吗 里尔克是对整个世纪的呐喊 万字旗倒下了 柏林墙升起了 Look at us now ,2
 6 8 一小时之后开始变得好看起来 用儿童的眼光讲述的反战片 到了后面的残酷才会理解前面的铺垫是那么地顺理成章 在这湛蓝的天空下 究竟有多少人是靠着谎言存活下去的 不是很满意的是升华的部分还是拍的太腻了 如果爱能解决问题的话 为什么我们的世界并不是一篇善始善终的童话 ps  中间那段孩子看着被实施绞刑的尸体那实在太棒了 ,3
"8月的第一天才坐在电影院看2020第一部院线电影 本来想说 是第一部也是最后一部 看完以后改主意了 如果还能有这么好的电影 我还来 时代需要这样的片子 以一个好笑的方式讲一个有意思的故事 同时丝毫不做作地自然带出感情 触碰历史和人性 把喜剧和正剧融合得这么好 其实早在1月在gh家的时候我俩就想看这个来着 打开百度云看了开头 画面实在是糊得没眼看 就关掉了 好庆幸当时没有在iPad上面完成观影 经常思考的是 对大众来说 大荧幕何以不可替代 对于好片子 大荧幕真的才是它们最好的归宿 真的只有在那个黑洞洞的空间里 面对满屏的另一个世界 情感才有办法完全挥发出来 电影真好 电影院真好 炮弹横飞的时候 我觉得这个世界实在是太荒谬了 人和人明明就是一样的 人类非说不一样 还动不动就动手 ",5
谁还不是个小纳粹,4
9 0 10 分 初看 蓝光 导演是 吸血鬼生活  追捕野蛮人 的导演 他的片子很清新有趣 喜剧效果不落俗套   ,5
看到後1 4部分的時候我開始聯想到 此一時彼一時  最後結尾那段話譯成中文剛好也有一部分是 此一時彼一時  這部電影也做到了那段話所說的 你永遠不知結局  雖然所有人都知道那段歷史的結局 我對片花做得好的標準重點放在不要對正片失望上了 差不多滿座 片尾字幕也基本都等著看完 出場時還聽到德國口音觀眾好的討論  雖然依然有不知為何有人笑和鼓掌的悲劇橋段 算了 對觀眾不應有要求 ,5
晴天霹雳 绝处逢生 笑中带泪 依偎取暖 本片完全没必要讨论纳粹思想的来由 能把 怎么没的 这个话题谈透五成就万分成功了 ,5
开始以为这是一部 月升王国  后来才发现这是又一部 美丽人生  剧情上前喜后悲再到重获新生的结构完全复刻 美丽人生  色彩光线的运用上由鲜明高亮到冷色低调的转变也像极了美丽人生 前半段生意盎然的画面搭配戏谑式的法西斯口号 尽显法西斯战争的可笑 乔乔兔 艾尔莎 罗西 队长 幻想希特勒      各个角色都太有趣 不过片中最有温度的角色还是克洛威尔饰演的队长 那个既有着军人的骄傲 又有着人性温暖的纳粹士兵 8 5 10,4
像是月升王国版的美丽人生 斯佳丽约翰逊和山姆洛克威尔太出彩了 居然最后听到了德语版的heroes 自由的人才跳舞 ,4
其实Jojo的疤痕装一亮相的时候 就应该隐约想到鲍爷 虽然实际上也是在最后 Heros 的前奏起时才恍然大悟 所以当然也可以以此概括整个电影虚实转换间不经意的伶俐与用意 而且电影选择结束的地方太美好了 因为谁都知道美苏攻占柏林后的柏林 才是真正的地狱 ,3
4 5 5 不完美 但是好喜歡片中所帶給觀眾的正能量 嚴肅的納粹題材 上周才看帝國毀滅 這周看塔導用喜劇包裝 整部片滿滿塔導風格 很不正經卻又言之有物 風格很陽光卻又適時的把觀眾拉回殘酷的現實 老婆 洛克威爾的戲份不多 但是角色卻非常暖心 老婆不論是騎腳踏車 喝葡萄酒 跳舞 幫兒子綁鞋帶 等動作 每一幕都美到令人窒息 該角色也是老婆近10年來演過最有喜感且最暖心的 洛克威爾的篇幅如果在更多一點 我對這角色的好感度鐵定不輸我老婆 塔伊加維迪提有望靠這部迎來首座奧斯卡提名 兔嘲男孩不完美 但它是這個世代所需要的反思電影 透過小孩納粹的視角 刻畫戰爭的殘酷與醜陋 塔導在喜劇與悲劇之間的切換精準不已 鐵定受 美麗人生 影響很深啊 ,4
冒犯有些时候并不意味着先锋或挑战 比如在Waititi手中更多地代表着肤浅廉价与美式傲慢 导演的所有设定都非常功利 披着童真的外衣小打小闹 对所有历史敏感点都不敢真正触碰 就这么个片子里面说纳粹军官是个充满人性的同性恋有什么意义 拿希特勒开那么多玩笑有什么表达吗 又要拿这段历史做背景 又要狡猾地单纯善恶二元论 生活在童话中的不幸男孩简直太幸运了 导演已经被我拉黑了 ,1
儿童视角 喜剧风格呈现二战 纳粹历史 无趣 不出彩 ,3
复古 可爱 温情,5
要被片尾曲笑死了 导演自己人,4
Let everything happen to you Beauty and terror Just keep going No feeling is final                                    Rainer Maria Rilke  ,4
现在也不是当TG的好时候,5
孩童视角调侃式反战主题 被纳粹洗脑的小主角在遭遇中逐渐剔除狂热外壳认清正邪并存的真实世界 躲过残酷战争的不过是无辜的民众与单纯的孩子们 配色清新好看 但也就止步于这种纯带立意的清新感了 ,3
轻松愉快的节奏讲述一个珍重痛心的故事,4
Jojo看到了蝴蝶 看到了妈妈的鞋 也开始懂得爱与痛苦 战争不止一面 不是英雄和热血 而是残忍和痛楚  可能我这颗童心只适合看这样的战争片  斯嘉丽真美 但越看越像我妈是怎么回事 ,5
成长在一个全社会都陷入疯狂的国家就很难意识到这个国家有什么问题 但人都会长大 会有把元首踢出窗外的那天 ,5
我真的好喜欢儿童片 荒诞又可爱 小孩子的古灵精怪奇思妙想在二战背景下显得格外天马行空 台词写得真妙 希德勒每次出场都是亮点 OST真的是心水 各种经典摇滚乐 好喜欢乔乔的第二好朋友小胖子哦,4
我太喜欢这部电影了 从小男孩的视角看德国二战 有滑稽搞笑也有成人之痛 几处感情戏都超级恰到好处 小男孩圆溜溜很可爱 本片开始get到斯嘉丽的颜值 里面的复古穿搭非常美 本片暂时预定我心中的年度最佳 ,5
二战小品和初中爱情 可能是金屋藏犹娇最不陈腐滥情的表达方式了 一直画面光鲜对白无厘导演乱入加上啾啾可爱的小脸 寡姐红舞鞋的戏剧力度恰到好处 措手不及又不过分政正 就是你帝国旗有点招摇,4
狂热的血性的战争 虽然看似轻松 但却十分沉重 当少年们的脑子被狂热残忍的事情占据的时候还有什么比这个更恐怖的呢 虽然和同样用相对轻松的方式表达战争的 美丽人生 差一个档 但整体也很不错 JoJo演技很好 唯一的泪点就是长官拔下JoJo的衣服推开他的瞬间,4
2 13 so 美式,3
我心目中今年BP的最佳选项了 边看心中边暗喊NB   ,5
我要哭死了 肚子里的蝴蝶 妈妈的鞋带  等你自由后 你想做的第一件事是什么   跳舞   我们何时才能跳舞  ,5
空中的红鞋讓人难忘  四眼搞笑伙伴没事真太好  ,4
萌到心颤 笑出眼泪 哭成傻逼 又和着鼻涕眼泪笑出来 能让人在短短两个小时里体会到这么多情感 就是一部电影能达到的最高成就 ,5
塔导太牛逼了   斯小姐那段假装孩子他爸的那段太温馨了 又可爱又扎心   类似韦斯安德森但立意高太多了   ,4
类似铁皮鼓的作品 目的是     意义是       疫情当下 乐呵乐呵算了,4
风格很棒 可惜前后诡异的分裂感太重 寡姐真美,3
失望 这题材跟这拍法很不搭啊,2
愿你遇见的每一件事 不论好事坏事 不要放弃 没有什么是一成不变的 ,4
强推,5
耳濡目染下的第三帝国小卫士的成长故事 与前辈的 铁皮鼓 一样 都是通过孩子的视角 用一种魔幻现实主义的手法反思二战  铁皮鼓 的设置是孩子不想长大 于是变成了侏儒  乔乔兔 则是幻想希特勒就在身边  乔乔兔 是根据新西兰作家克里斯蒂 鲁嫩斯的小说 笼中的天空 而改编的作品 妈妈给予了乔乔爱和自由 在残酷的战争中让乔乔看到了光 ,4
如果不看简介还真以为是韦斯 安德森的电影 就连选角上山姆 洛克威尔也与山姆 洛克威尔有几分相似 从画风 构图到略带荒诞的剧情都像是另一个 月升王国  很讨巧的是 站在儿童视角看纳粹战争 不再那般沉重和晦涩 ,4
记得去跳舞,5
题材相对讨巧 但是每个演员都完成得超级好 从狂热又不自信的纳粹少年视角来看二战末期的德国 色彩绚丽 让人几乎忘记了儿童也能熟练使用暴力政治语言的违和 虽然有feel good movie之嫌 但还是不负anti hate satire的使命 ,4
以独特的儿童视角的反战题材电影 运用儿童的幻想世界与现实世界之间编织出 美丽 的战争童话 现实世界的幻灭随即也引发精神世界的垮塌 最后迎来不一样的 美丽人生  剧情上完全是被小男孩所吸引 胖胖的小男孩也很可爱  但寡姐的角色却有些单薄 导致很多地方难以施展开来 反而是洛克威尔的角色在结尾处诠释的更好一些 总体三星半 还算不错 ,4
一天无意中看的两部电影 返校和乔乔 都是讲要活着 活着就有希望 对身处当下的我很有意义 2020年02月12日,4
感谢维迪提导演的疯癫 把希特勒再次搬上银幕 我爱斯嘉丽 我爱两个小男孩 Jojo Betzler  ten years old Dangerous outside Extremely  看得不专心 可丝毫不影响能够让我突然笑 突然哭 妈妈被hang的时候哭了 画面也太残酷太美了 Free people dance  小男孩编的分手信 最后欺骗German win  哎 近年看过最好的反战 儿童电影吧 Sam又演gay 什么时候下海 真是死命地性感 让人抓耳挠腮 2019年最后一部 我很满足 改编自Christine Leunens的小说 Caging Skies  想看 阵容   sam lockwell scarlett,5
哪里找的跟寡姐那么像的小男孩 ,4
情人节编写公众号边看完了 等有空看看原著,3
 德意志零年 在后现代语境下脱毒 成了无良杂种 月升王国 角度刁钻但又符合主流趣味 当下好莱坞只有Waititi能搞得定 眼看历史重演 真是笑中带泪,5
塔导真是厉害 不愧各种提名得奖 真没想到二战纳粹这样沉重严肃题材也可以拍得如此美好可爱 清新温情 又略带疯癫神经质 悲伤感人 笑中带泪 即使在那么黑暗的年代 亦有善良人性的闪光 就算隐藏在墙壁阁楼间 也有值得守护的光芒  天真容易被洗脑的孩童视角很独特 男主小演员真是颜值演技俱佳 好基友小胖子真是太可爱太抢戏了好么  斯佳丽和洛克威尔也都有高光时刻的精彩表演 ,5
疫情以来第一次进电影院 不是电影需要我们 是我们需要电影  自由以后先跳个舞吧  ,5
JOJO的奇妙世界 从儿童视角出发看待战争挺好的 拍得也还不错 但我get不到笑点 原本期待值很高 看完还是觉得略失望了 ,3
导演本人演了想象的希特勒 轻松恶搞的二战尾声不是很接受 ,3
儿童视角的纳粹电影 片中斯嘉丽的母亲负责传达爱 是一个反抗者 但力度不够  爱 用 系鞋带 这个意向展现  关于希特勒的幻想很鸡肋 包括小男孩与元首在幻想中的决裂处立的也很草率 整个故事也没有太大的矛盾冲突 只是通过母亲的死 德国突然战败来做转折 按照我的经验来看 喜剧化就根本不适合表现战争片 这样的讽刺大多流于表层 根本没法承载历史的沉重感 印象中 鬼子来了 是个例外 ,3
