comments,star
3 5可能是年纪大了吃不动这种儿童奶糖了 太腻人了 强烈感觉是在模仿威斯安德森 但安德森的童话是成人世界送给旧日童真的礼物 它充满了看似无可奈何的勇气和激情 是我们无望生命中最后的奋力一搏 童话是黑色的才更动人 但这部电影既没有拍成一部儿童电影又没有把黑色进行到底 反而显得有些头重脚轻 纳粹成了十足的弱智 本来想追求 美丽人生 的感动 但矫揉造作的剧情还是把历史当成了游戏 其最终落脚点 爱 更是非常主流与俗套 为了强行主旋律 我们完全看不到乔乔如此固执的纳粹信仰理想化消失的转变 而是靠煽情和突兀的转折来弥补 在地狱中构建童话本来就是件危险的事 果然这部电影最终沦为了幼稚的想当然的失望作品,3
Awwwwwwwwww  周周真是让人一见倾心的小男孩 Scarlett Johanson的声音真像Rashida Jones       ,4
孩童视角 错位隐喻 电影在色彩上颇有韦斯 安德森的味道 有那么几幕让人直接想起 月升王国 来 前半段色彩明丽 耀眼 夺目 后面是冷峻 阴郁的冷色系为主 色彩上的进阶与情感上的对冲 折射出一个孩童的心理长成过程 纳粹的冰冷外壳包裹着的是孩童口吻式的戏谑与解构 战争没有被异化 只是承载它的心灵过于幼小 单薄 电影对于纳粹德国的反讽与肢解通过孩童视角收获了放大的效果 升华主题的是爱与关怀 是成长 三次系鞋带的细节铺得不错 难得的是主观视角 而非外力 战争 催生成长 这是一种高级的觉悟 ,3
澳门iffam 韦斯安德森的美术风格 清洁版拜伦科恩式的笑点 或许我们从未在一个儿童狂热分子的视角去解读这场被对立者 胜利者 正义者定义的战争 如此我们发现 真实的生离死别带来的恐惧 才是反战的根源 ,3
小胖子朋友从来也不懂这个世界发生了什么 他傻乎乎的穿着纸质的衣服拿着洋枪大炮 最后面对废墟 想要的是妈妈的拥抱 他也从不质疑乔乔的犹太女友 他可真单纯浪漫啊 ,5
塔伊加 维迪提真的是个自作聪明的小丑 能不能带着你蹩脚的幽默滚回漫威 小大人们用佯装的德式口音英语念着好莱坞流水线化的对白 从这样扭曲怪异的视角切入历史题材让我格外反胃 文本这么贫瘠风格这么直楞居然可以提名奥斯卡最佳影片 对nazi的诡异描绘到底是怎么想的 对历史的轻佻 对苦难的轻描淡写 对历史与当下的避而不谈 对一切都迪士尼化真的感觉好莱坞快tm完蛋了 艹 ,1
一个小孩在真实世界里突破洗脑教育的故事 很多孤独小孩都有假想小伙伴 乔乔的是希特勒 想跟 德意志零年 配合看看 山姆演的教官 可能是个同性恋 强势语境下 弱者是一体的 惺惺相惜,4
Jo Jo的小伙伴小胖子真是萌化了 ,4
争议命题下剑走偏锋 仿佛有一百条理由感到冒犯 但又能有一百个解释心平静气 改编这个故事 又亲自上马出演希特勒 Taika Waititi十分有种 到最后 Jojo的异想旅程仿佛对标 美丽人生 里Guido给Giosuè精心布置的大型 游戏  也在轻松欢笑之间 让观众服下那剂最苦涩的药 对准历史上的黑暗一节 演 Yorki 的小朋友太可爱了 灵灵灵 ,4
童趣化的儿童视角切入二战不容易 复古童话的色彩很美好 第二幕稍显模糊 山姆摇得好的善良化在桥段设计上略古旧 但斯嘉丽可以说是全然逆转版的 美丽人生   与犹太父亲相对的德国母亲视角 那特殊年代最棒的妈妈 在铁蹄面前 清醒勇敢是多么奢侈啊 ,4
果然还是高估导演的才华了 美学上离韦斯安德森还差许多条街 几个关键的情感转折点的处理无甚亮点 尤其是结尾男主角感受到战争真实的残酷那组镜头  当然 它的娱乐性和对观众友好程度都非常的高 多伦多第一可以理解 还有 寡姐的角色太牵动人心了 这个完全可以提女配啊 还有男主小正太 啊他真的太会演了 太可爱了,3
观感非常地流畅 喜剧氛围不显别扭 现实批判不囿于严肃和感伤 维迪提处理这样童话质感的片子俨然驾轻就熟 在二战题材的电影创作早已陷入僵局的当下  乔乔兔 以同于 再见列宁 的叙事构建模式创造了一次崭新的 民众记忆  消解了其电影观点上本质的庸俗 倒也不失为一次对纳粹德国的有趣观察    ,3
前半部分特别韦斯安德森 和妈妈骑车回家那段太美好了 可从追蝴蝶到看到妈妈鞋子的时候开始 温柔的镜头开始变得沉重起来 越到后面 越是赤裸的世界 就越是击打得猛烈 但愿世界如抱着兔子的那个Jojo眼中的一样吧 真实丑陋却又温暖善良 ,5
请Waititi不要消费小孩 并立刻去死 故意忽略历史背景和当时环境到底怎么触发小孩子信仰那个人 小孩子幻想美化算了 但后面的自省就是表面的不信任而已 而未对那个人产生真正的敌对 仇视 仅仅用这样和解和寻找到爱情来化解童年伤痕 简直是让我作呕 ,1
虚伪又浮夸的一部电影 ,3
兔哪有清醒的这么快 ,4
戏谑与凝重的分寸拿捏得相当巧妙 情绪复杂但表达得顺畅自然 台词也好 最出彩的角色应该是那个小胖子 ,5
在孩子的视角下 战争带上了温柔的残忍 ,5
后半段超出了预期 有很多很感动的段落 妈妈的死 攻克柏林 洛克威尔牺牲 都很好看 唯一的问题是这假想希特勒对剧情推进度几乎为零 沦为塔伊加秀自己表演的工具 洛克威尔算找着自己戏路了 这种有点痞但是心肠好的角色太合适他了 ,5
剧照和预告片较好,3
好看好看好看 sam和席恩那对过于可爱 不穿成整条街最靓的纳粹不配做基佬  人物都可爱可爱 虽然塔导是对家也不得不承认这个人真的好玩 一边D区一边笑  ,5
黑色幽默 兒童視角 儘量簡化 輕松化乃至在一定程度上美化了二戰現實 但幸好真實自有千鈞之力 ,4
汤包开始演妈了    ,4
7 10 想当年卓别林的 大独裁者  用喜剧层层剖析了法西斯的无情和对人性的异化  乔乔 的喜剧形式却彻底粉饰了真相的残酷 幻想的希特勒没有了冷血 带着呆萌的形象陪着乔乔练习演讲 抢过训练的手榴弹和吃着独角兽大餐 纳粹更被温情和幼稚的外衣包裹 街道上的炮火变成了童子军的游乐项目 青年团兴奋着持着弹药冲向前方 单纯的队长穿戴马戏团式的古代战袍 善意地让乔乔免于集体枪毙 放在椅子上写着解放德国的反抗军纸条 绞刑架上悬空的红鞋这些残酷的真相 都被征集锅碗 形似消防栓的儿童玩具服和蓝色蝴蝶的童真元素所消解 摄影机甚至缺乏勇气地停留在下半身 拒绝展示母亲那张死亡的面孔 而乔乔和艾尔莎比赛说出各自血统的杰出人物 遥望着星辰中远方的轰炸 仿佛所有浩劫都抹去了真实 只剩下结尾亚当和夏娃推开房门迎接新德国的自由天地 ,3
其实还是不够有力 但是我现在温和了 我要温柔打分,4
当网络让人听到更多的声音 人们终于意识到曾经听到的 并不是 全部  意识形态给我们的信息立了墙  导演在这部新纳粹相关片里突出了这一点 Scarlett Johansson贡献出几段令人印象深刻的表演 比如丈夫上身那段 Sam Rockwell 也特棒 他最近几部片简直像开了挂似的 整部片子因为太过cute 削弱了主题 movie connection  美丽人生 ,4
说一句JO厨梗 这代乔乔生在二战时期的德国 替身是 希特勒   回归正题 影片棒在角度选取的巧妙 通过德国小男孩乔乔的主观视角去解构二战德军法西斯的行径 带着孩童般的滑稽可爱 赋予故事的多面性  导演亲自上阵演起了乔乔脑海中臆想出来的 元首 希特勒 这种带着动画片般想象的呈现方式增加了影片奇幻色彩 效果立竿见影 而二者间的关系变化 从 崇拜 到 质疑 到 高喊滚出去  其实就是二战德军宣战到失败的缩影  斯嘉丽诠释的乔乔妈妈很有魅力 尽自己所能守护着乔乔的心灵 收留犹太女孩倡导和平 实力圈粉  现实的战争如果可以像两个孩子打闹后就能握手和解该多美好 ,4
从 美丽人生 开始就很恶心给战时抹糖衣的手法 这部也不例外 就算喜剧部分也是美式的聒噪 本来还指望看到一些德国风味的 结果一堆美国演员连最基本的德式口音都做不好 尤其是演幻想中希特勒那位  战时两个不同种族的少男少女的纯情之爱也是陈词滥调了 唯有几处细节还能打动人心 ,3
某些过高的口碑还是有太多情感因素  包括小孩子的天然萌和想象中元首的蠢萌 主题比较教育化  当周遭世界与自己想象 被教育 大相径庭时 应该不抱成见得去寻找自己的答案 ,4
小男孩很可爱 当悲伤被快乐包裹 只有幸福的人才能动容 ,3
应该有两处会有掌声 小男主一脚把希特勒踹出窗户时 结尾热烈的摇滚乐响起两个小朋友开始跳舞的时候 女秘书让小男主去发的传单就是历史上希特勒用过并被记录进艺术史的传单 这片成为最早定档引进国内的奥斯卡提名是因为里面提到了中国么 希望斯嘉丽这届至少能拿个女配 妈妈演的真心不错 ,4
Helden 再一次在电影中听到这首 Let everything happen to you  Beauty and terror  Just keep going  No feeling is final    Rainer Maria Rilke,4
不完美但很灵 儿童视角选的很机灵 但可惜没能一以贯之 好几处转折 比如每次和姐姐的对话 觉得就差那么一点点就表达得很完备了   另外 小伙子太会演戏了 这片子能这么自然和他的表演密不可分 ,4
看得到很多致敬To Be or Not to Be的痕迹 故事核心有些许单薄 时代感有点迷 但是表现形式和导演趣味都很加分 作为用喜剧包装战争悲剧的电影其实比 美丽人生 高级很多 但是 说实话 对影片想要表达的东西确实非常不感冒 所以 全程都看不进去 ,3
获奖季目前为止最喜欢的三部之一 导演 编剧是聪明通透的人 懂得真正的儿童视角来看战争看灾难 我想起的参照物倒不是 美丽人生 而是 特别响非常近  ,4
的确某些时刻会想到一些二战题材 童子军题材电影 但仔细想想这是完全不同的儿童视角 乔乔激进又善良 处于一种不稳定的情绪 对一切充满着疑虑 这是10岁小孩的真实写照 将这样的孩子扔进战场中 他们就会像兔子一样慌乱 虽然是童话写法 但形式高度统一 反讽讥笑之余充满感动 很想看到也真的很合适拍这片的中国版 剧情都可以完全照搬 ,4
本来对战争片一点都不感冒 但是从十岁男孩这个视角太棒了 对希特勒的狂热崇拜和疯狂的洗脑教育 仇恨犹太人的教育 从上帝视角看是多么的可怕 还好有他妈妈 还有Elsa 教会他什么是爱 战争结束之后还可以在阳光下随心跳舞 Let everything happen to you  Beauty and terror  Just keep going  No feeling is final  ,5
开句玩笑 纳粹绘本化 跟给疫情医院的拖拉机打榜有什么区别 小男孩也从头到尾没心没肺的 ,3
也就鞋带这一处设计到位了吧,2
小朋友很可爱 但总觉得这样讲述用力过猛了些 或许是因为我总觉得孩子其实更复杂得多 ,3
妙趣横生 荒唐不经 天马行空 聚焦战争 亲情 朦胧的爱 偶像崇拜等各种话题 小男孩最初不知道世界的残酷 一昧想要加入少年党卫军 无知无畏 得知了世界的真相后  你可以随波逐流 假装什么都没发生 也可以逆流而上 与世界的黑暗抗争到底 ,4
没想到这片子争议这么大 导演半犹太人半土著人的身份都挡不过 但其实我看完感觉片子的核心是妈妈和儿子的关系 如何给一根筋的纳粹儿子一个温暖的家 无法引导却依旧可以爱他 还有她对阁楼里的女孩说 你活着的每一天都是我们的胜利  斯佳丽约翰逊这个角色太有层次了 导演也讲过某种角度上这是一个献给单亲妈妈的电影  I ll just chew on those grapes  年度幽默可爱瞬间  但整体比野蛮人差了好几档 有点回到吸血鬼那部的为了笑点no pathos了 这样反倒不好笑了 而且可以不要韦斯安德森么      Alfie Allen在这部里还挺帅的   ,4
塔伊加维迪提拍的雷神是烂片 而这不是他的错 离开了倒霉催的mcu 任何人都能成神 除了罗素兄弟  这个世界真的好歹毒 在你是孩子的时候骗你去相信所有的一切都是美好的童话 又在你猝不及防的时候扒开外衣给你看里面的黑色幽默 关于战争和纳粹的笑话都是常见的幽默 但是你越往后越是笑不出来 因为这些笑话太残酷了 所幸 人性之中无理由无目的的善良总是让我们相信希望 一个纳粹党也可以扮演天使的角色  另 Stephen Merchant可能是最被低估的英国演员之一吧 ,5
I wonder how taiki s bedrooms always look like my dream bedroom ,5
其实为了看寡姐时装秀 电影7 5分 故事单纯 温暖人心    氮素  氮素 最具反战情怀的非摇滚乐莫属 片中各种熟悉旋律反复刺激泪点 当片尾曲第一个音符响起 我就知道这片要无脑冲上10分了  God My David Bowie    ,5
无论是作为导演还是演员来说 Waititi真心有才 他对世界的感知很灵敏 又足够洒脱 另类 直觉之中自带老派导演们缺乏的 解构 视角 从这个角度看 他能在最近几年崛起 完全是天时地利人和推动下的必然 一点儿不意外 PS 如果没有Thor  Ragnarok 他绝对是我最叹服的导演之一 没错 锤的这个坎儿我过不去 过 不 去 ,4
同是少年的异想世界 但相比 追捕野蛮人 而言 乔乔兔 更加夸张与讽刺 前者是纯粹的火焰充满希望与热情 后者则是通透的海水看似明亮实则冰冷刺骨  乔乔兔 在一个天真可爱的孩童世界里 举重若轻地讨论着杀戮等话题 看似轻描淡写实则细思极恐 ,4
听片名还以为是和 月升王国 一样的儿童冒险喜剧 没想到呈现的主题和表现形式这么残酷 兔子与蝴蝶的意象 类似人眼监视的楼房窗户 踹飞希特勒幻象 纵情跳舞的反战诉求 终于会系鞋带的成长洗礼 构图技巧和镜头感皆为上乘 剧作层次也很丰富 是部值得深挖的好片 ,4
 There s always time for romance   最后Heroes的前奏出来我的妈呀我的眼泪不要钱 ,5
Scarlett Johansson的口音够烂 导演自己的戏应该换到Sam Rockwell身上 题材上倒显得过于温和 有点四不像 整体比预期好看,4
像极了双眼的窗户那个镜头非常不错 但其实真的过誉的相当严重 思想上转变的过程太少太少了 女主角演技很尬 唯一一部得奖概率为零的奥斯卡提名影片了吧,3
里面的希特勒傻傻呆呆 但他只是少年乔乔的异想想象而已 就如同az哥哥一样 当它在现实中露出狰狞时 一切幻想都被打个粉碎,4
超越了一般的儿童片 喜剧片 战争片甚至是剧情片的界限 把最残忍的故事用最美好的方式表现出来 是鬼才导演塔伊加 维迪提能够做到最温柔的一件事情 而继雅各布小弟弟之后 影坛内又多了一位拥有影帝级别演技的小演员 他叫罗曼 格里芬 戴维斯 ,4
明亮而温暖 少年JoJo是嘴巴老但人怂包 是更适合扑腾翩飞蝴蝶的兔子而不是手握尖刀捅刺的猎人 看着他的转变就像原谅一个淘气又善良的孩子 如片中流行音乐奇妙的嫁接  剥离了现实的沉重 在轻松乖离中完成一次救赎 ,4
3 5 DVD流出版 视角选的很好 以狂热的小孩子的视点看待战乱的时代 拍的很可爱 无论是手法还是内容 也有紧张的时刻 但是流于形式化 流水线化 所以不觉得多优秀 最让人意想不到是前面一些铺垫 没想到突然在后面出来了 虽然是一个泪点 但是没有击中我 反而山姆的角色更加可爱让人喜爱 结尾实在是太可爱了 ,4
看到教官居然是gay就猜到这个角色是正面人物了     什么时候能够自由地让基佬再次做反派 或正派 或无所谓正反派的时候才是平权吧 最抢戏的是小胖子 ,3
别样视角展现二战时期德国儿童的生活与内心世界 充满爱和温情的故事 关注的还是本应该属于孩子的童真 就像JoJo妈妈说的那样  你成长的太快了 不像个10岁的孩子 这个年纪不应该庆祝战争 讨论政治 你这个年纪应该在爬树 然后不小心从树上掉下来才对  战争毁掉了孩子们纯真的童年 不过还好的是全片对战争残酷的描绘只在结尾出现 而且并不血腥 那场战争有多残忍众所周知 本片没有去故意渲染残酷战争是明智的 细节里还是能感受到紧张 冰冷和无情的战争氛围 但是从那些温柔里体现出的人的善良内心才是最重要的 斯嘉丽演绎的妈妈很棒啊 希望她能在2020年奥斯卡拿最佳女配角奖 洛克威尔演的也不错 ,5
❶即使结合电影版  囚禁天空 依旧是贴合的名称 ❷选角精准 乔乔神似寡姐  ❸一段最终超越年龄 无视战争 政治的友谊 没有大起大落 也没有积蓄能量 而是一股暖流注入 直到片尾突然察觉它已流经全身  ❹不过 可能是怪才塔导最接近三界五行的一部剧情长片 我最多的笑声依旧留在 追捕野蛮人    ❺ 与狗性交 不是 与狗睡觉  ,3
从披头士的声音一出来就喜欢上了这部片子 到大卫 鲍伊结束时整个人已经完全沉浸在影片的情绪里 也太好了吧 好到不知道该怎么写短评 前面所有的笑和美好都在为成长之痛铺路 当泪点突然来袭的时候已经痛到哭不出来 守护孩子的天真是严酷时代里一个母亲最后的温柔   4th IFFAM 开幕影片 澳门文化中心,5
很有特点 喜欢 ,4
儿童与想象的希特勒并存 成为共生的一体两面 进而揭露法西斯主义对儿童的残害 个体在时代中的命运往往是没有选择可言 妈妈的鞋在泳池边和绞架下的特写让人印象深刻 ,3
期望越大 失望越大 人物没有说服力 很多设定看得人难受 强制煽情 没有意思 ,2
我好喜欢这部电影 奇趣的儿童片设定 幽默治愈可爱 内核则是反战和学会打破固有思维看待世界 二战期间 德国男孩乔乔是一个法西斯狂热分子 他渴望加入希特勒青年团 以自己是雅利安人的血统而自豪 可同时他也是一个善良纯真的小孩 某天发现了妈妈藏匿在家中的犹太人女孩 乔乔的世界 与真实的世界产生碰撞 到后来渐渐重叠 电影里系鞋带的片段印象深刻 起初妈妈帮乔乔系好鞋带 后来妈妈故意把两个鞋带系在一起的恶作剧隐喻不自己学会成长是会摔跤的 再下次镜头给到乔乔自己系鞋带 到最后他给犹太女孩系鞋带 这就是成长 汤包演的母亲一角简直就是我的理想型 善良 聪明 有趣 独立 漂亮 坚强 勇敢  完美的不像样 ,5
 元首哥哥是我的精神指引   现在来看自然有一个观众心里都明白的前提和角度 所以可以不断加入现代元素 喜剧元素 但真正处于类似环境里的人该怎么办呢 ,4
有一点点让人想起韦斯安德森 尽管色调并不那么炫目 镜头也不那么对称 把孩子放在战争背景下的故事太多 让这个孩子一开始作为 反派 登场倒很稀有 有时觉得这种设定稍显刻意 好在整个故事即使在最黑暗的时刻也保持住从容 没有崩掉 喜欢里面跳舞的承诺  你这个年龄本该去爬树 然后摔下来  ,4
非常有趣 很有观赏性的反战影片 最后还有点 美丽人生 的味道 ,4
好可惜哦 很多地方拍的并不好 但是9部奥提里 最喜欢的一部 喜欢小胖子Yorki的每一场戏 嘻嘻 ,5
影院重温 喜剧外壳 悲剧内核 孩童视角 屡见不鲜 些许反思 浅尝辄止 奇思妙想是有 但相比之下 与韦斯 安德森那一类作品依然有着一道难以逾越的鸿沟 ,3
有几个亮点时刻 1 鞋子 jojo给妈妈系鞋带又系不好的细节太好了 这组镜头让人郁闷得无法释怀 效果相当于 无间道 里黄sir坠楼或 再见萤火虫 里妈妈被烧毁的脸 2 山姆洛克威尔的小天使 3 能把盖世太保戏拍得那么紧张又搞笑 让人不得不爱 ,4
真的有点 美丽人生 的味道 以小孩独特的视角来反应战争的残酷无情 外加一点点奇幻色彩  乔乔处在纳粹阵营中 参加童子军 从小被洗脑 但毕竟又是小孩 还保留了那份童真善良 乔乔脑中所想出来的希特勒这一形象 在片中也十分有趣  全片整体基调欢快轻松 幽默中且还有温情 用恶搞荒诞的方式打开了一个本该沉重严肃的题材 让人在笑着笑着就会失落伤感起来  最终他不再有偏见 揭开了谎言 不再追随纳粹 战争结束了 他也长大了 也学会系鞋带了 也选择跳起自由之舞了 ,4
说实话 我看够了以美国人自大的视角去讲述其他民族的假大空故事了 ,2
爆點密集 笑點奇特的兒童視角下納粹意識形態的控制與反抗 ,4
就是因为他是一个十岁的孩子 不懂战争的残酷 在他的眼里才看起来离奇又荒诞 幸运的是 他有一个够酷的妈妈 教会他面对世界的一切真实 包括丑恶与美好 ,4
看到Waititi的少年故事回归真好 如此cliche的题材被他拍得如此兴味盎然 活力满满 把喜剧与纳粹的悲剧巧妙贴合 也能感到对当下的反思 我很感动 创造力在主流电影中也是可以存在的绝佳例证 里尔克的诗made my day 鼓舞当下的我们 Let everything happen to you  beauty and terror  Just keep going  No feeling is final  ,5
三星半吧 这么取巧的一个剧本 拍得太轻飘飘了  ,3
山姆大叔和Theon饰演的那两个军官 是比较明显的性少数 大约相当于男同性恋与变装 主要识别特征是两人的暧昧互动 Theon体态上明显的女性化 以及最后两人冲锋时的造型妆容 考虑到纳粹对同性恋者的迫害 粉色倒三角  山姆对两个孩子的帮助就更顺理成章了 2020 01 12  百老汇电影中心,4
对小朋友洗脑和觉醒演绎得直观活泼 虽过于简单 但暖系色调 动漫化人物和奇幻剧情很适合帮助孩子去理解那个不可思议的扭曲时代 感受白色恐怖下的那些未泯灭的人性 导演饰演的幻想中的朋友希特勒是神来之笔 长相颇似吴秀波和反光镜主唱的混合体 脱线得极具喜感 ,4
和韦斯安德森的风格同一个毛病 有部分佳句 却缺乏整体上的逻辑 看似想有深刻的寓意 实则靠的是一个个煽情性场面营造来拼起一种同情情绪 用借英美流行文化符号风格来包装纳粹精神的手法效果也有待商榷 最终也就是一个画面调色党 ,3
非同尋常的黑色幽默電影 Taika Waititi將那段黑暗沉重的歷史以喜劇的形式展現出來 但同時仍可以毫不保留地抨擊極端政治思想對公眾的毒害 Jojo Rabbit的成長和自我認知讓我們看到偏見和歧視是可以通過心於心的對話化解的 Scarlett Jo的表演非常出彩 使她的故事線尤其沉重 當一切似乎化為烏有之時 仍然相信希望 Let everything happen to you  Beauty and terror  Just keep going  No feeling is final  ,5
我要向Taika Waititi道歉 尽管我非常不喜欢他的 雷神3  但现在想来更多是漫威强行扭转 雷神 电影系列基调的锅 其实是掩盖不住导演的才气的 这一点在这部电影里更加明显了 真的是要感叹导演脑子里的奇思妙想 这哪里是 少年乔乔的异想世界  这分明是 Taika Waititi的异想世界  从孩子视角看纳粹 满是童趣 满是笑点 整个片子都始终是暖色调 但正当观众们沉浸其中时 全片唯一的冷色调构图就猝不及防给了观众迎面一击 然后结尾山姆大叔又给来了点儿催泪瓦斯 实在是温柔又奇妙的观影体验 ,5
远不及 美丽人生  倒是构图色调和艺术品味让我想起 月升王国  ,3
并没有一味地讽刺纳粹希特勒 更多地是借助孩子的视角重新反思战争 以一种独特的方式呈现了国家机器是如何给民众洗脑催眠 历史在重演 历史要警醒 莫欺少年 ,4
好久没哭成傻逼了 笑中带泪 Sam Rockwell永远都是我的小天使qwq 最后用的还是德语版heroes 你宝这首歌对两德时期真的太有意义了 塔导太棒了 可惜当时鸽了朋友没去澳门看 疫情过去必须要改档上   ,5
其实本质上我不喜欢儿童残酷语言从潘神迷宫开始就有点反感  可乔乔太干净了 干净的加重了很多东西 举重若轻 中二拯救世界  而且现在美丽人生上映 可以对照着看 多有意思 ,5
好莱坞犹太高层又一次对全世界的洗脑 ,2
已經想不起來上一部她演的討喜角色 看完Jojo Rabbit讓人重新愛上史嘉蕾  elsa和jojo太可愛了,5
又美又感人 服裝也太亮了吧 台詞也太厲害了吧,5
全片都洋溢着T导招牌的诡异笑点 寡姐优雅又迷人 山姆痞气又可爱 人性的赞歌在不经意间就戳中了泪点 有点韦斯安德森 有点昆汀 但更多的还是T导本身  最好的喜剧就是把美好的东西撕碎给人看 但值得留恋的 永远都不会消逝,5
